b32f4f9f-10d9-4ce6-961a-db5d4dba6bb2,"The Sims™ 3 Dragon Valley","Kaukaisen  laakson suojissa lepää myyttinen kaupunki suoraan muinaisista  tarinoista. Dragon Valleyyn suuntaavia matkaajia odottaa kukkuloiden  ympäröimä kylä rauhallisesti virtaavan joen varrella täynnä fantastista,  korkeuksiin kohoavaa arkkitehtuuria. Tässä maailmassa elävät värikkäät,  vuosisataisia perinteitä kunnioittavat haltiasimit, ja  lohikäärmeenpentuja pidetään jopa lemmikkeinä.• *Upouusi peliesine* lohikäärmeet  – Kaikki rakastavat lohikäärmeenpentuja! Haudo munista erilaisia  lohikäärmeitä, joista jokaisella on oma luonteensa, mielialaetunsa ja  hassutuksensa! • Uusi maailma odottaa – tapaa uusia simejä, tutustu uusiin paikkoihin ja koe Dragon Valleyn myyttinen maailma.• Ainutlaatuisia uutuusesineitä – tusinoittain uusia esineitä ja asuja, jotka saat vain Dragon valleyn mukana.• The Sims 2 -pelistä tuttu klassikkoperhe  – tapaa vastakihlautuneet Jennifer Pleasant ja John Burb maailmanmatkallaan ennen suurta päivää!"
67c1ad22-7094-495f-8d0a-dee1f18e219f,"The Sims™ 3 Baana auki Kamasetti","Iske talla pohjaan ja vie simisi kruisailemaan The Sims™ 3 Baana auki Kamasetin upealla autoilla. Ensimmäistä kertaa kamasettiin kuuluu nyt ajoneuvoja, huonekaluja, sisustusesineitä, kampauksia sekä koristeita. Mukana on neljä eri teemaa, joiden tavaroista ja kulkuneuvoista simisi pääsevät nauttimaan. Onko simisi päätähuimaavien nopeuksien perään vai pitääkö hän hitaammasta ja arvokkaammasta menosta vanhanajan autoklassikoilla? Ovatko simisi nuoria kapinallisia nahkatakeissaan ja kellohameissaan vai viettävätkö he jännittävää elämää vakoilumaailman eksoottisten asujen ja autojen parissa? Viime kädessä siitä kaikesta päätät sinä. Olipa valittu elämäntyyli mikä hyvänsä, The Sims™ 3 Baana auki Kamasetti tuo simiesi elämään yllin kyllin vauhtia ja vipinää!Ominaisuudet:• Upeita ajopelejä. Näistä hyrysysyistä ja niiden edustamasta vauhdikkaasta elämästä simisi ovat aina haaveilleet.• Neljä uutta teemaa asuineen, huonekaluineen ja ajoneuvoineen. Nyt liikutaan kilpa-autoilun, vakoilun, rockabilly ja Art deco -henkisen luksuksen parissa.• Rakenna simisi armaalle kilpa-autolle tai hot rod -hyrrälle sen arvoinen mahtitalli.• Sisusta simiesi kodit uusien luksuskaarojen tasoisilla huippukalusteilla. "
1587ff08-96b2-4a51-a22a-ad924b6f21c7,"The Sims™ 3 Täyttä Elämää","Nauti elämänkaaren koko kirjosta! Aloita lapsuuden mielikuvitusleikeistä ja siirry teini-iän draamantäytteisiin vuosiin. Koe aikuiselon m• onimutkaiset kuviot oikeuksineen ja vastuineen ennen kuin pääset nauttimaan vanhuusvuosien leppoisuudesta. Uudet tehtävät ja Ominaisuudet: varmistavat, että koet nyt parhaat puolet kustakin elämänvaiheesta. Elämä on nyt entistä mielekkäämpää iästä riippumatta. The Sims™ 3 Täyttä Elämää -lisäosan uudenlaiset juhlat, dramaattiset elämäntapahtumat ja entistäkin monipuolisemmat tavat ilmaista luovuutta takaavat, että saat jokaisesta ikäkaudesta kaiken irti! Ominaisuudet: • Kaikenikäiset simit pääsevät nyt nauttimaan uusista puuhista! Lapset kehittelevät hurjia seikkailuja puumajassa, teinit keksivät ilkikurisia kepposia ja aikuiset kokevat järisyttäviä keski-iän kriisejä. Ja tämä on vasta alkua!• Uudenlaiset juhlat ovat kaikenikäisten simien mieleen! Teinit revittelevät kotibileissä, opiskelijat juhlivat valmistumistaan pitkän kaavan mukaan ja hääparit pistävät tuulemaan viettäessään juhlista jalointa!• Luvassa on rutkasti draamaa, kun huhut villeistä polttareista ja pettävistä puolisoista kiertävät naapurustossa. Simien hulvaton meno tietää loputtomasti hupia!• Simit nauttivat uusista luovuuden muodoista kemistisetin äärellä puuhaillessaan ja kotivideoita kuvatessaan ja niitä telkkarista katsellessaan. Lapset taas eivät meinaa pysyä nahoissaan, kun leikkeihin astuvat astronautit, dinosaurukset, prinsessat ja monet muut hahmot.Uusia tehtäviä, juhlia ja dramaattisia hetkiä on nyt helppo muistella ja jakaa Facebookissa ja omilla sivuilla The Sims™ 3 -yhteisössä. Uusi muistojärjestelmä pitää lukua elämän suurista hetkistä ja tekee niiden jakamisesta helpompaa kuin koskaan!"
45c85077-eb46-404c-993d-a3fcc2b871ae,"The Sims™ 3 Hidden Springs","Julkkikset ja rikkaat tungeksivat Hidden Springsiin rentoutuakseen ja päästäkseen pois oravanpyörästä. Monia heistä kutkuttavat huhut alueen metsien ja vesien ihmeellisistä parantavista voimista. Seudun asukkaat ovat aiheesta melko vaitonaisia ja joidenkin mielestä jopa salailevia. Lisäksi heidän ihonvärinsä vaikuttaa hieman hailakan vihreältä. Voiko se olla todellakin seurausta jostakin maagisesta? (* Pelaaminen edellyttää The Sims 3 -peliä) Ominaisuudet:• Kokonainen uusi maailma odottaa - Tapaa uusia simejä, tutki uusia paikkoja ja paljasta Hidden Springsin taianomaiset salaisuudet nyt! •  Antaudu taian lumoihin - Hidden Springsin taianomaiset Ominaisuudet: ovat kiehtoneet simejä kautta aikain. Tutki uutta maailmaa, niin saatat kenties löytää vaikkapa nuoruuden lähteen. Tuleeko sinun simistäsi ikuisesti nuori?•  Tutki uusia paikkoja - Hidden Springs on täynnä uusia sijainteja, tontteja ja toimintapaikkoja. Minne seikkailusi vie sinut?xa0xa0xa0• Seurustele yläluokan edustajien kanssa ylellisessä Redwood Heights Luxury Lodgessa.xa0xa0xa0• Koe todellinen tasapaino ja hyvinvointi nauttiessasi Crystal Solarium Rejuvenating Watersin ylellisestä tunnelmasta.xa0xa0xa0• Voit myös pitää hauskaa Fairyfolk Park -puistossa. Vain mielikuvituksesi on rajana. xa0xa0xa0• Silver Zephyr Health Spa -kylpylässä voit itse kokea terveyden- ja kauneudenhoidon maailmankuulut tekniikat.•  Ainutlaatuisia uusia esineitä - Mukauta peliäsi kymmenillä uusilla ainutlaatuisilla esineillä, vaatteilla ja kampauksilla, jotka ovat saatavilla ainoastaan Hidden Springsissä.•  Uusia simejä ja tarinoita - Ylellinen retriitti rikkaille ja kuuluisille? Vaiko kenties salattu maailma outoine parantavine voimineen? Olipa vastaus mikä hyvänsä, varmaa on ainakin se, että Hidden Springsissä tapaamillasi simeillä on omat salaperäiset tarinansa."
9329fbe9-d0c2-4fb7-a027-f12bfa73242b,"The Sims™ 3 Luksuslukaali Kamasetti","Muuta simiesi koti virtaviivaiseksi ja moderniksi loft-asunnoksi The Sims™ 3 Luksuslukaali Kamasetillä. Kosolti kalusteita kodin suosituimpiin huoneisiin! Luvassa muuan muassa silmiä hivelevää elektroniikkaa kotitoimistoon, uudenuutukainen pelikonsoli harrastehuoneeseen ja moderneja kalusteita olohuoneeseen. Nyt simisi voivat tuoda kotinsa kertaheitolla nykyaikaan. Kun koti on ajan hermolla, on syytä uudistaa myös asukkaan vaatevarasto tyylikkäillä muotivaatteilla. Oli tyylipäivityksen tarpeessa sitten simin koti tai sim itse, The Sims™ 3 Luksuslukaali Kamasetti päivittää sen kerralla nykyaikaan!Ominaisuudet:• Virtaviivaista ja modernin teknologian innoittamaa ilmettä simiesi makuu- ja olohuoneisiin, toimistoihin ja patiolle.• Muuta simiesi koti ultramoderniksi tilaksi nykyaikaisilla sohvilla, sulavalinjaisilla sohvapöydillä ja eklektisellä taiteella.• Helli simejä viihde-elektroniikan viimeisimmillä keksinnöillä, kuten superlitteillä televisioilla, uusimmilla pelikonsoleilla ja muhkeilla stereoilla. • Päivitä simien vaatevarasto muodikkailla vaatteilla, mittatilauspuvuilla ja päheillä päällysvaatteilla. • Lisänä suosikkiesineitä! Erityisenä 10-vuotislahjana tämä kamasetti sisältää kolme klassikkoesinettä The Sims™- ja The Sims™ 2 -peleistä. Verestä muistoja vibromaattisella sydänsängyllä, sähkökitaralla ja akvaariolla. "
453d0ab0-d597-42ba-809f-c82fe7022cc4,"The Sims™ 3 Tulevaisuuteen","Nyt simeilläsi on upouusi temmellyskenttä. Hypätkää aikaportin läpi, nyt lähdetään tulevaisuuteen!

Satojen vuosien päässä tulevaisuudessa sijaitseva laaja maailma on täynnä uusia elämyksiä koettavaksi ja huikeaa teknologiaa löydettäväksi. Haluatko simiesi kiitävän tuulenhalkojalla tai rakettirepulla vai haluatko heidän kulkevan kaupungilla putkihisseillä ja yksiraiteisilla levitaatioradoilla? Ei hätää. Tulevaisuus on nyt. 

Mutta tämä aikajana ei ole varma. Saat halutessasi siirtyä tulevaisuudesta takaisin nykyaikaan. Näe itse, kuinka simiesi toiminta vaikuttaa vuosisatojen päässä odottavaan maailmaan. Yksi pieni valinta saattaa johtaa koko maailmaa uhkaavaan meteoriittisateeseen. Mihin utopiasi oikein katosi?

TÄRKEIMMÄT OMINAISUUDET  
- On tulevaisuus: Kaikki kaukaisen tulevaisuuden mukavuudet ovat simiesi käytettävissä. Tuulenhalkojat. Rakettireput. Lentävät autot. Uusi muoti sekä asuinmahdollisuudet. Kehitä simiesi taitoja monenlaisella tulevaisuuden teknologialla! 
- Elä kahdessa ajassa: Simisi voivat matkustaa nykyajasta tulevaisuuteen ja jälleen takaisin. Jokainen vierailu nykyajassa voi muokata tulevaisuutta, joten elä niin varovaisesti tai villisti kuin haluat.  
- Rakenna plumbot: Käyttämällä uutta plumbotinluontiominaisuutta voit kansoittaa simiesi maailman erinäköisillä ja luonteiltaan erilaisilla robottiystävillä. Vastuu on kuitenkin sinun, jos päätät asettaa plumbotin luonteen ""viheliäiseksi""!"
8a97d87d-0bd9-468c-ad48-66aa47af9880,"The Sims™ 3 Paratiisisaari","Joskus simit kaipaavat vain ympäristönvaihdosta. Merimatka saattaa silloin tulla tarpeen! Matkaa vesillä muunneltavissa olevilla veneillä tai sukella sinisen meren syleilyyn.

Pidempää lomaa kaipaavat simit voivat asettua johonkin rannalla sijaitsevista taloista. Vapautta halajavat simit ihastuvat varmasti taloveneisiin, joiden ansiosta seikkailut sujuvat vallan mainiosti.

Turistien virta takaa rajattomasti mahdollisuuksia yritteliäille simeille. Täydellisen hotellin perustaminen voi osoittautua tuotteliaaksi, keskittyy hotellisi sitten sinkkuihin tai perheisiin. Paratiisisaaret sisältävät puuhaa kaikille simeille aina yrittäjistä auringonpalvojiin.
Avainominaisuudet:

• Eksoottisia lajeja: Isla Paradison kaupungissa asustaa salaperäisiä merten kansalaisia. Simistä voi tulla sellainen tietynlaisen ruokavalion ansiosta. Luonasi saattaa vierailla jopa kammottava Kraken, seitsemän meren kauhu!

• Piilosaaria: Oletko kyllästynyt ulottuvissasi oleviin saariin? Onnekkaat ja sisukkaat simit saattavat löytää merestä kartan palasia, jotka johtavat täysin tuntemattomille saarille.

• Hengenpelastaja-ura: Jos simiäsi vaivaa sankaruuskompleksi, hengenpelastaja-ura sopii hänelle kuin nakutettu. Pelasta hukkuvia simejä ja nauti saamastasi kunniasta!"
c5136649-c40a-4544-984b-ffe8ede69ff8,"The Sims™ 3 Iltahuvit -lisäosa","Hemmottele simisi sisäistä rokkitähti-bilehilettä! The Sims 3: Iltahuvit -lisäosa PC:lle vie simisi tutkimaan kaupungin kiihkeää sykettä aivan uusilla tavoilla: suuntaa baariin tai tanssiklubille tai biletä vampyyrien kanssa. Hei, kyllä nekin saavat pitää hauskaa! Muista vaan pitää ne loitolla kaulastasi. Lisäosan mukana tulee myös joukko uusia uravaihtoehtoja. Simit voivat tarjoilla drinksuja mehumestarina, rämpyttää kitaraa rokkibändissä tai kohota paikallisjulkkikseksi, joka vaatii VIP-kohtelua kaikkialla.Ominaisuudet:xa0•xa0Hengaile kaupungin kuumimmissa klubeissa, diskoissa ja baareissa. Muista antaa hyvät juomarahat portsarille!•xa0Niitä mainetta ja kunniaa muusikkona, mehumestarina, ohjaajana tai paikallisjulkkiksena.•xa0Kiertele kaupungin salaperäisellä puolella ja ratkaise vampyyriksi muuttumisen salat... jos uskallat.• Hanki pääsy VIP-alueille ja nauti julkisuuden tuomista eduista, kuten hienoista kattohuoneistosta, tyylikkäistä porealtaista ja upeista luksusautoista."
02f694e9-89c0-4936-9f6d-bf263ac113c6,"The Sims™ 3 Makkari & Kylppäri Kamasetti","Koti on siellä missä sydän on! Rentoutuvatpa simisi vaahtokylvyssä ylellisessä kylpyhuoneessaan, lataavat akkujaan tyylikkäästi sisustetussa makuuhuoneessaan tai pukeutuvat uusiin alusasuihinsa sydämensä valittuaan varten, The Sims™ 3 Makkari & Kylppäri Kamasetti lisää simiesi kotioloihin hieman loistoa! Tyylikkäät makuuhuonesetit, kylpyläteemaiset kylpyhuonekalusteet sekä romanttiset uudet alusasut ja hiustyylit antavat simisi rentoutua mukavasti ja tyylikkäästi. Ominaisuudet:• Luo mahtava master-sviitti romanttisella katosvuoteella, 40-luvun tyylin mukaisella tuolilla ja monella muulla huonekalulla. • Sisusta simiesi kylpyhuone uuteen uskoon nykyaikaisilla, kylpylätason kalusteilla, joita ovat esimerkiksi tyylitelty meikkauspöytä sekä sulavalinjainen ja tyylikäs kylpyamme.xa0• Yksityiskohdat ovat tärkeitä. Pienet asiat, kuten kukkamaljakot ja kynttilät sekä ruusun terälehdet, voivat auttaa tunnelman luomisessa.xa0• Asu tilanteen mukaan. Olipa simisi etsimässä romantiikkaa tai rentoutumassa, uudet alusasuvaihtoehdot toimivat varmasti.xa0• Viimeistele kokonaisuus huolettomalla mutta elegantilla uudella kampauksella, joka tekee simistäsi entistäkin rentoutuneemman.xa0"
031e74d5-8946-4ce9-abef-c552e46e834f,"The Sims™ 3 Monte Vista","Löydä charmin ja rahan rikastuttama maailma, jossa huvilat koristavat runsaita kukkuloita. Tutustu elävään yhteisöön vierailemalla museoissa, käyskentelemällä aukiolla tai opettelemalla ruoanlaittoa aidon puulämmitteisen uunin äärellä. The Sims 3 Monte Vistasta löytyy kulttuuria, joka on ruokkinut useita sukupolvia. Löytävätköhän sinun simisi inspiraation kokkaamiseen?OMINAISUUDET• *Täysin uusi peliesine* Puulämmitteinen uuni- Laajenna simiesi ruokatietämystä uusilla resepteillä! Valmista erilaisia leipiä, calzoneja, lasagneja ja pizzoja!• Uusi maailma odottaa- Tapaa uusia simejä, tutki uusia kohteita ja katsele Monte Vistan upeita maisemia!• Uusia esineitä- Räätälöi pelisi useilla uusilla tavaroilla ja vaatteilla, jotka ovat saatavilla vain Monte Vistassa.• Perhe Sims 2 -pelistä- Tapaa Veronalan Monttupuun perhe! Ennen riitaansa Capuloiden kanssa Monttupuut asuivat rauhanomaisesti Monte Vistassa."
d3204c8c-353e-4104-a536-d4c598326c50,"The Sims™ 3 Lemmikit","Uusi lemmikki tuo simiesi kotiin enemmän eloa!Joskus eläin on se paras kaveri. Simit rakastavat uusia lemmikkejään ja kaikkea, mitä ne voivat tehdä. Temppujen opettaminen on vasta alkua. Lemmikit kulkevat simien mukana heidän päivittäisissä puuhissaan ja tarjoavat loppumatonta, yllättävää viihdykettä.Aivan kuten simejäkin, lemmikkejä voi muokata oman makunsa mukaan, kuonosta hännänpäähän ja luonteenpiirteisiin. Eläimet ovat älykkäitä: niille voi opettaa koko joukon temppuja tavanomaisen ""nouda!""-komennon lisäksi. Ne voivat jopa varoittaa simejä uhkaavasta vaarasta.Lemmikeillä on oma sosiaalinen elämä muiden eläinten kanssa, minkä tuloksena taloon saattaa ilmestyä uusia suita ruokittaviksi! Lisäksi voit kesyttää villieläimiä lemmikeiksi. Jos simisi on vaikuttanut yksinäiseltä, ole ystävä ja hanki hänelle lemmikki!"
6428a109-f996-480d-b9d8-c829b286824d,"The Sims™ 3 Vuodenajat","Anna simisi uida meressä kuumana kesäpäivänä, kalastaa omenia saavista syksyn lehtien kahinassa, laittaa lumilautailutaidot koetukselle tai toivottaa kesäiset sadekuurot tervetulleiksi värikkään sateenvarjon suojassa. Jokainen vuodenaika tuo mukanaan uusia aktiviteetteja kuten jalkapalloa sekä suuria juhlia. Simisi voivat käydä pussauskopissa kevätriehan aikana tai tutustua kummitustalojen pelottelupäivän yllätyksiin. Pukeudu sään mukaan muun muassa sadetakkeihin tai lumitamineisiin, ja kanna mukanasi sateenvarjoja. Uusien ruokien, sisustusesineiden ja säätehosteiden ansiosta simisi voivat nauttia koko ajan muuttuvista vuodenajoista paremmin kuin koskaan ennen. PELIOMINAISUUDET:  • Pukeudu sään mukaan: pue simiesi ylle vuodenaikoihin sopivat vaatteet. Niitä ovat muun muassa lumitamineet, märkäpuvut, sadetakit, sateenvarjot ja uudet pelottelupäivän asut!  • Ilahduta simejäsi eri vuodenaikojen aktiviteeteilla: rakenna intiimi iglu, kaiverra kurpitsalyhty, hyppää veteen tai katsele ilotulitteiden pauketta. Simisi voi pitää hauskaa vuoden ympäri.  • Ota osaa erilaisiin juhliin vuoden jokaisena hetkenä: simisi voivat heitellä lumipalloja jokavuotisessa talviriehassa, hankkia kasvomaalauksia kesän juhlissa, tanssia sydämensä kyllyydestä keväällä ja onkia omenia saavista syksyllä.  • Koe muuttuvan sään ilo ja haasteet: Nyt simisi voivat todella nähdä luonnonvoimien kauneuden! Simit voivat ruskettua, tulla salaman iskemiksi tai jopa vilustua.  • Tuo ulkoilma sisätiloihin: Nyt simisi voivat oppia valmistamaan kurpitsapiiraita tai koristaa kotinsa uusilla huonekaluilla ja sisustusesineillä. Jokaiselle vuodenajalle löytyy jotakin. Osta kesäksi rusketuskoppi tai julista juhlahenkeäsi pikkulampuilla ja koristeilla.  • Toivota salaperäiset vieraat tervetulleiksi: Taivaalla ei näy pelkästään uusia sääilmiöitä! Ystävysty avaruudesta saapuvat vieraan kanssa ja kidnappaa naapureitasi heidän aluksensa avulla. Voit myös matkustaa tähtiin. *Sääkivi ilmestyy kaikissa maailmoissa lukuun ottamatta The Sims 3 Maailmanmatkaaja -lisäosan maailmoja."
9782f178-a047-4871-9642-940bda93319f,"The Sims™ 3 Superstara","Nosta simisi ryysyistä rikkauksiin ja pidä samalla yhteyttä ystäviisi. Näe, kuinka simisi nousee julkisuuden valokeilaan esiintyessään erilaisilla areenoilla. Lisäksi The Sims™ 3 Superstara tuo peliin upouusia sosiaalisia Ominaisuudet::, kuten SimPort-passin, jonka avulla voit lähettää simin kiertueelle kaverisi peliin! Siellä hän voi esiintyä kaverisi esiintymispaikassa kaverisi simeille! Voit myös chattailla kaveriesi kanssa ja lähettää heidän seinälleen viestejä ja kuvia.
Ominaisuudet:

• Simit voivat tavoitella tähteyttä laulajina, akrobaatteina, taikureina ja tiskijukkina. Näe, kuinka simisi esiintyy muille ja kohoaa maineeseen – tai putoaa huipulta.

• Uudet sosiaaliset Ominaisuudet:: chattaile kaverien kanssa, lähetä viestejä heidän seinälleen, julkaise tilapäivityksiä ja luo kaverilistoja.

• Lähetä simisi kiertueelle ystäväsi peliin ja isännöi kaverisi simin keikkaa omassa pelissäsi!

• Luo oma keikkapaikka! Rakenna hulppea konserttisali, valtava stadion tai rähjäinen indieklubi. Rakentamasi lava vaikuttaa simisi esityksen onnistumiseen ja uran etenemiseen."
17b5bb5c-f59c-45c8-8d1b-fe1b488001d8,"The Sims™ 3 Supernatural Lisäosa","Syleile yliluonnollista uudessa taian-, mystiikan- ja kujeidentäytteisessä maailmassa. Luo alusta asti noitia, vampyyreita, keijuja ja ihmissusia. Jokaisella yliluonnollisella simillä on outoja uusia piirteitä ja taitoja, jotka tuovat heidän elämäänsä ja ympäristöönsä hupia ja haasteita. Tee taikoja taikasauvallasi tai kerää tarvikkeita ja keitä tusinoittain peliä muuttavia eliksiirejä. Voit muuttaa simisi zombeiksi tai antaa heille kultaisen kosketuksen. Jaa taikajuomasi kenen tahansa The Sims 3 -pelin omistavan kaverisi kanssa. Tutki upouutta Moonlight Fallsin kaupunkia, jossa kuunkierto antaa simeillesi erikoisvoimia ja yllätyksiä odottaa joka kulman takana. Peliominaisuudet: • Pelaa yliluonnollisilla simeillä: Luo noitia, velhoja, ihmissusia, kiinnostavia vampyyreja ja keijuja - joilla kaikilla on omat taikavoimansa, piirteensä ja toimintonsa. • Tutki Moonlight Fallsin kaupunkia: Selvitä, mitkä salaisuudet ja taidot täysikuu paljastaa. Menevätkö simisi sekaisin vai tuleeko heistä entistä voimakkaampia? • Työstä taikavoimiasi ja jaa niiden lumo: Opi tekemään taikoja sekä etsimään harvinaisia aineksia eliksiirejä varten, jotta voit muunnella simiesi elämää. Lähetä taikajuomiasi kavereillesi, joilla on The Sims 3 -peli. Simisi voivat parantaa meediontaitojaan ja luoda uraa salamyhkäisenä ennustajana. • Löydä yliluonnollisia esineitä: Viiletä areenalla luudanvartesi selässä, vieraile kiertolaisten vankkureilla tai kaunistaudu taikapeilin edessä. Voit jopa herättää luurankopalvelija Luu-Liisan. Mitä voikaan tapahtua kaikkien uusien taikaesineiden avulla? • Koristele kotisi goottityyliin: Lisää taloosi salainen piilopaikka kirjahyllyovineen ja sisusta huoneesi karmaisevilla uusilla huonekaluilla. • Zombiointi: Sekoita erikoisjuoma luodaksesi ikiomia laahustavia aivonnälkäisiä hirviöitäsi. Puraise muita simejä levittääksesi iloa ja aiheuttaaksesi tuhoa. Paniikkiin ei ole syytä, sillä simit voi muuttaa takaisin eliksiirin avulla."
e9b7bf6b-8271-46fe-87c0-a1e164ec874e,"The Sims™ Keskustan kuhinaa Kamasetti","Rutkasti uutta ja kamaseteissä ennennäkemätöntä sisältöä. The Sims™ 3 Keskustan kuhinaa* -kamasettiin sisältyy muun muassa uusia tapahtumapaikkoja ja esineitä, joiden avulla voit piristää niin kaupungin kuin kotienkin ilmettä. Rakenna uusi tyylikäs kirjasto tai huipputekniikkaa hyödyntävä kuntosali, hurjan hauska leikkipuisto tai pesuhuone, jossa pyykinpesu sujuu kuin leikkiä vain. The Sims™ 3 Keskustan kuhinaa -kamasetistä löydät sekä roppakaupalla uusia esineitä kotisi koristeeksi että uusia yhteisötontteja simiesi iloksi! Suuntaa vaikkapa Herkkunärpin kahvilaan!* Pelaamiseen tarvitaan The Sims™ 3 -peruspeli.Ominaisuudet:• Uudet tapahtumapaikat ja tontit—Anna kaupungille uusi ilme upeilla käyttövalmiilla tapahtumapaikoilla ja yhteisötonteilla, tai rakenna oma upea tapahtumapaikkasi.• Treeniä ja raikkautta—Treenaa uusinta tekniikkaa edustavilla kuntolaitteilla ja pese sitten hikiset treenikamat huippumoderneilla pesukoneilla ja kuivausrummuilla.• Rentoudu—Lapset ihastuvat taatusti uuteen kiipeilytelineeseen, liukumäkeen ja hiekkalaatikkoon. Aikuiset taas voivat rentoutua pelaamalla shakkia solisevan suihkulähteen äärellä.• Totta ja tarua—Täytä kirjakokoelmaasi tyylikkäillä intellektuelliin makuun sopivilla kalusteilla. Rakenna oma työhuone tai luo rauhaisia lukunurkkauksia suojaisine väliseinineen.• Uusia vapaa-ajan asuja ja kampauksia—Vaatteita niin arkeen kuin vapaa-aikaan ja kuntoiluunkin. Kosolti eri tyylejä jokaisen muotitietoisen simin makuun."
237735a0-09b8-4827-bb27-443be319dce2,"The Sims™ 3 Yliopistoelämää","Yliopisto on oppimisen ja kokemisen aikaa. Nyt simisi voivat luoda omia yliopistomuistojaan ja kokea kaikenlaista, jolla on vaikutus heidän kohtaloihinsa! Pääaineen valinta merkitsee alkua opiskeluajalle, joka takaa paremmat työpaikat ja nopeat ylennykset opintojen jälkeen.  Yliopistossa ei tietenkään ole kyse pelkästä opiskelusta... simisi janoavat myös hauskanpitoa! Asuntolabileiden ja kokkoremujen avulla simisi voivat hellittää hetkeksi, eikä hassuille kujeillekaan ole loppua. Jos simeistäsi tulee vielä jonkin tunnetun sosiaalisen ryhmän jäseniä, hyvät ajat eivät lopu koskaan!  Yliopistoelämää-lisäosa tarjoaa simeillesi paljon puuhaa aina sosiaalisissa verkostoissa postituksesta mielenosoitusten järjestämiseen ja kaikenlaisen uuden tutkimiseen! AVAINOMINAISUUDET:  • Jännitystä piisaa: Jokaisessa pääaineessa ovat omat hyötypuolensa. Tiede- ja lääketiedeopiskelijat pääsevät leikkimään anatomisesti oikeanlaisella luurangolla, ja viestinnän opiskelijat voivat tehdä radiolähetyksiä.  • Ole kampuksen tunnetuin sim: Sosiaaliseen ryhmään kuuluminen (olet sitten silmäätekevä, nörtti tai kapinallinen) voi johtaa ainutlaatuisille urapoluille. Simistäsi voi tulla vaikkapa urheiluagentti, videopelisuunnittelija tai taiteenarvioija. Simisi on kuitenkin työskenneltävä rankasti päästäkseen uransa huipulle.  • Lykkäyksen mestari: Yliopistokaupunki on täynnä kaikenlaisia huvituksia. Nauti kahvikupposesta Paahtimo-kahvilassa tai käy kiivasta keskustelua supersankareista Simon sarjis-puodissa. Mikä vain voittaa opiskelun."
5c60cac9-fb35-45e8-a916-234d2b572e91,"The Sims™ 3 Maailmanmatkaaja Lisäosa","The Sims™ 3 Maailmanmatkaaja vie simit huimaan seikkailuun. Ohjaa simisi menestykseen—tai kammottavaan kurjuuteen. Vie simisi eksoottisiin kohteisiin metsästämään kätkettyjä aarteita. Hanki uusia taitoja, koe uudet luonteenpiirteet ja nauti onnistumisen tuomista palkinnoista. Tutki Egyptin pyramidien muinaisia hautaholveja, opettele taistelutaitoja Kaukoidässä ja nauti Ranskan monipuolisesta kulttuurielämästä ja maailmankuuluista maamerkeistä. Seikkailu odottaa simejäsi, ja sinä päätät millainen siitä tulee!Ominaisuudet: • Ota vastaan haasteita, etsi aarteita ja selvitä luolien salaisuudet.• Tutki Kiinan, Egyptin ja Ranskan kuuluisia maamerkkejä.• Opettele valokuvausta ja muita uusia taitoja ja hyödynnä uudet tilaisuudet. • Tapaa eksoottisten maiden asukkaita ja tutustu heidän kulttuuriinsa. • Sisusta simiesi koti uusien tyylisuuntien mukaisesti ja koristele se seikkailuissa saaduilla esineillä. • Saat ilmaiseksi 1000 SimPoints-pistettä The Sims™ 3 Storeen ja myöhemmin ilmoitettavat ylimääräiset verkko-Ominaisuudet."
