7d26f1b3-93d1-40dc-9908-c3ce3ef676d1,"Need for Speed™ Payback","Need for Speed™, en av verdens bestselgende spillserier, er tilbake med hevn i nye Need for Speed Payback.

I Fortune Valleys undergrunnsverden ble du og crewet ditt splittet av svik, og gjenforent av hevn for å ta knekken på The House, et nådeløst kartell som trekker i snorene til byens kasinoer, kriminelle og politi. I dette korrupte gamblerparadiset er innsatsen høy, og huset vinner alltid. 

Lag unike biler med dypere tilpasning av prestasjon og estetikk enn noensinne tidligere. Skyv grensene når du så vidt kommer deg unna storslåtte politikamper. Fra vanvittige kupp til knusende bilkamper og øyeblikk som gir deg hakeslep – Need for Speed Payback leverer en adrenalinfylt kjørefantasi.
Hovedinnhold:
Fra skrap til standardbil og superbil. Bilen din står i fokus ved alt du gjør i Need for Speed Payback. Finjuster ytelsen din i det uendelige med hver av de fem bilklassene (Race, Drift, Off-Road, Drag og Runner) for å snu bordet i hvilken som helst konkurranse, utfordring eller oppdrag.
Gjør bilactionfantasien til virkelighet. Spill som tre ulike figurer som er forent av ett felles mål: hevn. Tyler, Mac og Jess går sammen for å ta hevn mot alle odds, og bli med på det ultimate racet for å ta knekken på The House. Kjemp mot politi med stadig høyere intensitet, kjør mot rivaler gjennom byen og dra både på og utenfor veiene gjennom fjell, canyoner og ørkenen.
Konkurranse med høy innsats. Vinn stort med nye «risiko-belønning»-mekanikker. Med intense politijakter har det aldri vært mer på spill. Utfordre venner og potensielle rivaler via Autolog-anbefalinger i konkurranser, eller gå en-mot-en i klassiske ledertavler på nett."
43cc48a4-6285-4286-bfe9-c46e447c31eb,"NFS Payback 2200 Speed Points","Speed Points er premiumvalutaen i Need for Speed Payback. Du kan bruke Speed Points for å få Shipments i spillet som inneholder Bank, Vanity Items og Part Tokens for å gi bilen litt ekstra kjærlighet og oppmerksomhet!"
cc48fbce-baf6-4b80-a40c-ebeee7cfa8d3,"NFS Payback 4600 Speed Points","Speed Points er premiumvalutaen i Need for Speed Payback. Du kan bruke Speed Points for å få Shipments i spillet som inneholder Bank, Vanity Items og Part Tokens for å gi bilen litt ekstra kjærlighet og oppmerksomhet!"
08949641-8220-4983-9ea8-6cc7c0fae495,"Need for Speed™ Rivals","Erase the line between single player and multiplayer in this street-racing rivalry between Cops and Racers. Seamlessly join a world where your friends are already racing and chasing. Forget isolated game modes. There are no lobbies; no waiting. You and your friends can all share the same race as paths cross and experiences merge.Key features:• All-drive:xa0Imagine your race and your friend’s pursuit colliding—creating a world where no two events feel the same. Don’t want to play with others? Then simply choose to make Redview County yours alone and dominate the advanced Racer and Cop AI.• High-stakes rivalry:xa0Racers are lone wolves out for glory; driving agile cars built for high-speed racing and epic chases. Cops work in teams to hunt down and bust racers using the full power of the police force. Switch roles whenever you like, and watch the stakes grow through a new scoring system that puts your speed points on the line.• Next-gen racing:xa0Experience speed that you can truly feel in the fastest racing game around, powered by the Frostbite 3 engine. Every detail of the game world is rendered in stunning, high-definition graphics. Race and chase in snow, hail, rain, dust storms and heavy fog.• Your car, your identity:xa0Personalize your cars with performance and style modifications. Power up your car with the latest upgrades in pursuit technology and personalize your bodywork with fresh paint jobs, liveries, custom license plates, rims and decals to show off your car to the world.• Pursuit and evasion tech:xa0Use the latest pursuit tech and modifications to change your pursuit or escape strategy on the fly. Racers evade Cops using turbo bursts, jammers and electromagnetic pulses. Cops will be armed for aggressive busts, deploying shockwaves, spikestrips and calling in police roadblocks or helicopter support."
5c84766c-f7c0-457b-89a2-210ee0eea762,"Need for Speed™ SHIFT","Se for deg et bilspill lagd av racingsjåfører for racingsjåfører - og du vil få en idé om hva du kan forvente av Need for Speed SHIFT. Spillet introduserer gamere til et nivå av realisme man aldri før har sett i en Need for Speed-tittel, et nivå med en utrolig ektefølt og nervepirrende kjøreopplevelse. Need for Speed SHIFT er designet for å gi deg racingfølelsen av å kjøre lynraske superbiler fra et genialt kupè-perspektiv i førsteperson. Spillet byr også på en helt ny krasjsimulator som vil gi deg en formidabel fornemmelse av å kjøre veldig, veldig fort.Spillet utvikles på en felles modell gjennom et samarbeid med noen av de beste spilltalentene i verden. Noen nøkkelpersoner bak spillet er Michael Mann (produksjonssjef i Black Box), Patrick Söderlund (Senior VP hos EA Games) og Slightly Mad Studios i London. SMS, eller Blimey som de før ble kalt, burde vær et velkjent navn hos racingfrelste som utviklerne bak de klassiske bilspillene Legends og GTR 2."
0e9d03a7-f404-41b0-81d9-8a548500574c,"Need for Speed™ The Run","The Run. Et løp over nesten fem hundre mil med nådeløs asfalt fra San Francisco til New York. Ingen fartsgrenser. Ingen regler. Ingen hjelp. Jack har ikke annet enn instinkt og magefølelse på sin side når han tar opp kampen mot verdens råeste bilførere. Smale bygater, islagte fjellpass og trange daler er utfordringene han må takle. Samtidig er politiet på jakt etter ham, og det samme er de som vil se ham død. Jack kjører for livet.
HOVEDFORDELER
Fra Golden Gate Bridge til Empire State Building - The Run er et ulovlig løp langs de mest kjente og farligste veiene i USA, fra San Francisco til New York. Det er ingen regler, ingen hjelp å få i byene, ørkenene, fjellene eller dalene mellom deg og målstreken.
Du er Jacks hemmelige våpen. - Han er den som kjører for livet, men han har noe konkurrentene ikke har: Deg. Hold Jack ett skritt foran farene som kommer krypende fra hans mørke fortid, både inni og utenfor bilen. Det er opp til deg å få Jack helskinnet til New York, før de andre.
Løpene drives av Frostbite 2 – Den nye, kraftige Frostbite 2-motoren, som er laget av det prisbelønte studioet DICE, gir tekniske fordeler som gjør spillet uovertruffent, med visuelle detaljer uten sidestykke, oppslukende miljø og kraftige følelsesmessige inntrykk.
Delta i høyoktanløp -   med andre spillere i de mest tilgjengelige nettbaserte løpene du har sett. Du kan bli med i løp som alt har startet, i stedet for å vente i lobbyen, takket være en teknologi som setter sammen spillere som passer sammen. Lag en gruppe med venner, velg en spilliste med utfordringer, og kjemp om førsteplass i hver del av The Run. Når du mestrer alle spillistene, kan du nå nye nivåer og få tilgang til eksklusive kjøretøy, oppgraderinger og evner."
0d1f5b5e-9fe3-4d23-89da-3d0d347116de,"Plants vs. Zombies™ Garden Warfare","Vinner av 10 E3-premier, inkludert E3s beste og Beste skytespill. Plants vs. Zombies Garden Warfare graver i skyttergravene med en eksplosiv actionopplevelse. Ødelegg zombier, planter og unike figurer gjennom en minesprengende verden, som leverer dybden av tradisjonelle nettskytespill og den forfriskende humoren til Plants vs. Zombies-universet.   Digital Deluxe Edition er beste måte å sette i gang handlingen i Garden Warfare; vinn de første 150xa0000 myntene for å bruke dem på tilpasningsmuligheter og få en Origin-eksklusiv pakke med tilpasningstilbehør. Flerspillerfokusert. Nabolaget yrer av så mange som 24 spillere, som har gått sammen for å kontrollere mer enn ti ulike slagmarker. Garden Warfare inneholder mangfoldige spillmoduser for konkurranse og samhandling, så velg side og mestre nyansene av hver enkelt spillbare figur. Tilpass som en gal. Hvert poeng og hver seier gir deg mynter som kan brukes på klistremerkepakker, som låser opp nytt utstyr, spillbare figurer og mye mer. Jo mer du spiller, dess mer kan du låse opp. Og dess bedre vil du dominere nabolaget. Gratis oppdateringer. Handlingen i Garden Warfare fortsetter å utvikles med nytt innhold. Her kommer to flotte tilegg siden spillanseringen:  • Suburbination. Utkonkurrer alle i Suburbination-spillmoduset, hvor zombier og planter kjemper om kontrollen over tre erobringspoeng. Plantene vil ha dem på grunn av den fruktbare jorden, zombiene på grunn av de fruktbare ... hjernene. Suburbination inkluderer også kartet over ørkenforstaden ""Crash Course"", ekstra Garden Ops-bosser og Plasma-erteskyteren som er laget av fellesskapet.  • Legends of the Lawn. Hvorfor nøye seg med å erobre flagget, når du kan spille nervepirrende kamper om å erobre tacoen? Gjør nettopp det i Taco Bandits-moduset, som får plantene til å forsvare Crazy Daves lekre grillede tacos, og plantene til å stjele dem. Du vil også motta sju ekstra figurvarianter (inkludert Golf Star, Centurion, Chomp Thing og fler) og over 200 tilpasningsgjenstander."
e632c3fa-9745-4753-9276-92715905ce71,"Plants vs Zombies™ Garden Warfare Digital Deluxe","Vinner av 10 E3-premier, inkludert E3s beste og Beste skytespill.
Plants vs. Zombies Garden Warfare graver i skyttergravene med en eksplosiv actionopplevelse. Ødelegg zombier, planter og unike figurer gjennom en minesprengende verden, som leverer dybden av tradisjonelle nettskytespill og den forfriskende humoren til Plants vs. Zombies-universet. 

Digital Deluxe Edition er beste måte å sette i gang handlingen i Garden Warfare; vinn de første 150xa0000 myntene for å bruke dem på tilpasningsmuligheter og få en Origin-eksklusiv pakke med tilpasningstilbehør.
Flerspillerfokusert. Nabolaget yrer av så mange som 24 spillere, som har gått sammen for å kontrollere mer enn ti ulike slagmarker. Garden Warfare inneholder mangfoldige spillmoduser for konkurranse og samhandling, så velg side og mestre nyansene av hver enkelt spillbare figur.
Tilpass som en gal. Hvert poeng og hver seier gir deg mynter som kan brukes på klistremerkepakker, som låser opp nytt utstyr, spillbare figurer og mye mer. Jo mer du spiller, dess mer kan du låse opp. Og dess bedre vil du dominere nabolaget.
Gratis oppdateringer. Handlingen i Garden Warfare fortsetter å utvikles med nytt innhold. Her kommer to flotte tilegg siden spillanseringen: 
• Suburbination. Utkonkurrer alle i Suburbination-spillmoduset, hvor zombier og planter kjemper om kontrollen over tre erobringspoeng. Plantene vil ha dem på grunn av den fruktbare jorden, zombiene på grunn av de fruktbare ... hjernene. Suburbination inkluderer også kartet over ørkenforstaden ""Crash Course"", ekstra Garden Ops-bosser og Plasma-erteskyteren som er laget av fellesskapet. 
• Legends of the Lawn. Hvorfor nøye seg med å erobre flagget, når du kan spille nervepirrende kamper om å erobre tacoen? Gjør nettopp det i Taco Bandits-moduset, som får plantene til å forsvare Crazy Daves lekre grillede tacos, og plantene til å stjele dem. Du vil også motta sju ekstra figurvarianter (inkludert Golf Star, Centurion, Chomp Thing og fler) og over 200 tilpasningsgjenstander."
71472883-1b94-482d-8cb8-eabc6f40885d,"Plants vs. Zombies™ Garden Warfare 2: Standard Edition","Gjør klar erteskyterne og forbered deg på det sprøeste, morsomste skytespillet i universet: Plants vs. Zombies Garden Warfare 2. 

Doktor Zomboss har erobret Suburbia og gjort den om til et paradis fylt med zombier, helt uten planter. Hjelp plantene med å ta tilbake området sitt i nye Herbal Assault med 24 spillere, eller velg side i samarbeidsspill med 4 spillere, eller spill alene. Med nye moduser, klasser og masse humor, vil Plants vs. Zombies Garden Warfare 2 la deg krige mot alt som er seriøst (og vennene dine!) på måten du selv vil. 

Plants vs. Zombies Garden Warfare 2 introduserer også Backyard Battleground, din helt egen interaktive hub hvor du og opptil 3 venner kan fullføre daglige oppdrag og utfordringer samt samhandle med PvZ-favorittkarakterene deres.
Dette kan du se frem til:

Plantene angriper. Denne gangen tas kampen til zombiene. Gå på offensiven som plantene for å ta tilbake Suburbia, eller stopp den botaniske invasjonen og beskytt Zomburbia i helt nye spillmoduser.
Flere karakterer, klasser og skins. Seks nye klasser er med, noe som betyr 14 spillbare karakterklasser. Velg mellom mer enn 100 spillbare planter og zombier, og vis hva du er god for. 
Spill på din måte. Plants vs. Zombies Garden Warfare 2 gir deg mange inspirerende spillmoduser, så du kan spille med andre eller alene. Trenger du selskap? Spill i den helt nye Herbal Assault-modusen, og bli med i kamper på Internett med 24 spillere – som alle kjemper i Suburbia. Alternativt kan du slutte deg til plantene eller zombiene, og slå deg sammen med andre i samarbeidsmodusen for fire spillere. Hvis du vil, kan du til og med spille alene!
En levende PvZ-verden. Kampen om Suburbia er i full blomst på tvers av 12 kart, som er fylt med personlighet og humor. Kjemp deg gjennom zombifiserte byer og et luftrom fylt med motstand, fylt med skjulte hemmeligheter som venter på å oppdages."
d1275f51-2acb-413f-9bb6-ba2cca157504,"SHIFT 2 UNLEASHED™","Den kritikerroste SHIFT-serien er banen igjen med SHIFT 2 UNLEASHED™. I den mest altoppslukende racingopplevelsen til dags dato blir den ekte føreropplevelsen levende med den intense spenningen du kan oppleve ved å sitte bak rattet og konkurrere i Driver’s Battle. Med et helt nytt hjelmkamera, nattracing og skrekkinngytende realistisk fysikk og kollisjoner, leverer SHIFT 2 UNLEASHED all volden og spenningen fra løpsdagen i en banebrytende, autentisk racingopplevelse.INNHOLD• Dypere realisme – Opplev naturlig førstepersonsracing som aldri før. Det helt nye hjelmkameraet gjenskaper realistiske hodebevegelser hos føreren og gir en fartsfølelse du aldri har opplevd maken til: legg deg inn i svingene, kjenn hver eneste dump, hump og krasj på kroppen, opplev virkelige vibrasjoner i førerhuset og mye mer. • Virkelig realistisk racing – SHIFT 2 UNLEASHED omdefinerer racingsimulatorsjangeren ved å gjenskape stemningen fra løpsdagen. Med alt fra autentisk bil- og kollisjonsfysikk til skremmende nattracing til det aggressive utseendet og følelsen på både biler og baner, er ingen detaljer utelatt i SHIFT 2 UNLEASHED for å gi deg den hittil mest autentiske racingspillopplevelsen. Inneholder FIA GT1 World Championship og GT3 European Championship pluss førere, baner og biler fra virkeligheten. Dette er morgendagens simulator for dagens adrenalindrevne racerkjørere. • Utrolig dybde og variasjon i karrierespillet – Vinn bonusgjenstander og delta i flere racingdisipliner på veien frem til verdensmestertittelen i FIA GT1. Prøv de nye Endurance-løpene eller muskel- og retro-bilene – SHIFT 2 UNLEASHED er så fleksibelt at du kan velge akkurat den veien som passer din individuelle racingstil. Kjemp for posisjonene, dominer motstanderne og knus banerekordene hver gang du kjører – kampen er ikke over når du krysser målstreken – den pågår gjennom hele racingkarrieren. • Endre spillet med Autolog – Autolog er et revolusjonerende system som knytter sammen venner og endrer spilleopplevelsen ved at du kan dele de fleste aspekter ved racingkarrieren din. Sammenligne førerprofiler og karrierestatus, del og kommenter bilder og videoer, send utfordringer og hent nyhetsmeldinger direkte fra NFS.com og Speedhunters.com. Autolog-anbefalinger gjør den sosiale racingkonkurransen mye morsommere ved å levere utfordringer basert på vennenes aktivitet. Dette skaper en dynamisk, konkurransepreget og morsom ny måte å spille på, både på nettet og alene. • Tilpass for å vise deg frem eller for å vinne! – Gi kreativiteten frie tøyler og omskap noen av verdens ypperste og kraftigste kjøretøy til ildsprutende våpen. Tilpass motor, karosseri, fjæring og mye, mye mer. Så setter du den ultimate racingmaskinen din på prøve i en av de mange spillvariantene. Uansett om målet ditt er å kjøre en 1000-hesters Econobox eller en oppstylet GTR, så har du nesten ubegrensede muligheter til å bli en mester på banen der hver eneste sekund teller. "
8730968c-49d7-4135-af12-3219b5e172c3,SimCity™,"The defining city simulation is back! Create the city you desire and make the choices that shape your city and power the Sims within it. Every decision, big or small, has real consequences. Invest in heavy industry and your economy will soar—but at the expense of your Sims’ health as pollution spreads. Implement green technology and improve your Sims’ lives while risking higher taxes and unemployment. Team up with your friends to solve global challenges: launch a space shuttle, reduce carbon emissions, or build magnificent wonders. Compete on global and regional leader boards to be the richest, the dirtiest, the happiest or the best place to visit!  • Constructible Worlds  — Creative and customizable world that offers unique gameplay benefits, all with a fun tactile interface.  • Sims Matter — The Sims in your city speak to you directly and it’s up to you to respond to their needs. Will you listen and be the toast of the town? Or abuse your power for fame and fortune?  • Specialize in What You Love —Mold your city as a casino resort, manufacturing hub, educational enclave, and more, and then watch as a unique look and feel spread throughout your city.  • Multiplayer — Build a region with friends for the first time! Collaborate or compete in regional and global challenges and make decisions that impact the greater SimCity World.  • GlassBox Engine — SimCity introduces GlassBox, the revolutionary simulation technology that gives you the power to impact individual Sims lives, manage city level simulation, and balance multiple city simulations at once. "
f49733ba-390e-4375-81de-a828e2e4a1a8,"SimCity™: Complete Edition","Opplev den nyeste versjonen av SimCity, den største bysimulatoren noensinne. I denne komplette utgaven finner du det oppdaterte og utvidede grunnspillet, utvidelsespakken SimCity: Cities of Tomorrow, samt fornøyelsesparken, luftskipet og franske, britiske og tyske bypakker. Gjør drømmebyen din virkelig. Velg hvordan du vil forme byen og dem som bor der. Fokuser på industri eller forbruk og se økonomien styrkes mens innbyggernes helse forverres etterhvert som forurensningen sprer seg, eller ta i bruk grønn teknologi og gi innbyggerne bedre livskvalitet på bekostning av høyere skatt og arbeidsløshet. Valget er ditt!

DETTE FÅR DU
Spill på nett eller frakoblet: Valget er ditt. Spill når du vil, hvor du vil.
Dybdesimuleringer: Uovertruffen dybde i simuleringene. Alt du ser er simulert, selv hver enkelt sim i byen din.
Spesialiser deg på det du liker: Form byen din til å være en casinoby, et produksjonssenter, et mekka for festelskere, et forbrukerdrevet megakonglomerat, et grønt paradis og mye mer. Så kan du lene deg tilbake og nyte synet av drømmen din som blir levende.
Skap en by som strekker seg mot himmelen: Oppnå høyere befolkningstetthet ved å bygge megatårn som lar Simmene dine leve, arbeide og leke uten å noen sinne måtte berøre bakken.
Flere byer i stor skala: Spill én enkel by, eller opptil 16 byer samtidig der du kan spore folketall, velstand, utdanningsnivå og livsglede over hele regionen.
Den komplette SimCity-pakken: Inneholder det utvidede grunnspillet, utvidelsespakken SimCity: Cities of Tomorrow og fem sett med nedlastbart ekstrainnhold."
ce0e8c3a-e6c7-456b-9740-49b6923bc3f6,"Britisk by-sett","Gjør en del av byen din om til det moderne England på et blunk! Plasser det historiske Big Ben-landemerket og se på at en særpreget stil og følelse sprer seg i byen din. England kommer til liv etter hvert som unike, britiske butikker og hus spretter opp rundt Big Ben. Britisk by-settet kommer med eksklusive bygg, blant annet verdenskjente Big Ben og terminal for dobbeltdekkerbuss så simmene dine kommer seg rundt i byen med stil.EKSKLUSIVT LANDEMERKE: BIG BEN Med Big Ben i byen din vil du alltid vite når det er tid for te. Big Ben er ikke bare ett av de best kjente landemerkene i verden, det er også en fullt funksjonell klokke. Du kommer til å bli veldig glad når du ser alle turistene byen din tiltrekker seg når Big Ben slår klokken tolv.DOBBELTDEKKERBUSSEREtt av Londons mest ikoniske transportmidler, nemlig dobbeltdekkerbussene, kan bli dine med terminalen for dobbeltdekkerbusser. Enten de frakter simmene dine hjemmefra til jobb eller fra jobb til shopping, er synet av dobbeltdekkerbussene alltid en glede. Dobbeltdekkerbussene har bedre kapasitet enn vanlige busser, så du kan bruke disse morsomme bussene til å kutte ned enda mer på trafikken.GJØR OM BYEN DIN MED BRITISK BKIGjenskap en del av London i din egen by! Med Big Ben i byen din, vil glade boliger og vellykkede forretninger utvide og endre seg til britisk BKI. Det vil føles som om du er rett ved Themsen når du har Big Ben i byen din, omringer av britisk BKI."
dc0dd905-4026-4a4f-8cef-b7eddbc6af72,"SimCity™ 4 Deluxe Edition","SimCity 4 Deluxe Edition inkluderer bestselgeren SimCity 4 og utvidelsespakken SimCity 4 Rush Hour. Lag den største regionen med byer noen sinne, lag et jordbrukssamfunn, en forstad full av pendlere, et næringsområde med hi-tech-bransje og egne områder med tungindustri. Ta full kontroll over byens transportsystem og løs Du kjører-oppdrag - fra å bekjempe kriminalitet til å takle katastrofer. Se innbyggertallet gå i været mens simmene beveger seg rundt i byen,og lag en storby som har alt - dette er den største SimCity 4-samlingen noen sinne.


DETTE FÅR DU

SimCity 4


• Lag en hel region med byer, lag et lappeteppe av byer som henger sammen med integrert transportnettverk, og få dem til å dele og konkurrere om ressurser.



• Bruk guddommelige krefter - form landskapet og lag en verden basert på fantasien. Påkall vulkaner, tornadoer, meteorer og lyn.



• Vær en ansvarlig ordfører - bygg en by i verdensklasse, med idrettsarenaer, flyplasser, universiteter og landemerker fra den virkelige verden. Send ut utrykningskjøretøyer og ta del i det som skjer når det brenner, under demonstrasjoner og masse annet. 



• Få vite hvordan det står til med simmene - les byens rytme, fra når pendlertogene går i rushtrafikken, til når alle sover midt på natten.


SimCity 4 Rush Hour


• Du kjører - Ta kontrollen over biler, helikoptre og ambulanser i bygatene. Skru på politisirenene og fang biltyver, eller kontroller søkelyset på helikopteret for å fange bankranere. Ta ledelsen, løs oppdrag og få nye bygninger og kjøretøyer.



• Spennende nye transportmuligheter - Få orden i systemet ved å lage enveiskjøringene i San Francisco, New Yorks brede avenyer, Tokyos kjappe monorails og masse annet.



• Nye katastrofer - Test innbyggerne med den nye UFO-invasjonen, stopp trafikken med ulykker eller lag kaos med tog som sporer av. Len deg tilbake og se på ødeleggelsene, eller gjør alt du kan for å unngå fremtidige katastrofer.



• Ny arkitektur - Lag storbyen din basert på moderne europeisk byggeskikk, eller bruk de opprinnelige settene fra SimCity 4: Chicago 1890, New York 1940 og Houston 1990.



• Nye opplæringer og vanskelighetsgrader - Det har aldri vært lettere, raskere eller morsommere å komme i gang, takket være de fire nye opplæringene. Nå kan du også justere vanskelighetsgraden på spillet."
44ed34f3-dec5-4835-a972-51fe73e6dd85,"SimCity™: Morgendagens byer","Bygger du et utopisk samfunn understøttet av ren teknologi, lar et gigantisk selskap mate dine simmers umettelige konsumerisme eller bygger du deg mot himmelen med enorme megatårn som tar opp en rekke soner? I tillegg til å utvide utover, vil byer ha muligheten til å bygge oppover med enorme megatårn som tar opp en rekke soner. Utdanning og forskning vil hjelpe deg med å oppdage nye teknologier som vil gjøre byen dine mindre forurenset, mindre avhengighet av naturressurser og administrert dag-til-dag av tjenestedroner – og som et biprodukt av dette, sjansen for at ressursslukende kjemperoboter angriper byen din. Etter hvert som befolkningen øker vil simmene dine leve, jobbe og leke nærmere hverandre. Om de gjør det i harmoni og velstand eller som medlem av en utnyttende arbeidsstyrke, er opp til deg.DETTE FÅR DU •xa0Bygg deg mot himmelenxa0–xa0Lag høye megatårn som bruker flere soner, hvor simmene dine kan leve, arbeide og leke uten å måtte berøre bakken.•xa0Selskaps konsumerisme mot et grønt idealsamfunnxa0–xa0Lås opp to nye byspesialiseringer som lar deg bygge et ressurssultent megaselskap drevet av en arbeidsstyrke med lav velstand, eller et urbant idealsamfunn som utvikler ren energi og er kontrollert av de rike.•xa0Morgendagens endringerxa0–xa0Se byen din endre seg og tilpasse seg at tiden går, med nye alternativer basert på ekte teknologi, som Mag Lev-tog som kjører over byens gater og små bygninger, fremtidskjøretøyer og tjenestedroner.•xa0Ny katastrofexa0–xa0Gjør deg klar for en helt ny type katastrofe som bare er passende for en teknologisk avansert økonomi: En gigantisk robot angriper byen din! "
