8a97d87d-0bd9-468c-ad48-66aa47af9880,"The Sims™ 3 Øyparadis","Noen ganger trenger simmene dine litt miljøforandring. Og en tur til sjøen kan være akkurat det de trenger! Sus rundt i båter du kan tilpasse som du vil, eller kast deg ut i det blå havet for å kjøle deg ned.

Hvis simmene har lyst til å bli litt lenger, kan de skaffe seg sitt eget hus på stranden. Rastløse simmer vil sette pris på friheten forbundet med å bo i en husbåt som kan brukes til å reise rundt og utforske nye steder.

I og med at det er så mange turister som kommer på besøk, er det mange muligheter for å tjene penger for gründersimmer. Det kan være meget lukrativt å bygge opp et perfekt feriehotell, og du kan velge om du vil satse på familier eller single gjester. Simmene kan velge hva slags ferieparadis de vil ha, du kan konsentrere deg om mest mulig moro i sola, eller å tjene mest mulig penger.
Dette får du:

• Eksotisk art: I byen Isla Paradiso lever de myteomspunne havsimmene, som er halvt menneske, halvt fisk. Og hvis simmene dine spiser en bestemt diett, kan de bli havsimmer selv! Det kan til og med hende du får besøk av den skrekkelige Kraken, havets største og mest grusomme monster!

• Hemmelige øyer: Er du lei av de tilgjengelige øyene? Heldige simmer med ståpåvilje kan finne kartdeler under vann som fører til nye landområder du kan utforske.

• Badevaktkarriere: Hvis simmen din har lyst til å bli en skikkelig helt, er en karriere som badevakt midt i blinken. Redd simmer som holder på å drukne, og motta hyllesten!"
c5136649-c40a-4544-984b-ffe8ede69ff8,"Utvidelsespakken The Sims™ 3 Helaften","Tiden er inne til å slippe løs rockestjernen i simmen din og feste som aldri før. Med utvidelsespakken The Sims 3: Helaften til PC kan simmene dine utforske et hektisk, urbant liv på en helt ny måte, dra på lokale barer eller nattklubber og feste med ekte vampyrer! Vampyrene fortjener også å ha det moro, bare sørg for å holde dem unna halsen til simmene. Denne utvidelsespakken inneholder også et nytt sett med karrierevalg. Simmene dine kan servere drinker som miksolog, spille gitar i rockeband eller bli lokal kjendis som krever VIP-behandling overalt.DETTE FÅR DU Heng på de hippeste stedene i byen, fra brune kneiper til fornemme barer med dørvakter i døra. Bli berømt som bandmedlem, miksolog, filmregissør eller lokalkjendis. Hvis du havner i en bestemt del av byen, kan det hende simmene dine oppdager hva som skal til for å bli vampyr.Få tilgang til eksklusive områder og dra nytte av kjendisfordeler, som å bo i panoramaleiligheter, slappe av i luksusboblebad og kjøre fete biler."""
02f694e9-89c0-4936-9f6d-bf263ac113c6,"The Sims™ 3 Soverom og bad - Stæsj","Borte bra, men hjemme best. La simmene slappe av i et boblebad på det nye luksusbadet, nyte litt fritid i sitt lekkert møblerte soverom eller ikle seg nytt undertøy for å glede sin aller kjæreste. The Sims™ 3 Soverom og bad – Stæsj  setter en ekstra piff på hjemmelivet! Med stilige soveromssett, spa-inspirerte baderomsmøbler og romantisk, nytt undertøy og nye frisyrer, kan simmene nå slappe av i komfort og stil.  Funksjoner:• Lag det perfekte voksensoverommet med en romantisk himmelseng, en 40-tallsinspirert stol og mye mer. • Puss opp simmenes baderom med moderne møbler i spa-kvalitet, blant annet en lekker kommode og et elegant og stilig badekar. • Gi interiøret det lille ekstra. Fra vaser med blomster til stearinlys og roseblader, det er de små tingene som skaper stemningen. • Klær som gjør inntrykk. Uansett om simmen er ute etter et romantisk stevnemøte eller en rolig, avslappende aften, så vil det nye undertøyutvalget garantert ha en behagelig virkning. • Gjør utseendet perfekt med en upretensiøs, men elegant ny frisyre som viser at simmene er klare for behagelig avslapning. "
031e74d5-8946-4ce9-abef-c552e46e834f,"The Sims™ 3 Monte Vista","Oppdag en by rik på sjarm og penger, der villaene har fantastisk utsikt mot åsene rundt. Utforsk et levende samfunn, dra innom anerkjente museer, ta deg en tur på torget eller lær deg kulinariske kunster med en autentisk vedfyrt steinovn. I The Sims 3 Monte Vista får du inspirasjon fra en tradisjonsrik kultur som har eksistert i mange generasjoner. Kommer simmene til å finne inspirasjon til å bli mesterkokker?DETTE FÅR DU• *Ny spillgjenstand* Steinovn - Utvid simmenes kulinariske verden med nye oppskrifter! Lag et utvalg av brød, calzone, lasagne og pizza!xa0• En helt ny verden venter - Treff nye simmer, utforsk nye steder og nyt den vakre utsikten i Monte Vista• Eksklusive nye ting - Tilpass spillet med mange nye, eksklusive møbler og plagg som bare er tilgjengelige i Monte Vista.• Sims 2-familie – Hils på familien Monty fra Veronaville! Før de begynte feiden med familien Capp, levde familien Monty en rolig tilværelse i Monte Vista."
d3204c8c-353e-4104-a536-d4c598326c50,"The Sims™ 3 Kjæledyr","Gjør huset til simmene enda mer levende med et nytt kjæledyr!Noen ganger er det et dyr som skal til for å få bukt med ensomheten. Simmene dine kommer til å elske de nye kjæledyrene sine og alt de kan gjøre. Å lære dem triks er bare begynnelsen. De blir med simmene i de daglige gjøremålene, og leverer kontinuerlig og uforutsigbar underholdning.På samme måte som med simmene, kan du tilpasse kjæledyrene som du vil, og alle har unikt utseende og en egen personlighet. Og smarte er de også: Du kan lære dem å gjøre masse annet enn bare å hente pinner, de kan til og med advare simmene dine når det er fare på ferde.Kjæledyrene liker å være sosiale med andre dyr, og før du vet ordet av det, kan det hende du har flere munner å mette! Du kan også temme ville dyr og ta dem med hjem. Hvis simmene dine har følt seg litt ensomme i det siste, bør du skaffe dem et kjæledyr!"
6428a109-f996-480d-b9d8-c829b286824d,"The Sims™ 3 De fire Årstider","Få simmene dine til å ta seg en dukkert i havet en varm sommerdag, leke eple i balje-leken om høsten, teste snowboardferdighetene i halfpipen eller ønske vårregnet velkommen på tur med en fargerik paraply. Hver nye årstid gir deg nye aktiviteter, som fotball, store festivaler og andre feiringer. Simmene kan ta seg en tur til kysseboden på vårfestivalen eller se hva slags overraskelser som venter i det hjemsøkte huset på skumledagen. Kle deg etter forholdene med sesongens moteklær, som regnfrakker, snøutstyr og til og med paraplyer. Med forskjellige typer mat, pynt og væreffekter, kan simmene kose seg mens årstidene skifter og leke med livet som aldri før. DETTE FÅR DU:  • Kle deg etter forholdene: Kle opp simmene med nye moteklær som passer årstiden, som snøutstyr, våtdrakter, regnfrakker, paraplyer og nye skumledagkostymer!  • Gled simmene dine med nye aktiviteter for hver årstid: Bygg en koselig iglo, skjær ut en skummel gresskarlanterne, stup uti fra stupebrettet eller fyr av det nye fyrverkeriet. Simmene har nye ting å gjøre gjennom hele året.  • Bli med på festivaler skreddersydd årstidene: Simmene kan være med i snøballkrig på den årlige vinterfestivalen, få ansiktet malt på sommerfestivalen, dans på vårfestivalen eller prøv deg på en eple i balje-konkurranse på høstfestivalen.  • Opplev gledene og utfordringene med vær som endrer seg: Nye væreffekter og nye reaksjoner fra simmene fanger opp skjønnheten i naturen! Simmene kan bli brune, truffet av lynet eller forkjølet.  • Ta med naturen inn: Simmene dine kan lære seg oppskriften på gresskarpai eller pynte huset med nye møbler og pynt. Det er mange nye ting som kan brukes til hver årstid. Ta turen til en spraytanbås før sommeren, eller kom i julestemning med lys og annen pynt på huset.  • Si velkommen til mystiske gjester: Nye værmønstre er ikke det eneste som skjer på himmelen! Bli venn med en gjest fra verdensrommet, og bruk UFO-en deres til å bortføre en nabo, invadere en fellestomt eller reise mellom stjernene. *Værsteinen vises i alle verdener bortsett fra dem som er med i The Sims 3 Reisefeber."
9782f178-a047-4871-9642-940bda93319f,"The Sims™ 3 I rampelyset","Lev ut superstjernedrømmen med simmene mens du holder kontakten med vennene dine! Se at simmene blir mer og mer berømte etter hvert som de opptrer på forskjellige scener. I The Sims 3 I rampelyset kan du for første gang i serien bruke sosiale funksjoner, som Pass, en helt ny funksjon som lar deg sende simmene dine til spillet til en venn. Når de har dratt til vennens spill, kan de opptre for simmene til vennen din! Du kan også chatte med venner og poste meldinger og skjermbilder på veggen til vennene dine.
 Funksjoner: 

• Simmene kan leve ut drømmen som sanger, akrobat, tryllekunstner og DJ. Se dem bli stadig mer populære — eller bli buet ut når de opptrer for andre simmer. 

• Helt nye sosiale funksjoner: chat med venner, post på veggen deres, post statusoppdateringer og lag en venneliste.

• Send simmene til spillet til en venn og få simmene til vennen din til å komme på besøk i spillet ditt!

• Lag ditt eget spillested! Bygg et elegant konserthus, en storstilt stadion eller en undergrunnsklubb. Hvordan du bygger en scene påvirker hvor bra simmene opptrer og hvordan de kommer seg videre i karrieren."
17b5bb5c-f59c-45c8-8d1b-fe1b488001d8,"The Sims™ 3 Overnaturlig Utvidelsespakke","Kast deg ut i det overnaturlige i en helt ny verden full av magi, mysterier og rampestreker. Lag hekser, vampyrer, feer eller varulver fra start. Alle de overnaturlige simmene har merkelige nye trekk og egenskaper som tilfører humor og utfordringer i livene deres og i verden rundt dem. Bruk tryllestaven til å fyre av magiske formler, eller samle ingredienser og bland eliksirer. Du kan gjøre simmene til zombier eller gi dem en midasberøring. Del de magiske bryggene dine med venner som har The Sims 3. Utforsk den nye byen Moonlight Falls, der simmenes spesialkrefter forsterkes basert på månefasene, og overraskelsene venter rundt hvert hjørne. Spillfunksjoner: • Spill som overnaturlige simmer: Lag hekser, trollmenn, varulver, feer og mer spennende vampyrer enn før, som alle har spesielle magiske egenskaper, personlighetstrekk og samhandlinger. • Utforsk Moonlight Falls: Oppdag hvilke mysterier og egenskaper som kommer frem i lyset fra fullmånen. Kommer simmene dine til å frike ut eller bli mektigere? • Dyrk de magiske ferdighetene dine og del fortryllelsen: Lær deg å bruke formler og finn sjeldne ingredienser til å brygge eliksirer som du kan bruke på andre simmer - på godt og vondt. Send de magiske eliksirene dine til venner som har The Sims 3. Simmene dine kan jobbe med de overnaturlige egenskapene sine og bygge seg opp en karriere som spåsim. • Finn overnaturlige ting: Sus rundt arenaen på sopelime, dra innom sigøynervogna eller få en makeover foran det magiske speilet. Du kan til og med få hjelp av den klassiske skjeletthushjelpen Beinhilde, for første gang i The Sims 3. Med tonnevis av forheksede ting er det ikke godt å si hva som kommer til å skje. • Pynt hjemmet ditt i gotisk stil: Lag en hemmelig hule bak en bokhylledør og fyll huset ditt med skumle, nye møbler. • Zombiefisering: Bland en spesiell eliksir for å lage en gjeng med rallende, hjernesultne monstre. Spis andre simmer og skap kaos. Men ingen grunn til panikk, du kan alltids lage en eliksir som forvandler simmene tilbake igjen."
e9b7bf6b-8271-46fe-87c0-a1e164ec874e,"The Sims™ Byliv Stæsj","The Sims™ 3 Byliv - Stæsj* har spennende Funksjoner: du aldri har sett før i en stæsjpakke, du får nye steder du kan bruke til å gi byen en makeover og gjenstander simmene kommer til å elske å ha i husene sine. Bygg opp et nytt bibliotek, lag et eksklusivt treningsrom, lag en gøyal lekeplass eller gjør husarbeidet til en lek med et nytt vaskerom. The Sims 3 Byliv - Stæsj gir deg ikke bare masse nye ting du kan bruke i huset, men har også nye fellestomter, som Den lekre herligetskafeen, der simmene dine kan dra på besøk!* Krever at du har The Sims 3 for å spille.Funksjoner:• Forhåndsbygde steder og tomter - Gi byen til simmene en ny look med spektakulære, nye steder de kan dra — eller konstruer dine egne.• Toppform - Tren med det siste nye innen høyteknologisk treningsutstyr, og vask det skitne treningstøyet i den nye luksusvaskemaskinen med tilhørende tørketrommel.• På tide å slappe av - Ungene kommer til å elske den nye hytta i treet, sklien og sandkassen, mens voksne kan spille sjakk ved den nye fontenen.• Lese lekser eller lese høyt - Oppdater biblioteket med elegant tilbehør, bygg deg ditt eget kontor eller lag båser med spesielle seksjonssitteplasser.• Nye uformelle antrekk og frisyrer - Klær for å løpe ærend, slappe av eller trene — det er masse forskjellige stiler til alle simmens motebehov."
237735a0-09b8-4827-bb27-443be319dce2,"The Sims™ 3 Studentliv","Tiden på universitetet går med til både å lære seg ting og å eksperimentere. Nå kan simmene dine få sine egne minner fra studietiden og oppleve ting som former fremtiden deres! Først velger de et hovedfag, og så begynner de på en utdanning som gir store fordeler etter at de har tatt eksamen, med bedre startjobber og raskere forfremmelser.  Men det dreier seg selvfølgelig ikke bare om å studere, simmene dine har lyst til å ha det moro også! Fester på hybelhuset og rundt bålet er fantastiske når man trenger å få et avbrekk fra studiene - her kan absolutt alt skje. Hvis du blir med i en av gjengene på universitetet, kan du også åpne opp helt nye muligheter.  Om simmene dine poster på sosiale nettverk med smarttelefonen, leder en demonstrasjon på universitetsområdet eller forsker for å gjøre vitenskapelige fremskritt, kommer de til å finne masse spennende å gjøre i Studentliv! DETTE FÅR DU:  • Kule hovedfag: Alle hovedfagene har egne temaer å utforske. Spill med det anatomisk korrekte skjelettet som en del av hovedfaget i medisin, eller kringkast ditt eget radioprogram med hovedfaget i kommunikasjon.  • Bli den mest populære simmen på universitetet: Hvis du blir med i en av gjengene på universitetet — sportsgjengen, nerdene eller rebellene — kan du få spesielle jobber: sportsagent, dataspilldesigner og kunstkritiker. Men simmene må jobbe hardt for å komme seg til toppen.  • Mestre utsettelsens kunst: Byen rundt universitetet har mange muligheter for utforskning og underholdning. Ta deg en kaffe på Superbønna kafé eller diskuter superhelter hos Keith’s tegneserier. Hva som helst for å unngå å lese!"
5c60cac9-fb35-45e8-a916-234d2b572e91,"The Sims™ 3 Reisefeber Utvidelsespakke","Ta med deg simmene på livets største eventyr med The Sims™ 3 Reisefeber. Styr dem til rikdom og berømmelse — eller lidelse og undergang. Dra til eksotiske reisemål og let etter skjulte skatter. Gi dem nye ferdigheter, opplev nye personlighetstrekk og få nye belønninger hvis simmene lykkes. Utforsk eldgamle gravkamre i pyramidene i Egypt, mestre kampkunst i Det fjerne østen og reis til de berømte landemerkene i Frankrike. Eventyret venter — hva kommer simmene dine til å oppdage?Funksjoner: • Ta på deg utfordringer, finn skatter, oppdag hva som befinner seg i bortgjemte huler og masse annet.• Utforsk berømte landemerker i Kina, Egypt og Frankrike.• Lær nye ferdigheter, som fotografi, og ta på deg nye oppgaver. • Treff nye simmer fra eksotiske steder og utforsk kulturen deres. • Tilpass hjemmeme til simmene med nye stiler og ting de har med seg hjem fra ferie.• Skaff deg 1000 gratis SimPoints til The Sims 3 Store og nye nettfunksjoner som kunngjøres senere."
295f43ef-8cc5-423b-9ea8-20cef3855756,"The Sims™ 4","Enjoy the power to create and control people in a virtual world where there are no rules. Express your creativity as you customize your Sims’ distinct appearances and unique personalities. Choose their fashions, select their hairstyles, and give them life aspirations. Effortlessly build your Sims the perfect homes with the all-new room-based Build Mode, choosing your favorite designs and décor. Develop your Sims’ relationships, pursue new careers, and shape the rich and entertaining moments of their lives. Explore beautiful worlds with unique environments and travel to neighborhoods where you can visit venues and meet other interesting Sims. Be powerful and free, have fun, and play with life!

Create Unique Sims Create a variety of unique Sims with distinct appearances, big personalities, and all-new emotions. Sculpt your Sims’ body shape using the powerful new Create A Sim tool then choose their hairstyles, walk-styles, and fashions. Give their lives purpose by selecting their traits and aspirations that give you control over their mind, body, and heart.

Build the Perfect Home Effortlessly build and design homes for your Sims using the new room-based Build Mode. Construct the home of your dreams by designing its layout, choosing its furnishings, and altering the landscape. You can even add a pool or basement!

Explore Vibrant Worlds Travel between worlds, explore unique neighborhoods, and discover interesting venues. Your Sims can visit new communities to expand their social circle, hangout with friends in parks, or find and collect fun new objects. 

Play with Life Control the rich and entertaining moments of your Sims’ lives from their relationships to their careers. Your choices shape every aspect of their lives from birth, to being a toddler, and into adulthood. Develop your Sims’ skills and pursue new hobbies.

Add New Experiences The all-new Gallery gives you the power to discover amazing community content to add to your game, or share your own creations with the world. Download, like, and comment on your favorite Sims, complete homes, and fully designed rooms."
3f4949b9-f6e9-485c-b438-356ee82e310e,"The Sims™ 4 Pluss Katter og hunder bundle","Skaff deg en bundle med The Sims 4, The Sims 4 Katter og hunder og The Sims 4 Digital Deluxe-innhold! Lag unike simmer, bygg hus til dem og utforsk fargerike steder. Lag katter og hunder, la dem flytte inn hos simmene og gjøre om livet deres for alltid, og stell nabolagets kjæledyr som veterinær.
DETTE FÅR DU
The Sims 4. Lag og kontroller personer i en virtuell verden der det ikke er noen regler. Uttrykk kreativiteten din mens du tilpasser simmenes utseende og personlighet og bygger drømmehjemmet til dem. Utvikle simmenes forhold, gi dem karrierer, og utforsk fargerike, nye steder.
Utvidelsespakken The Sims 4 Katter og hunder. Lag katter, hunder, kattunger og hundevalper med spesiell pels og egne personligheter. Opplev samholdet og moroa pelsdottene gir i livet til simmene dine, og bygg en veterinærklinikk for å følge en karriere som byens beste dyrlege.
The Sims 4 Digital Deluxe-innhold. Oppgrader spillopplevelsen med innhold som gjør simmene til festens midtpunkt! Med Festens midtpunkt, Oppe hele natta og musikken til The Sims 4."
5a8c644d-2fc3-4ce8-aca4-7c8eea87cb28,"The Sims™ 4 Bundle - På jobben, Ut i naturen, Luksusparty","Få flere måter å spille på til en super pris med en The Sims™ 4 Bundle med 1 utvidelsespakke, 1 spillpakke og 1 stæsjpakke. Regjer på arbeidsplassen med spennende, nye karrierer, ta med simmene på camping på et helt nytt sted og arranger en luksuriøs fest.
DETTE FÅR DU
Nye måter å spille på. Inneholder utvidelsespakken The Sims™ 4 På jobben, spillpakken The Sims™ 4 Ut i naturen og stæsjpakken The Sims™ 4 Luksusparty.
The Sims™ 4 På jobben. Du regjerer på arbeidsplassen! Ta aktiv kontroll over simmene dine mens de er på jobben, og avgjør om de skal bruke dagene sine på å redde liv som modige leger, løse krimgåter som fryktløse politisimmer, finne opp ting som gale forskere eller lage sin egen butikk og prøve å bli simoleonærer.
The Sims™ 4 Ut i naturen. Ta med simmene på camping, og utforsk nye steder i Granite Falls. Dra inn i de dype skogene, og oppdag nye overraskelser, som farlige og forbløffende urter, nye fiskearter, gufne insekter og ... bjørner?
The Sims™ 4 Luksusparty. Arranger en luksuriøs fest med ekstravagant pynt. Oppgrader simmenes garderober med flotte kjoler og fornemme formelle antrekk. Med det nye buffetbordet kan du velge hvilke gourmetretter du vil servere simmene, og velge pynt som passer til anledningen."
5a3569e0-3229-4998-b091-bcccd85416bf,"The Sims™ 4 Kult kjøkkenstæsj","Gjør om kjøkkenet til simmene dine med strømlinjeformede stålapparater og nye gourmetmøbler. Oppdag alle de spennende smakene simmene kan diske opp med ved hjelp av den nye iskremmaskinen. Og de blir helt til å spise opp selv også, med nye moteklær og frisyrer.
DETTE FÅR DU
Lag noe gøy med den nye iskremmaskinen. Alle liker iskrem! Simmene elsker de frosne fristelsene, og denne iskremmaskinen kan lage nesten hva det skal være! Prøv deg på vanlig iskrem, eller gå for en softis. Så kan du legge på bananskiver, pisket krem, strø og sjokoladesaus – nam!
Gi kjøkkenet en fresh, ny look. Lag et gourmetkjøkken med stålapparater, dører med frostet glass og masse annet. Dette kjøkkenet er en mesterkokk verdig, selv om simmene dine foretrekker å bruke mikrobølgeovnen til å varme opp maten sin.
Mote og frisyrer som gjør simmene til å spise opp. Simmene er klare til å servere ny mote! Oppdater simmenes utseende med en rekke forskjellige frisyrer og trendy klær."
f2e9f8ba-c40f-4ce9-b46d-84542875ac54,"The Sims™ 4","Enjoy the power to create and control people in a virtual world where there are no rules. Express your creativity as you customize your Sims’ distinct appearances and unique personalities. Choose their fashions, select their hairstyles, and give them life aspirations. Effortlessly build your Sims the perfect homes with the all-new room-based Build Mode, choosing your favorite designs and décor. Develop your Sims’ relationships, pursue new careers, and shape the rich and entertaining moments of their lives. Explore beautiful worlds with unique environments and travel to neighborhoods where you can visit venues and meet other interesting Sims. Be powerful and free, have fun, and play with life!

Create Unique Sims Create a variety of unique Sims with distinct appearances, big personalities, and all-new emotions. Sculpt your Sims’ body shape using the powerful new Create A Sim tool then choose their hairstyles, walk-styles, and fashions. Give their lives purpose by selecting their traits and aspirations that give you control over their mind, body, and heart.

Build the Perfect Home Effortlessly build and design homes for your Sims using the new room-based Build Mode. Construct the home of your dreams by designing its layout, choosing its furnishings, and altering the landscape. You can even add a pool or basement!

Explore Vibrant Worlds Travel between worlds, explore unique neighborhoods, and discover interesting venues. Your Sims can visit new communities to expand their social circle, hangout with friends in parks, or find and collect fun new objects. 

Play with Life Control the rich and entertaining moments of your Sims’ lives from their relationships to their careers. Your choices shape every aspect of their lives from birth, to being a toddler, and into adulthood. Develop your Sims’ skills and pursue new hobbies.

Add New Experiences The all-new Gallery gives you the power to discover amazing community content to add to your game, or share your own creations with the world. Download, like, and comment on your favorite Sims, complete homes, and fully designed rooms."
47a729eb-6422-4719-adaf-28e04ef2e0dd,"The Sims™ 4 Stæsj til uteplassen","Gi simmene en hage de virkelig kan kose seg i med The Sims™ 4 Stæsj til uteplassen! Sett opp gøyale vannsklier og plasser fargerike, nye pyntegjenstander. Kle opp simmene i komfortable klær, og husk å lage nok limonade.
DETTE FÅR DU
Ha det gøy med sklier. La simmene kjøle seg ned og tøffe seg med to helt nye vannsklier. Gjør triks for alle som ser på, og skli gjennom gapet på en hai! Og så kan du tilsette litt såpe, for alt er morsommere med bobler!
Pynt uteplassen. Gi hagen et personlig preg med pyntelys og potteplanter. Gi simmene og gjestene deres et supert sted å henge med møbler i forskjellige farger. Ikke glem et beroligende sett med vindspill og fine fuglematdispensere for å gjøre uteplassen komplett.
Slapp av med komfortable moteklær. Det er på tide med noen nye klær til simmene. Nå kan de slappe av med søte frisyrer og se fantastiske ut mens de drikker iste!"
91a7150f-29de-4687-b2ae-316b1eafaae1,"The Sims™ 4 Bowlingstæsj","Bygg en bowlinghall, og ta med deg simmene ut for å velte kjegler med en tung ball, for nå ruller The Sims™ 4 Bowlingstæsj inn i byen! Konkurrer mot venner, bli bedre i bowling, og lås opp avanserte kast. Tilpass hallen din med bowlinginspirert pynt, og gi simmene dine en fet, ny look.
DETTE FÅR DU
Bygg en bowlinghall. Lag din egen bowlinghall med neonlys, bowlingpynt og til og med en bar der simmene dine kan nyte forfriskninger mellom omgangene. Tilpass interiøret med fantastiske retromøbler som passer like fint hjemme.
Ta med simmene på bowling. Spill bowling med simmene med den nye bowlingbanen. Begynn med vant på siden, og tren til du etter hvert låser opp mer avanserte kast. Demp lysene og skru opp musikken for å spille månelysbowling.
Fete nye moteklær. Kle opp simmene i tradisjonelle bowlingskjorter og bowlingsko, eller gi dem en rocka ny look med rockabilly-inspirerte klær og frisyrer."
