04a8137c-0de9-42d4-8959-f15ca2567862,"12 is Better Than 6","<h1>现已推出最新 DLC</h1><p><h2 class=""bb_tag"">朋友们，大家好！ </h2>《12 Is Better Than 6》的资料片即将推出！<br><br>来认识下 3 位全新角色，每个都有自己的战役与不同的游戏方式： <br><br><img src=""https://steamcdn-a.akamaihd.net/steam/apps/410110/extras/bill_watt_(кит).png?t=1513979976"" ><br><img src=""https://steamcdn-a.akamaihd.net/steam/apps/410110/extras/GIF1.png?t=1513979976"" ><br><br><img src=""https://steamcdn-a.akamaihd.net/steam/apps/410110/extras/pitt(кит).png?t=1513979976"" ><br><img src=""https://steamcdn-a.akamaihd.net/steam/apps/410110/extras/GIF2.png?t=1513979976"" ><br><br><img src=""https://steamcdn-a.akamaihd.net/steam/apps/410110/extras/indi(кит).png?t=1513979976"" ><br><img src=""https://steamcdn-a.akamaihd.net/steam/apps/410110/extras/GIF3.png?t=1513979976"" ><h2 class=""bb_tag""><strong>新的游戏机制： </strong></h2><ul class=""bb_ul""><li>赛马 - 西部片怎么能少得了骑马追捕呢？而且是发生在沙漠上的骑马追捕！ <br><br></li><li>漂流 - 如果你出现在河流中的筏子上，那你会怎么做？当然是一边祈祷，一边开枪了！<br><br></li><li>抢劫两列火车，因为一列远远不够。</li></ul><h2 class=""bb_tag""><strong>新的敌人：</strong></h2><ul class=""bb_ul""><li>狂战士 - 带着子弹与对死亡的不屑。谁也别在墨西哥开玩笑！<br><br></li><li>装备炸药的敌人 - 现在围栏和倒下的桌子也不再安全了。 </li></ul><br>别忘了将《12 is Better Than 6: The Apostles》加入到您的愿望清单！</p><br><h1>关于游戏</h1><img src=""https://steamcdn-a.akamaihd.net/steam/apps/410110/extras/5-features-pic.png?t=1513979976"" ><br><br>这是 1873 年。一名逃亡的奴隶在沙漠中步履蹒跚，希望从墨西哥逃到德克萨斯州。他手拿一把左轮手枪，带着一顶从死人身上偷来的墨西哥帽。<h2 class=""bb_tag""><strong>主要特色：</strong></h2><br><ul class=""bb_ul""><li> <strong>致命枪战 </strong>  <br>你需要用一根手指扣上左轮手枪的扳机，才能通过按下另一根手指来开枪。一着不慎，可能随时招来杀身之祸。 <br></li><li> <strong>真实的武器</strong><br>温彻斯特步枪、双筒猎、左轮手枪和加特林机枪都会乐意帮你杀死那些外国佬。对了，游戏里还有绑着炸药的老鼠呢。<br></li><li> <strong>扣人心弦的剧情  </strong><br>进入十九世纪七十年代的美国，扮演一名逃脱的墨西哥籍犯人，为了生存和自由而战。<br></li><li> <strong>选择游戏风格 </strong> <br>你可以选择潜行方式杀敌人个措手不及，甚至直接绕到他们身后。<br></li><li> <strong>升级</strong><br>你会发现各种惊喜：胸甲有 50% 几率使部分子弹偏转，快速装弹技能可以让英雄一次填入 2 发子弹，超精准射击（减少子弹散射），不引起敌方同伙注意而潜行击杀敌人等等！<br></li><li> <strong>华丽的美术风格</strong><br>该游戏使用手绘方式呈现，创造了一种妙趣横生的视觉体验。<br></li><li> <strong>游戏场景</strong><br>真实的地点和城镇、沙漠的精神与最令人绝望的本地强盗将把你带入逼真、残酷的狂野西部世界。</li></ul>"
9f966b78-ac85-46f7-81db-f5b7ed46147b,2Dark,"Alone in the Dark® 制作人、恐怖生存游戏先驱 Frédérick Raynal 的倾力之作，2Dark 是一场通往堕落中心的潜行与勇气之旅。发挥你的机智，渗透到 Gloomywood 的残酷堡垒中。开展调查，揭开堡垒内疯狂变态者的秘密，惩戒他们的罪行，把孩子们带到安全的地方。<h2 class=""bb_tag"">一款全新的潜行恐怖冒险游戏</h2><ul class=""bb_ul""><li> 令人心惊胆战的体验，结局非常残酷，只能靠智慧来引导你前行。<br></li><li> 完善计划，通过六个错综复杂的手工制作关卡，带着孩子们逃出生天。<br></li><li> 保持隐蔽，小心前行。灯光和声音可以帮助你，也可以毁灭你。<br></li><li> 补给品有限。从手电筒电池到子弹，充分发挥每件物品的作用。<br></li><li> 调查每个角落和缝隙，揭开劫持事件背后的险恶秘密。<br></li><li> 孩子就是孩子。停下太久他们就会烦躁、哭泣，使你们都陷于险境。</li></ul>"
554e3607-3daa-4731-a4e0-3dc43cc440c9,3SwitcheD,"小心！玩这个游戏会上瘾！在已知宇宙中，您再也找不到比它更有挑战性、更快、更有趣和财宝更多的游戏了！<br><br><strong>3SwitcheD™</strong> 将传统玩法与迷人的新技术相结合。您将置身于一个新的街机游戏世界。全新的 3D - 和 3D-ET- 技术将整个游戏提升到一个新层次。使用 3D-ET™ 技术，3SwitcheD™ 不仅带给您真实得难以置信的 3D 外观，它的工作也是 3D 的。通过任何连接的摄像头，游戏将扫描您的面部，当您需要改变视角的时候只需向那个方向看一眼就足够了！这项全新的技术将带给您从未想到过的游戏体验！<br><br>对于所有没有使用这一功能的玩家，游戏依然向他们提供了奇妙的外观和大量挑战！大量挑战已严阵以待，您准备好了吗？<h2 class=""bb_tag"">游戏玩法</h2>从 6 个不同的游戏模式中挑选一个并取得惊人的高分，或者打破您的原有纪录。您需要一个挑战性的逻辑游戏，没问题！谋略和冷静是通往“清除群簇”模式胜利之路的大门。或者您在寻求一种肾上腺素快速分泌的纯粹快感？那么挑选“时髦的交换”模式吧！让我们看看您的极限速度。只有手速最快的人才能打破自己的分数限制。在“改变重力”模式，一个新纪元正在等着您。在寻找成对宝石的同时管理重力场，使宝石重新排列，并且也许找到新的获胜方法。 <br><br>您认为自己是这个维度最好的寻宝者，那么让全世界都知道吧。上传您的最高分并与社区中其他的相比较。您是最好的吗？继续努力吧，总有人在紧跟您的纪录。<br><br>多个难题保证您可以得到远远超过从已知世界能够获得的无尽的娱乐和快乐。 <br><br>一个游戏多种挑战，全部以令人激动的3D表现！不要错过！3SwitcheD™ 将发布用于个人电脑、Mac 和 iOS 设备的版本。<h2 class=""bb_tag"">特点:</h2><ul class=""bb_ul""><li>独特的 3D-ET™ 技术控制视角<br></li><li>3D 游戏场和奇妙的动画<br></li><li>6 种完全不同的游戏模式，独特的挑战性<br></li><li>具有高分数据库的全球挑战社区<br></li><li>两种专门制作的音轨<br></li><li>支持 12 种不同语言</li></ul>"
f1420584-ca60-48c4-ad63-d327a2d6f275,"8-Bit Armies","<strong><i>劲爆复古游戏！</i></strong><br>《8-Bit Armies》是一款 PC 平台的复古式即时战略游戏。这款由 Petroglyph 倾情打造的游戏采用了色彩欢快的像素风，是现今市场上节奏最快和友善的即时战略游戏。采集资源，建造并防守基地，集结大军，碾压你的对手！《8-Bit Armies》提供单机单人任务、双人合作任务、AI 突袭模式与专用服务器 PvP 多人模式。<br><br>首次发行版提供：<br>[列表]<br><ul class=""bb_ul""><li>25 个单机战役任务<br></li><li>12 个合作任务，让您与好友并肩作战<br></li><li>10 张多人/突袭战地图，支持高达 8 名玩家联网对战<br></li><li>多级难度 AI，可以选为队友或对手进行游戏<br></li><li>经典的基地建造游戏机制，打造终极大本营，向对手发起摧枯拉朽的进攻<br></li><li>可以破坏地图上的环境元素，无论大小<br></li><li>易于理解的现代军事单位和建筑，即使新手也能快速适应<br></li><li>由经典即时战略游戏《Star Wars: Empire at War》、《Universe at War,》和《Grey Goo》的开发商倾情打造 [/列表]<br><br>《8-Bit Hordes》适合所有热爱即时战略游戏的玩家，骨灰级游戏也会为此兴奋不已。游戏提供的单人战役与合作模式，可以让每个玩家都能享受游戏乐趣！<h2 class=""bb_tag"">游戏媒体人的更多评论……</h2><br><i>“他对即时战略游戏的最大贡献就是其精彩的复古设计、色彩明快的图形与易上手的游戏玩法。对于那些被即时战略游戏复杂性吓倒的玩家，《8-Bit Armies》是非常好的入门游戏。”</i><br><strong>- CGMagazine</strong><br><br><i>“简单与平衡的游戏玩法让《8-bit Armies》成为了一款独立游戏明珠！这款游戏让我欲罢不能，太好玩了，我可没开玩笑！”</i><br><strong>- Just Press Start</strong><br><br><i>“我非常喜欢这款游戏，绝对值得购买。”</i>还有……<i>“这游戏太好玩了，爱死它了！”</i><br><strong>- Worth A Buy (YouTube)</strong></li></ul>"
d0140c56-22eb-4c3f-8b99-7dd0bdb3c37d,ABZU,"沿袭 Journey® 和 Flower® 蕴含的艺术思想，ABZÛ 是一款能唤起你的潜水梦想的唯美海底冒险游戏。沉浸在生机勃勃的神秘海洋世界中，这里色彩缤纷，生物繁多。作为一名潜水员，通过优美的游泳控制表演水中杂技。探索成百上千种以真实生物为原型的独特物种，与丰富的海洋生活形成紧密联系。与数以千计的鱼群互动，它们会按程序对你、彼此和捕食者作出回应。徜徉在史诗般的海景之中，探索空前详细的海洋生态系统。深入海洋中心，探寻被遗忘的古老秘密谎言。但要注意，危险就潜伏在深处。“ABZÛ”源自最古老的神话，AB 意为水，ZÛ 意为探知。ABZÛ 代表智慧之海。"
b771a230-cd6e-4b64-ad3b-76a29dce4e53,"Accel World VS. Sword Art Online Deluxe Edition","斯瓦特阿尔普海姆与加速世界开始融合。在一片溷乱中结衣失去踪影，为了获得结衣的线索，桐人必须击败加速世界的七位纯色之王。<br />
<br />
此游戏版本包含DLC「异世界的漂流者」。<br />
<br />
可随心驾驭动画与小说裡众多登场角色。<br />
利用各项飞行技能、魔法、剑技进行刺激的空中战斗！<br />
甚至能以强力跳跃抵抗地心引力自由移动，伺机给予敌人致命一击！<br />
同时支援组队战斗，多人游玩模式下最多可让4名玩家连线组队冒险。"
27c81745-98e2-4060-b055-e6318dc65126,"AER Memories of Old","<img src=""https://steamcdn-a.akamaihd.net/steam/apps/331870/extras/steamworks_AER_aboutGame_header_test01.png?t=1524052147"" ><br><br>古老的诸神已被遗忘，迷失让世界分崩离析的大事件中，只在天空中留下零落的岛屿。这个充满无尽天空、多彩岛屿和古代遗迹的神秘世界，正面临着跌入黑暗深渊之中的危险。作为仅存的变形人之一，你被派去朝拜诸神之地。揭开可以帮你拯救现实的秘密。<br>	<br><ul class=""bb_ul"">	<li>	自如变身飞鸟，去飞行和探索。<br></li><li>	一个充满隐藏秘密和全新发现的广阔世界<br></li><li>	一次集奥秘、谜题和神庙的朝圣之旅<br></li><li>	充满活力的抽象艺术风格，着重展现游戏氛围和画面</li></ul>"
583cee91-1913-4e9d-b51d-e27083420001,"Age of Empires II HD","在《帝国时代二：高清版》中, 原版游戏的忠实玩家和新玩家同台竞技, 一同体验这款游戏的乐趣. 在这里您将能体验到经典的国王时代和征服者战役. 在横跨千年的世界历史里有十八个曾叱咤风云的文明供您选择. 无论是单机还是与其他Steam玩家进行网络对战都充满乐趣, 让您惊心动魄, 满足您在各个时代征服世界的愿望. 《帝国时代二》这款游戏最早由Ensemble工作室设计制作, 后来经Hidden Path密道娱乐公司, Skybox天盒实验室, Forgotten Empires失落帝国制作组改良重制成高清版本, 现在由微软工作室在Steam上隆重推出!"
a47c6b5c-eaf9-4391-8b7a-b6eb170427c3,"Age of Empires II HD: The Forgotten","欢迎进入《帝国时代二高清版: 失落帝国》! 这是帝国时代二征服者在推出十几年后的第一款官方资料片. 在这里你可以和朋友一起尝试五个全新的文明和科技, 体验7个全新的战役, 在新的游戏模式和各种新的地图中打败你的敌人. 你还可以通过twitch.tv直播或者讲解游戏对战! <br> <br>《帝国时代二: 失落帝国》是基于帝国时代二高清版的资料片, 内置Steam玩家作坊, 资料片基本排名, Steam贸易卡片和更多游戏属性! <br> <br> 帝国时代二: 失落帝国》为您带来全新的体验, 它包括<br> <ul class=""bb_ul""><li>五个全新的民族<br> <ul class=""bb_ul""><li>意大利 - 你扮演着一位在罗马帝国瓦解之后意大利共和国的将军, 扬帆驶向威尼斯城! <br> </li><li>印度 - 你将指挥千军万马, 其中还有大量的骆驼军团和大象方队. <br> </li><li>斯拉夫 – 在蒙古金帐汗国分崩离析后, 你麾下百万雄师的铁蹄, 又将再次震撼这片冰冷的东欧平原.<br> </li><li>马扎尔 - 你所率领匈牙利黑军, 在匈牙利平原上所向披靡, 无坚不摧. 要知道, 你指挥的可是欧洲中世纪里出现过的最强大的骑兵部队啊! <br> </li><li>印加 - 在著名的秘鲁的的喀喀湖边上, 为了守护你们世代相传的土地与遗迹, 你在欧洲征服者面前毫无惧色, 与他们血战到底, 还建造了流传千年的世界奇观. </li></ul> <br> </li><li> 七个全新的战役<br> <ul class=""bb_ul""><li>阿拉里克: 公元4世纪的那场匈奴入侵, 给这位可怕的哥特王带来的创伤改变了他的一生. 年幼的他从战火纷飞的故土逃离出来, 终其一生都在寻找另一个能重建家园的地方. 这位敬爱的国王能为他的子民在破败的罗马帝国疆域上打下自己的江山吗? <br> </li><li> 斯福尔扎: 在亲眼目睹了父亲的死后, 这个年轻的将军毫不犹豫地接手掌管了他先父的雇佣军团. 为了荣誉和财富, 斯福尔扎驰骋在15世纪的意大利半岛, 为出价最高的雇主提供军队支持, 所向披靡. 他会选择正确的战斗, 还是错误的敌人? 这个年轻的雇佣军团团长的命运都掌握在您手里. <br> </li><li>巴里: 罗马灭亡的四百年之后, 意大利仍是一个群雄割据之地. 作为南部的主要海港城, 巴里是拜占庭人, 哥特人, 诺曼人和穆斯林人等兵家必争之地. 这个战役讲述了一个普通的拜占庭军人家族在一场场争夺巴里的战争中英勇的表现, 和最后成为显赫世家的传奇故事. 要知道巴里城的争夺关乎的不仅仅是一座城池, 而是整个南意大利的安危. <br> </li><li>德古拉: 15世纪中期的战乱历史铸造了这位瓦拉几亚统治者传奇的一生. 在与日渐壮大的奥斯曼帝国的斗争中他死守阵地毫不退让, 他血腥而残忍的手段更让他成为东欧最可怕的人. 他手下对他的忠诚和他对鲜血的渴望可以一直把土耳其人抵御在国门之外吗? <br> </li><li>黄金国: 加入弗朗西斯科·德·奥雷利亚纳和贡萨洛·皮萨罗的探险队在广袤的亚马逊热带雨林寻找那深藏着的传说中失落的黄金之国. 他们在亚马逊河流域的探索会给他们带来永世的财富, 还是终身的遗憾呢? <br> </li><li>布里陀毗罗阇: 在12世纪末北印度群雄割据. 它们当中的兆汗王朝刚刚迎来了一位新主公, 他叫布里陀毗罗阇, 带着决心要打败所有对手, 一统江山. 但是, 上天对他开了一个玩笑, 让他爱上他敌人的女儿. 此后, 他的抱负将何去何从? 他是否有能力抵挡西边穆斯林人的全面入侵呢? <br> </li><li>失落帝国战役集锦: 历史的灰尘湮没了众多曾叱咤风云明震寰宇的英雄将领. 在他们生前的时代, 他们曾在沙场上指挥千军万马, 攻无不克战无不胜, 让对手闻风丧胆. 在这章战役里我们重温狮心王理查, 源赖朝, 奥斯曼·加齐和霍斯劳等英雄人物成就一代伟业的光辉历史吧. </li></ul> <br> </li><li> 全新超大型地图<br> </li><li> 内置Twitch.tv直播系统 <br> </li><li> 旁观模式<br> </li><li> 全新的游戏模式<br> <ul class=""bb_ul""><li>协议模式 - 这是前期喜欢专心发展经济, 后期才出军事的玩家常常选用的模式. 这种模式从《失落帝国》开始就有了, 又有人叫它为“禁止快攻”模式. 在这种模式下在游戏的初期所有玩家都无法对敌人发起进攻, 这样你在前期就可以专心发展而不用担心敌人的快攻骚扰了. <br> </li><li>抢夺圣物模式 - 这是一个节奏很快, 需要抢占先手的游戏模式. 玩家们需要用僧侣快速夺取地图中间的圣物, 并把它安全护送回自己城里, 供奉到寺庙中.  </li></ul></li></ul>"
aa4d181a-5e5b-47d8-861d-4fd05433dfe9,Agony,"<img src=""https://cdn.steamstatic.com.8686c.com/steam/apps/487720/extras/steam_logos.png?t=1527617096"" ><br><br>Platform: STEAM, PLAYSTATION 4, XBOX ONE<h2 class=""bb_tag"">STORY MODE</h2><br><img src=""https://cdn.steamstatic.com.8686c.com/steam/apps/487720/extras/2.jpg?t=1527617096"" ><br><br> 你的旅程始于一个在地狱深处饱受折磨、丧失了关于过去所有记忆的灵魂。<br><br><br>你拥有操控出现在你路途中的人类、甚至附身恶魔的特殊能力，这些都将成为你在极端条件下求取生存的必要措施。<br><br><br>通过探索极端恶劣的环境以及同地狱里其他疲惫的灵魂来往，玩家将会很快意识到只有一种方法可以逃离地狱，那就是找到神秘的赤色女神。<h2 class=""bb_tag"">《痛苦地狱》模式：</h2><br><img src=""https://cdn.steamstatic.com.8686c.com/steam/apps/487720/extras/3.jpg?t=1527617096"" ><br><br> 《痛苦地狱》具有完整的故事模式和开放的挑战系统，它能够随机产生不同的级别，以供玩家探索和求生，并获得更高的得分。这款由众筹平台（Kickstarter）融资的游戏，不仅被列在无数“最值得期待的恐怖游戏2018”榜单中，而且以其恶劣和恐怖的生存坏境不断挑战玩家的技能和潜力。<br><br><img src=""https://cdn.steamstatic.com.8686c.com/steam/apps/487720/extras/1.jpg?t=1527617096"" ><br>《痛苦地狱》将你抛掷在地狱中，让你努力求生，并去解开神秘的赤色女神背后的谜团——她是这个悲恸险境的建筑师,也是唯一知道如何逃生的实体......除了故事本身，还有更多的元素值得探索。 被噩梦生物萦绕，你将获得拥有附身恶魔和其他灵魂的能力，从而求取逃离地狱的方法。<br><img src=""https://cdn.steamstatic.com.8686c.com/steam/apps/487720/extras/steam_art_transparent.png?t=1527617096"" >"
932a64b6-ce25-44e1-b514-75b4166b5c04,"Alan Wake","妻子在与最畅销的作家艾伦韦克度假时神秘失踪，他必须追寻自己神志不清的状况下拟写的每一页恐怖小说。在夜幕降临的亮瀑镇，推动濒临的理智苏醒并且与他们战斗。解开其中的谜团，并拯救他的爱人。<br><br>以美剧的手法呈现，艾伦韦克使用 Remedy 的招牌叙述方式以及紧张火爆的情节。当玩家陷得越深，越能体验其中的悬疑。他将面对各种事件，情节曲折，扑朔迷离。他必须和散发光芒的器械并肩作战，只有它们能抢先一步抑制笼罩在亮瀑镇的黑暗。<br><br>游戏将以动作游戏为主题以及心理惊悚游戏为内涵，艾伦韦克剧烈的气氛，深层次的故事，特殊的战斗次序给玩家带来一个有趣并且独一无二的游戏体验。<h2 class=""bb_tag"">针对 PC 优化</h2><ul class=""bb_ul""><li>包含艾伦韦克的两部续集“信号”“作家”。<br></li><li>体验艾伦韦克中比XBOX 360 版本更高更逼真的西部景象。<br></li><li>完美支持鼠标键盘，如果你喜欢，也可以在电脑上接入微软XBOX 360手柄！<br></li><li>大量可自定义的图形设置并且支持 4：3 16：9和16：10的宽高比！<br></li><li>支持多线程的引擎，可充分利用4核心 CPU。<br></li><li>根据粉丝反馈的意见增加一些特性，包含调整视野半径，隐藏界面。<br></li><li>支持 AMD 宽域3D 3屏幕模式。</li></ul>"
143703a2-0333-40a6-a609-a58b13a58528,"Alan Wake's American Nightmare","<h1>Steam Big Picture</h1><p><a href=""http://store.steampowered.com/bigpicture/"" target=""_blank"" rel=""noreferrer""  ><img src=""https://steamcdn-a.akamaihd.net/steam/apps/108500/extras/check_it_out.png"" ></a><br>这款游戏完全支持控制器<br>于“大屏幕”中<br>了解更多内容</p><br><h1>关于游戏</h1>In this brand new standalone experience, Alan Wake fights the herald of darkness, the evil Mr. Scratch! A thrilling new storyline, hordes of creepy enemies, serious firepower and beautiful Arizona locations, combined with a fun and challenging new game mode make this a must for Alan Wake veterans, and the perfect jumping on point for new players!<h2 class=""bb_tag"">Key Features:</h2><ul class=""bb_ul""><li><strong>Play the full-fledged Story Mode:</strong> You’ll be on the edge of your seat as you fight to stop your murderous evil double to take back your life... and change reality itself!<br></li><li><strong>Fight till dawn arcade mode:</strong> In the action-packed Arcade Mode, you’ll need to master the Fight with Light mechanic to stay alive until dawn and beat your friends on the Leaderboards. Can you survive until sunrise?<br></li><li><strong>Face the darkness:</strong> Twisted and dangerous enemies stalk you in the shadows. Dispatch them with the powerful arsenal of weapons at your disposal.</li></ul>"
96c91d2e-82f6-4537-8d99-f4d60c9aa2f1,"Aliens vs. Predator™","为FPS爱好者们带来一场在科幻世界里最著名的两个角色之间爆发的传奇之战——AvP包含了3个出色的单人游戏战役，并带有令人无法自拔的独特的三向多人游戏体验。<br><br>体验焕然一新且令人战栗的第一人称游戏，在环绕着被诅咒的Freya's Prospect的致命的丛林和沼泽中生存、猎杀和捕食。<br><br><ul class=""bb_ul""><li>对于海军陆战队员，你会经历压抑而幽闭的恐怖体验——光明是你的朋友，但是你会觉得永远都不够用。但是，作为人类最后防线的美国海军陆战队，已经用高爆和自动武器武装到了牙齿。<br><br></li><li>身为铁血战士，你会从阴影和空中进行追踪，在树顶上矫健地穿行并伏击你的猎物。虽然你配备了一系列强力而奇异的武器和追踪装备，你的荣誉感最终还是趋势你必须接近你的猎物并和它进行面对面的战斗。<br><br></li><li>作为宇宙中最致命的种族，异型这个种族让你有机会体验一把身为噩梦的感觉——黑暗沼泽中的这些野兽们和难以计数的同类们，带着尖牙利爪不断推进。<br><br></li><li>你可以在本作独特的一系列三向在线模式中选择三个阵营中的任意一个对抗其他阵营，从獠牙到利爪再到脉冲步枪，在多人游戏中经历截然不同的心跳时刻。</li></ul>AvP使用Steam Cloud来存储游戏状态和技能信息，这些信息可以在以后进行多人游戏配对时作为参考。"
786630f1-118a-4bda-8d42-99ca938012ba,"Always Sometimes Monsters","<img src=""https://cdn.steamstatic.com.8686c.com/steam/apps/274310/extras/asmtitle.png?t=1510065936"" ><br><br>Out of money and out of luck you find yourself heart broken and on the verge of collapse. Your landlord's taken the key back, you can't finish your manuscript, and your beloved is marrying someone else. With no choice but to handle whatever life throws at you, you set out on the open road on a mission to win back the love of your life. The story from there is up to you. Can your life be salvaged, or are we always sometimes monsters?<br><br><u>Choice</u><br>A story-driven experience focusing on relationships and emotional bonds rather than traditional RPG combat and adventuring. Indecision is your enemy and empathy is your weapon in a quest to earn one last chance to win back the love of your life.<br><br><u>Circumstance</u><br>Choose from characters of different gender, race, and sexual preference and live through the common experiences and unique hardships of each based on your selection. NPCs may treat you differently based on your gender, race, or sexual preference opening and closing different paths along the way.<br><br><u>Consequence</u><br>Each playthrough is filled with a staggering number of diverging paths that can be discovered through both overt actions and subtle choices in conversation. The journey you experience will be tailored to your personal ethical compass as your decisions both conscious and subconscious change your fate.<br><br><a href=""http://store.steampowered.com/app/274190"" target=""_blank"" rel=""noreferrer""  ><img src=""https://cdn.steamstatic.com.8686c.com/steam/apps/274310/extras/soundtrack.png?t=1510065936"" ></a><br><br>Download the original Always Sometimes Monsters soundtrack by <a href=""https://steamcommunity.com/linkfilter/?url=http://laserdestroyerteam.bandcamp.com"" target=""_blank"" rel=""noopener""  >LASER DESTROYER TEAM</a> featuring 15 remastered tracks from the game. <a href=""https://steamcommunity.com/linkfilter/?url=http://laserdestroyerteam.bandcamp.com"" target=""_blank"" rel=""noopener""  >Available on Bandcamp</a>."
