9054844e-d830-4f22-a54a-518e1375722a,"Syberia 3","<h1>数字豪华版</h1><p><img src=""https://steamcdn-a.akamaihd.net/steam/apps/464340/extras/SYBERIA_MOCK-UP_BASE_SP4-XBOX-PC_UK-FR616.png?t=1510596076"" ><br><br><br>Digital Deluxe Edition includes: <br><ul class=""bb_ul""><li>Digital Standard Game<br></li><li>Digital Soundtracks (*mp3)<br></li><li>Exclusive Digital 20 first pages  of the next Comic Books (*Pdf)<br></li><li>1 Digital Wallpaper</li></ul></p><br><h1>关于游戏</h1><h2 class=""bb_tag""><strong>Author and creator : Benoît Sokal</strong></h2><h2 class=""bb_tag""><strong>Overview:</strong></h2><br>The limitless imagination of Benoît Sokal continues in Syberia 3, focusing on an entirely new adventure. After abandoning the island, Kate is found dying on the edge of a river by the Youkole tribe, a nomadic people migrating with their snow ostriches. Stuck in Valsembor village, together they must find a way to continue their journey in a race against their enemies and unexpected obstacles, not to mention Kate's past, which catches up with her.<br><br>The next generation in adventure games, Syberia 3 takes you inside an enchanting, mysterious universe full of life for you to explore in 3D. Plunged into the heart of a world inhabited by a cast of interesting characters, you'll discover and experience a fabulous tale as imagined by Benoit Sokal.<br><br><ul class=""bb_ul""><li>A brand new tale, completely different from the first two Syberia games<br><br></li><li>Exceptionally immersive storytelling, multiplied by Benoit Sokal's unparalleled artistic direction<br><br></li><li>Explore Benoit Sokal's poetic universe in 3D for the first time<br><br></li><li>Original score by Inon Zur (Syberia 2, Fallout, Dragon Age, Prince of Persia)<br><br></li><li>Original, real-time 3D puzzles and mysteries</li></ul><h2 class=""bb_tag""><strong>Previously in Syberia</strong></h2><br>A lawyer in NYC, Kate Walker was sent to Europe on a simple mission that gradually transformed into personal quest, an adventure that led her on a voyage aboard a locomotive bound for the reaches of the Europe. Accompanied by an automaton named Oscar, she fulfilled inventor Hans Voralberg's dream, searching for the last mammoths all the way on the legendary island of Syberia."
f6b8e3e6-fcd3-415b-aa82-6094c638ae24,"Tabletop Simulator","<h1>VR Support</h1><p>Take your tabletop gaming to a whole new level in virtual reality with the HTC Vive &amp; Oculus Rift! And what's more, both VR and non-VR players alike can play together in the same game room!</p><br><h1>关于游戏</h1>Create your own original games, import custom assets, automate games with scripting, set up complete RPG dungeons, manipulate the physics, create hinges &amp; joints, and of course flip the table when you are losing the game. All with an easy to use system integrated with Steam Workshop. You can do anything you want in Tabletop Simulator. The possibilities are endless!<br><br><img src=""https://steamcdn-a.akamaihd.net/steam/apps/286160/extras/TTS-Store01.jpg?t=1518127108"" ><h2 class=""bb_tag"">Endless Games</h2><br>Tabletop Simulator has it all. The base game includes 15 classics like Chess, Poker, Jigsaw Puzzles, Dominoes, and Mahjong. Additionally, there are thousands of community created content on the Workshop. If you’re the tabletop gaming type, we include an RPG Kit which has tilesets &amp; furniture, as well as animated figurines that you can set up and battle with your friends, with even more options in the Chest. There’s even an option for Game Masters so they can control the table!<br><br><img src=""https://steamcdn-a.akamaihd.net/steam/apps/286160/extras/TTS-Store08.jpg?t=1518127108"" ><h2 class=""bb_tag"">Create Games</h2><br>If you’re into creativity and prototyping, you can easily create your own games by importing images onto custom boards &amp; tables, create custom decks, import 3D models, create scripts, and much more. You can choose to upload your creations on the Steam Workshop or share them privately with your friends.<br><br><img src=""https://steamcdn-a.akamaihd.net/steam/apps/286160/extras/TTS-Store02.jpg?t=1518127108"" ><h2 class=""bb_tag"">Fun For All Ages</h2><br>Everyone can play Tabletop Simulator! Play a classic board game with grandma, have poker night with the guys, or start your epic RPG adventure with your crew. Play almost any tabletop game you can think of! Being a multiplayer-focused game, up to <strong>10</strong> players can play at any given time. <br><br><img src=""https://steamcdn-a.akamaihd.net/steam/apps/286160/extras/TTS-Store05.jpg?t=1518127108"" ><h2 class=""bb_tag"">DLCs</h2><br>Our downloadable content (DLCs) are different from other games, as we partner with developers and publishers to bring their games into Tabletop Simulator. Each DLC is custom created with  high quality assets and  special themes that match their games. And best of all, only the host needs to own the DLC for everyone at the table to play.<br><br><img src=""https://steamcdn-a.akamaihd.net/steam/apps/286160/extras/TTS-Store07.jpg?t=1518127108"" ><br><br><strong>Key Features</strong>:<br><br><ul class=""bb_ul""><li>Online sandbox with unlimited games to play how you want.<br></li><li>Multiplayer physics with objects that collide and interact just how you would expect. <br></li><li>Create your own mods easily with full Steam Workshop support and 3D model importing. <br></li><li>Take games to the next level with Lua scripting support.<br></li><li>Play just like you do in real life; pick up, rotate, shake, and throw any object.<br></li><li>Up to 10 people can play together on the same table.<br></li><li>Team system with voice and text chat.<br></li><li>Save &amp; load individual objects and complete games.<br></li><li>Hotseat allows you to play locally on the same computer with your friends.<br></li><li>Browse the internet, listen to music, and watch videos in multiplayer, in-game on a tablet. <br></li><li>Perfect for RPGs - build your very own roleplaying dungeons with our modular tileset, RPG Kit, Multiple States and Tablet (useful for character sheets). <br></li><li>Great admin tools to enable or disable player permissions and to eliminate griefing in public games. <br></li><li>360° panoramic backgrounds that change the lighting and atmosphere. <br></li><li>Included games: Backgammon, Cards, Chess, Checkers, Chinese Checkers, Custom Board, Dice, Dominoes, Go, Jigsaw Puzzles, Mahjong, Pachisi, Piecepack, Poker, Reversi, RPG Kit, Sandbox, Solitaire, and Tablet.</li></ul>"
eddf6ff9-cabd-4caf-b32a-99501850e1ec,"Tales From Space: Mutant Blobs Attack","<h1>Big Picture Mode</h1><p><a href=""http://store.steampowered.com/bigpicture/"" target=""_blank"" rel=""noreferrer""  ><img src=""http://storefront.steampowered.com/v/gfx/apps/108500/extras/check_it_out.png"" ></a></a><br>这款游戏完全支持控制器<br>于“大屏幕”中<br>了解更多内容</p><br><h1>关于游戏</h1><strong>Tales from Space: Mutant Blobs Attack</strong> is a sci-fi puzzle-platformer of cataclysmic proportions. You’re a Blob of alien origin with mutant powers and an insatiable appetite. To the great horror of your former captors (and all of humanity), you have escaped into the world. Consume Everything!!! Regret Nothing!!!!<h2 class=""bb_tag"">Key Features:</h2><ul class=""bb_ul""><li><strong>INSANE GROWTH</strong> -- Start the size of a tennis ball. Grow to massive proportions.<br></li><li><strong>STEAM FEATURES</strong> -- Trading Cards! Leaderboards! Achievements! Cloud Save! Big Picture Mode!<br></li><li><strong>RETRO STYLE</strong> -- 50’s-inspired art &amp; music paired with B-movie-inspired humor.<br></li><li><strong>MUTANT POWERS</strong> -- Fly like a bottle rocket, stick to things like a fridge magnet, or use the powers of telekinesis to move platforms. </li></ul>"
35a2b424-b924-473b-9dc7-7a598d5d3257,"Tales of Zestiria","為理想堅持到底！<br><br>統治權和至高無上的霸權誘惑逼使兩大民族短兵相接，世界因此分崩離析。義無反顧接下牧羊人重擔的您挺身對抗人類的無知罪惡，保護世界不受「汙穢」危害，並重新凝聚人類和天<br>在守護聖劍的湖中女性－萊菈和密友米克利歐陪伴下，主角很快將察覺強大黑暗勢力的崛起。<br><br><ul class=""bb_ul""><li> 踏上史雷史詩般的旅程，體驗知名動畫製作公司ufotable所呈現的精美中世紀幻想世界。<br></li><li> 在與天族相伴協助的冒險的過程中，發掘豐富、浩瀚的遊戲世界。<br></li><li> 融合史雷與天族的嶄新戰鬥系統，告別載入或轉換畫面程序，使戰鬥畫面完美融入遊戲環境。</li></ul>"
a272e344-596c-4bf1-b5ec-694a7a0960c4,"TEKKEN 7","<h1>数字豪华版</h1><p><img src=""https://steamcdn-a.akamaihd.net/steam/apps/389730/extras/T7_PC_Custom_Deluxe.PNG?t=1511774477"" ><br><br>Get TEKKEN 7 Deluxe Edition and expand your fighter's journey with two additional playable characters, a new game mode and hundreds of additional costumes. As an exclusive gift for purchase, receive over 30 metallic costumes for your characters and shine in the Iron Fist Tournament!</p><br><h1>关于游戏</h1><img src=""https://steamcdn-a.akamaihd.net/steam/apps/389730/extras/Gifs-Tekken_3.png?t=1511774477"" ><br><br>Discover the epic conclusion of the Mishima clan and unravel the reasons behind each step of their ceaseless fight. Powered by Unreal Engine 4, TEKKEN 7 features stunning story-driven cinematic battles and intense duels that can be enjoyed with friends and rivals alike through innovative fight mechanics.<br><br>Love, Revenge, Pride. Everyone has a reason to fight. Values are what define us and make us human, regardless of our strengths and weaknesses. There are no wrong motivations, just the path we choose to take.<br><br>Expand your fighter's journey by purchasing the Tekken 7 Season Pass separately and gain access to stunning additional content"
1f0738f3-2973-46f3-9354-3242627653e8,"TEKKEN 7","<h1>数字豪华版</h1><p><img src=""https://steamcdn-a.akamaihd.net/steam/apps/389730/extras/T7_PC_Custom_Deluxe.PNG?t=1511774477"" ><br><br>Get TEKKEN 7 Deluxe Edition and expand your fighter's journey with two additional playable characters, a new game mode and hundreds of additional costumes. As an exclusive gift for purchase, receive over 30 metallic costumes for your characters and shine in the Iron Fist Tournament!</p><br><h1>关于游戏</h1><img src=""https://steamcdn-a.akamaihd.net/steam/apps/389730/extras/Gifs-Tekken_3.png?t=1511774477"" ><br><br>Discover the epic conclusion of the Mishima clan and unravel the reasons behind each step of their ceaseless fight. Powered by Unreal Engine 4, TEKKEN 7 features stunning story-driven cinematic battles and intense duels that can be enjoyed with friends and rivals alike through innovative fight mechanics.<br><br>Love, Revenge, Pride. Everyone has a reason to fight. Values are what define us and make us human, regardless of our strengths and weaknesses. There are no wrong motivations, just the path we choose to take.<br><br>Expand your fighter's journey by purchasing the Tekken 7 Season Pass separately and gain access to stunning additional content"
f86b539e-f9a6-436f-b86e-161143143486,"Teleglitch: Die More Edition","<h1>Steam Big Picture</h1><p><a href=""http://store.steampowered.com/bigpicture/"" target=""_blank"" rel=""noreferrer""  ><br><img src=""http://storefront.steampowered.com/v/gfx/apps/108500/extras/check_it_out.png"" ></a></a></p><br><h1>关于游戏</h1>In a cold, dark future dominated by mega-corporations, a small lonely planet on the edge of habitable space is the site of a shadowy research facility specializing in necrotic tissue reactivation. You are a scientist who has suddenly awoken to the realization that you are the lone survivor. The rest of the facility’s personnel have all been killed – micro-chipped and reactivated as combatants by the facility’s central processing AI. <br><br>Teleglitch: Die More Edition is a roguelike top-down shooter with retro pixel graphics. Featuring procedurally generated maps that change with each play through, you will never experience the same facility twice.  Clutch your gun, walk down the dark corridors and enter each new room hoping those last few rounds of ammunition will be enough. Feel the anxiety, the paranoia and the sheer terror of Teleglitch.<h2 class=""bb_tag"">Key Features</h2><ul class=""bb_ul""><li> Over 20 types of enemies to combat<br></li><li> More than 40 types of weapons and items<br></li><li> 10 levels that radically change their structure every time you play<br></li><li> 10+ hours of play time (it gets harder the further you get)<br></li><li> Detailed database with full dossiers of each monster<br></li><li> Scavenge random equipment to craft new and deadly gear like The Can Gun (empty can + nails + explosives)<br></li><li> A sinister narrative filled with greedy military corporations covert experiments<br></li><li> The risk of permanent death creates an atmosphere of fear and dread </li></ul><br><strong>The Die More Edition features:</strong><br><ul class=""bb_ul""><li> 5 bonus levels<br></li><li> Additional items and weapons<br></li><li> Upgraded and more deadly enemy AI<br></li><li> Expanded dossiers and lore content</li></ul>"
9a7ac1ca-3e56-4982-af65-199df425df70,"Tempest: Pirate Action RPG","<strong>游戏特色</strong><h2 class=""bb_tag""><img src=""https://steamcdn-a.akamaihd.net/steam/apps/418180/extras/1.png?t=1521469838"" ></h2><br><ul class=""bb_ul""><li><strong>永远不会无聊</strong><br>三大区域、数十座岛屿、几百项任务！<br></li><li><strong>自由畅行</strong><br>实时无限航海——还可在需要时查看全球地图！<br></li><li><strong>海盗联盟</strong><br>与好友分享 Tempest 世界。一起掠夺、交易、做任务，或者彼此宣战，让海洋上的战火燃烧起来！<br></li><li><strong>纯粹的个人游戏</strong><br>想在海洋上做一匹孤狼？多人游戏只是一个方案，游戏最初的设计就是单人游戏模式。<br></li><li><strong>航海家的冒险</strong><br>购买船只、升级并装扮船只！<br></li><li><strong>成为海盗：商人还是强盗？</strong><br>要么低买高卖、赚取利润；要么掠夺船只、击沉敌舰、摧毁堡垒！<br></li><li><strong>对抗海中巨怪</strong><br>挪威海怪的朋友们正对你虎视眈眈！<br></li><li><strong>作战武器不只是大炮</strong><br>用神秘水晶躲避敌人的炮弹，将天上陨石引落到敌人头上，或者召唤一只巨大章鱼帮你消灭敌人！<br></li><li><strong>组建一支伟大而忠诚的水手团队</strong><br>升级你的海盗，让他们从见习水手成长为经验丰富的老水手！</li></ul><h2 class=""bb_tag""><img src=""https://steamcdn-a.akamaihd.net/steam/apps/418180/extras/7.png?t=1521469838"" ></h2><br>船长！海盗旗正在您的船上迎风招展，是时候去海上巡逻一番，掠夺几艘货物满满的商船，然后去攻打一些坚固的堡垒。赶快扬帆前行，寻找那些等待人发现的传奇宝物！<br>当初开发 <i><strong>Tempest</strong></i>, 我们关注的是海盗生涯中最刺激的部分——海战。 <br>当你航行在危险的海域中时，你不只会撞见商船，还会遇到其他海盗、诡异的邪教信徒、以及可怕的神秘海怪：挪威海怪、Leviathan 海怪、还有其他邪恶生物。<br>你可以通过各种方式定制你的战船，让它成为所有海盗的自豪和快乐。几乎所有部件都可免费更换——从旗帜和帆的颜色到船体和船头雕饰。<br>当然了，在每场战争中，你都有很多武器可以选择，包括大炮、迫击炮、火焰喷射器等。此外还有很多特殊工具，可以让你随意对船进行改造。不过，只有完成多级任务“传说”，才能赢得最棒的神器。<h2 class=""bb_tag""><img src=""https://steamcdn-a.akamaihd.net/steam/apps/418180/extras/16.png?t=1521469838"" ></h2><br>捕猎愉快！"
fe822104-96c8-4625-a7f7-f65844bb57e4,Tengami,"《Tengami》是一款以日式立体书形式巧妙建构而成的冒险游戏，玩家藉着翻页与滑动等简单动作，来解开各式的谜题与发现隐藏的秘密。<br><br><strong>探索折叠於书中的美妙世界 </strong><br>经由突出的视觉风格丶独特的游戏过程，还有摄人心弦的优美配乐，让玩家沉浸於日本古老的神话传说当中。体验幽暗的森林丶荒废的神社以及宁静的山涧水瀑，并找出枯萎凋零的樱树背後的秘密。 <br><br><strong>前所未有的立体书游戏方式 </strong><br>不是单纯的一本书，而是存在於书中的游戏。《Tengami》玩起来的感觉有别於过去所有的游戏。藉着直觉地翻页丶折叠与滑动这个世界中的物件，在这神秘的旅程中进行探索。 <br><br><strong>震慑人心的游戏配乐 </strong><br>由知名作曲家 David Wise 谱下的优美配乐，将令你感到馀音绕梁丶不绝於耳。强烈建议游玩时戴上耳机，以获得最完整的体验。 <br><br><strong><br>真实而精致 </strong><br>《Tengami》的世界是「真的」立体折叠书，我们为了做到这点特地开发了全新的技术。所有在游戏中看到的结构，都可以在现实中用纸丶剪刀与酱糊制作出来。 <br><br><br> "
5616b26c-e891-40ea-8a4b-bcbf57e91332,"Tennis World Tour","<strong>网球巨星</strong><br>• 以世界前 30 名最佳球员之一的角色游玩：罗杰·费德勒、安洁莉克·克伯、斯坦·瓦林卡以及许多体育传奇。<br><br><strong>完美再现的移动方式</strong><br>• 逼真的动画、以动作捕捉技术精心重制的动作、能帮助你学习现代网球的各种击球方式：切球、高吊球、上旋球……以及其他。<br><br><strong>各种比赛地面</strong><br>• 18 种球场：硬地、泥地、草地、地毯甚至是硬木。每种地面都会影响比赛条件。<br><br><strong>完整的生涯模式</strong><br>• 创建你的球员，体验专业选手杰出的职业生涯：进行训练、锦标赛、人员管理、装备购买……等等。<br><br><strong>无与伦比的战术维度</strong><br>• 决定每场比赛该使用何种策略，用你的技能卡击败对手。"
5629d8d2-86b9-4a78-a0fe-4179e5d2873a,Terraria,"挖掘，战斗，探索，建造！在这个动感十足的冒险游戏里没有什么是不可能的。世界是你的画布，地面是你的油漆。 <br>拿起你的工具出发！制造武器和各种各样的敌人作战。前往地下寻找配件，金钱，以及其他有用的东西。收集资源创造你的世界所需要的一切。建造一栋房子，一个堡垒，甚至是一座城堡。人们会搬到那里居住，而或许他们还会卖给你不同的商品来协助你完成旅程。<br>但要注意，那有很多挑战在等着你……你能完成任务吗？<br><strong>主要特点：</strong><br><ul class=""bb_ul""><li>沙盒游戏<br></li><li> 随机生成的世界<br></li><li>免费的内容更新</li></ul>"
d42e45a8-ba0c-4519-9d36-87a50c6ea16f,Teslagrad,"特斯拉学徒<br />
探险之旅已经开启...一座险象环生的塔楼...去揭其中的谜团！去揭晓暗藏在废弃已久的特斯拉塔楼中的玄机！在磁力及其他电磁能量的辅助下探索手绘图编织而成的唯美立体世界，体验古老欧洲的朋克文化。"
3c188220-7e7e-449a-8b49-19dae9f42432,"The Banner Saga","<h1>数字豪华版</h1><p>豪华版——在Banner Saga游戏中加入了官方音乐合辑，包括29首游戏周边曲目，它们是由格莱美提名、两次荣获BAFTA Award大奖的作曲家Austin Wintory创作，由Dallas Winds管弦乐团演奏，以及由YouTube上最热门的三人表演组合：人声表演者Peter Hollens和Malukah、小提琴演奏者Taylor Davis联袂呈现的。</p><br><h1>关于游戏</h1>在这款挪威史诗级的角色扮演游戏中闯荡江湖，你的每一个战略性的选择都会影响全程。在这片充满荆棘与困难的土地上，与同伴一起旅行时结交同盟。在挑选战友的时候要格外注意，他们应能够帮助你打击那些威胁到整个人类文明的敌对势力。随着故事的展开，你在旅途、对话和战斗中的每一个决定都对最终的结果有影响。并非所有人都能活下来，都会被永远记住。<h2 class=""bb_tag"">主要特色</h2><ul class=""bb_ul""><li><strong>玩家的选择会推进独特的故事线发展</strong>——你在旅途、对话和战斗中作出的每一个决定，都对故事的发展有着决定性的影响。<br><br></li><li><strong>战略战斗影响深远</strong>——战斗的成败，以及角色的永久损失，都取决于你选择的战斗角色和之后做出的决定。<br><br></li><li><strong>旅程与战斗一样重要</strong>——在穿越这片冰冻土地的时候，你的职责是建设和管理这支队伍，这不仅对于你自己的生存异常重要，对于整个文明也是举足轻重。<br><br></li><li><strong>受挪威神话启发而创造的2D幻想国度</strong>——沉浸在美妙的手绘战斗场景和动画中，欣赏由格莱美提名的作者家Austin Wintory为你带来的醉人乐章，让你迷失在北欧神秘而华美的气氛中。<br><br></li><li><strong>强化了多人联机对战</strong>——在免费的多人联机游戏“Factions”中磨练自己的战斗技术。与Banner Saga中诸多角色分类的玩家展开激烈的竞争。</li></ul><br><strong>Banner Saga是我们计划的三部曲中的第一部。如果完成了这部游戏，你个人的进度和游戏情节将继续在下一部曲中展开来。</strong>"
5fbebaf0-14f3-4f51-872a-e80e5fc43ddf,"The Banner Saga 2","<h1>最新更新</h1><p>Survival Mode is a new gameplay mode that is all about staying alive through as many battles as possible! <br><br>To play, simply click on the Survival Mode banner on the start screen of Banner Saga 2.<br><br>Note: This is a gameplay mode available to all Banner Saga 2 owners and not a separate DLC.</p><br><h1>数字豪华版</h1><p>The Deluxe Edition – Combines Banner Saga 2 with the official soundtrack which includes 25 tracks by Grammy nominated, and two time BAFTA Award winning, composer Austin Wintory, performed by the Colorado Symphony plus a powerhouse group of soloists: vocalists Peter Hollens and Malukah, violinist Taylor Davis, and the phenomenal Icelandic band called Árstíðir.</p><br><h1>关于游戏</h1><img src=""https://steamcdn-a.akamaihd.net/steam/apps/281640/extras/BS2Notice.png?t=1515001598"" ><br><br>The award-winning adventure continues in Banner Saga 2! This epic, story-based, role-playing game continues its emotional journey across a breaking world. Bold leadership decisions, wise use of resources, and skillful battle tactics are vital to ensure your viking clans make it through alive. Experience what took the indie gaming world by storm in Banner Saga 2!<br><br>KEY GAME FEATURES<br>•	The epic Viking saga continues on – beautifully 2D hand drawn combat sequences and animations are further enhanced with special effects, once again accompanied by an evocative score from Grammy-nominated composer Austin Wintory<br>•	Player choice that continues to drive your narrative – your story continues based on choices made in the first game as well as hard choices you have to make in this one.<br>•	New Characters and a New Race – continue your epic journey interacting with new characters and a new race, the Horseborn.<br>•	Improved Strategic combat with consequences – improved, more strategic battle boards enhance combat and permanent loss of characters will still weigh heavy on your mind long after the battle is over. <br>•	The journey is as important as battle – your role in building and managing your caravan as you travel the vast landscape is critical to not only your own survival but the survival of an entire civilization."
