3162d993-705a-495b-a000-e1da701b97d2,"A Way Out","Skaparna av Brothers – A Tale of Two Sons presenterar ett rent samarbetsäventyr. I A Way Out spelar du en av två fångar som rymmer från fängelset.

Det börjar som en spännande flykt men blir snabbt ett oförutsägbart och känslosamt äventyr som inte liknar något du sett eller spelat förut.

A Way Out är en upplevelse som måste delas av två spelare. Varje spelare styr en av huvudkaraktärerna, Leo och Vincent, som motvilligt hjälps åt för att rymma från fängelset till friheten.

Upplev hela äventyret med dina kompisar utan kostnad, genom vårt kostnadsfria kompispass. När du har köpt det kompletta spelet kan du bjuda in en vän online, vare sig vännen har köpt spelet eller inte. På menyn i spelet skickar du en inbjudan, vännen låser upp den kostnadsfria testversionen och sen är ni redo att uppleva hela spelet tillsammans."
bacc8e26-4148-4dac-af69-3d2443fda9c6,"Alice: Madness Returns™","För elva år sedan förlorade Alice sin familj till en fruktansvärd brand vilket har gett henne men för livet. Hon spärrades in på Rutledges psykiatriska sjukhus där hon försökte ta itu med sina demoner genom att sjunka djupare och djupare ner i Underlandet. Nu, tio år senare har hon äntligen beviljats sin frihet – men hon bär fortfarande på den tragiska händelsens tunga psykiska börda. Med ett splittrat psyke klarar hon inte av skräcken som hennes underliga minnen, drömmar och visioner ger henne. Hon kanske skulle klara sig bättre i Underlandet? Det brukar hon ju. Hon reser dit för att hitta allt det som den ""riktiga"" världen inte kan erbjuda: trygghet, kunskap och sanningen om det som ha hänt. Men under hennes frånvaro har Underlandet förändrats. Något fruktansvärt har hänt och en stor ondska sänker sig över den en gång så magiska platsen. Kan Alice rädda Underlandet och sig själv från den dårskap som hemsöker dem båda? FUNKTIONER OCH INNEHÅLL • Intensiv tredjepersons-action: Ett flertal uppgraderingsbara vapen som den explosiva tekannekanonen, den bestraffande leksakshästen och det klassiska svärdet Vorpal. • Utforska ett mörkt och splittrat Underland:  Träffa på bekanta men något förvandlade karaktärer som Cheshire-katten, Den galne hattmakaren, Larven och Den röda drottningen. • Magiska förmågor:  Få konstiga förmågor i Underlandet som att sväva med Alice klänning, krympa och växa till enorm, fiendekrossande storlek. • Interaktiva pussel:  Intuitiva och roliga pussel som att förvandla hinder, musik-memory, schack, och bildrutor. "
31d022fc-e7cb-4af1-be68-2f0fd3cabc23,"Battlefield™ 1","Battlefield™ 1 tar oss tillbaka till första världskriget, där ny teknologi och en global konflikt förändrade krigföringen för evigt. Bli en del av varje slag, kontrollera alla enorma fordon  och utför manövrar som vänder hela striden. Hela världen krigar – se vad som finns bortom skyttegravarna.Utvalt innehållFöränderliga miljöer runtom i världen. Upplev alla delar av den globala konflikten – kämpa i ockuperade franska städer, öppna ytor i de italienska alperna, eller i den arabiska öknen. Ingen strid är den andra lik. Fullt förstörbara miljöer och opålitlig väderlek ger ett landskap i ständig förändring;vare sig du förstör skydd, eller gör kratrar i marken är ingen strid den andra lik.
Enorma multiplayerstrider. Inta slagfältet i massiva multiplayerstrider för upp till 64 spelare. Storma in till fots som infanteri, led ett kavallerianfall och delta i så komplicerade strider att du kommer behöva dina kamrater för att klara dig.
Spelförändrande fordon. Vänd på krigslyckan med hjälp av stora och enorma fordon, pansarvagnar, propellerplan och gigantiska, mekaniska monster som kommer behövas i kristider. Ge eld från luften med det enorma luftskeppet, slit sönder slagfältet med det armerade tåget och bombardera land från havet med ett dreadnought-slagskepp.
Nya flerspelarläget Operations. I Operations ska du utföra en serie flerspelarstrider på flera delar av kartan. De anfallande ska trycka tillbaka försvarslinjen till nästa del av banan och försvararna ska stoppa deras framfart."
794687b2-c13c-405e-bcc8-47abc4c44bb2,"Battlefield™ 1 Revolution","Gå med i det starka Battlefield-communityt och upplev episka strider under det stora kriget i denna kritikerrosade firstperson-shooter. Kritikerhyllade Battlefield 1 fick Game Critics Awards Best of E3 2016: Best Action Game och Gamescom Best Action Game utmärkelse 2016.

Battlefield 1 Revolution levererar det kompletta paketet och innehåller:
Grundspelet 
Upplev det totala krigets gryning i Battlefield 1. Upptäck en värld i krig genom en äventyrsfylld kampanj, eller delta i storslagna lagbaserade strider för upp till 64 spelare. Slåss som infanteri eller kör otroliga fordon på land, i luften och till sjöss.
Battlefield 1 Premium Pass
Fyra tema-expansionspaket med nya multiplayer-banor, nya vapen med mera.

 Battlefield 1 They Shall Not Pass
 Battlefield 1 In the Name of the Tsar
 Battlefield 1 Turning Tides
 Battlefield 1 Apocalypse

Red Baron Pack, Lawrence of Arabia Pack och Hellfighter Pack – de innehåller tematiska vapen, fordon och emblem som är baserade på berömda hjältar och enheter."
235e63c6-dc20-48e8-9b58-e6c13bf74e4a,"Battlefield™ 1 Premium Pass","Erövra hela första världskriget med Battlefield™ 1 Premium Pass. Få tillgång till 16 flerspelarbanor, nya operationer och spellägen, elitklasser och mer i fyra expansionspaket med teman. Slutför utmanande vapenuppdrag för att låsa upp allt från nya knivar till nya handeldvapen. Utrusta dig och anfall på alla fronter!Möt fyra nya fronter i första världskriget:Upplev närstrider och enorma slag med stridsvagnar på västfronten i Battlefield™ 1 They Shall Not Pass.Gå med i kriget på den största fronten med den ryska armén. Kämpa i snötäckta raviner och en iskall skärgård i Battlefield™ 1 In the Name of the Tsar.Delta i första världskrigets amfibiska krigföring och var sedan med om den vågade Zeebryggeräden och Gallipolioffensiven i Battlefield™ 1 Turning Tides.Erövra bittert omstridd mark med brutala verktyg och delta i några av första världskrigets mest ökända strider i Battlefield™ 1 Apocalypse.Huvudinnehåll:Nya frontstrider. Gå med i den franska armén i They Shall Not Pass, kämpa för kontroll över östfronten i In the Name of the Tsar, ge dig ut på sjön i Turning Tides och upplev mardrömslik skräck i Apocalypse.Prioriterad tillgång till servrar. Hoppa över kön i flerspelarmatcher med VIP-åtkomst till serverköer – bara för spelare med Premium Pass.Gör dig redo för nya uppdrag, spellägen, vapen, elitklasser, fordon och mer. Premium Pass till Battlefield™ 1 innehåller nya flerspelarbanor, 20 nya upplåsbara vapen, 14 unika ID-brickor och 14 Battlefield™ 1 Superior Battlepacks (med högre chans att ge ett extra bonusföremål jämfört med ett Standard eller Distinguished Battlepack)."
1aaa83aa-0c64-4365-8492-c51fd43e8de9,"Battlefield 3™","Öka intensiteten i Battlefield 3 och njut av den totala friheten att strida på det sätt du vill. Utforska nio enorma flerspelarbanor och använd mängder av fordon, vapen och utrustningsföremål för att göra striden intensivare. Dessutom gör varje sekund i strid att du kommer närmare att låsa upp massor av extrainnehåll.Huvudinnehåll:Spela på dina styrkor. De fyra spelarklasserna Assault, Engineer, Support och Recon har alla sina specialegenskaper, och samarbete är avgörande för att vinna.Ta dig vart som helst, gör vad som helst. Kör alla fordon du hittar, från stridsvagnar och jeepar till helikoptrar och jetflygplan. Krascha din F/A-18E Super Hornet rakt in i en fiende!Total förödelse. Ha otroligt kul på nio flerspelarbanor. Enorma förstörbara miljöer? Japp. Vidöppna områden som är perfekta för vilda fordonsstrider? Absolut.Massor av föremål att låsa upp. Alla strider hjälper dig att låsa upp rang, band, medaljer och mer som gör dig starkare. Håll dig till helikoptern, bli en skicklig pilot och lås upp IR-bloss för att avvärja inkommande missiler, eller välja att öka din smygförmåga."
baeaa132-32aa-4d91-b4c8-4a6cb397b629,"Battlefield 3™ Premium Edition","Öka intensiteten i Battlefield 3 och njut av den totala friheten att strida på det sätt du vill. Utforska nio enorma flerspelarbanor och använd mängder av fordon, vapen och utrustningsföremål för att göra striden intensivare. Dessutom gör varje sekund i strid att du kommer närmare att låsa upp massor av extrainnehåll och öka din rang. Så kast dig in i striden.Huvudinnehåll:Spela på dina styrkor. De fyra spelarklasserna Assault, Engineer, Support och Recon har egna specialegenskaper, och samarbete är avgörande för att vinna.Ta dig vart som helst, gör vad som helst. Kör alla fordon du hittar, från stridsvagnar och jeepar till helikoptrar och jetflygplan. Krascha din F/A-18E Super Hornet rakt in i en fiende!Upplev total förödelse. Ha otroligt kul på nio flerspelarbanor. Enorma förstörbara miljöer? Japp. Vidöppna områden som är perfekta för vilda fordonsstrider? Absolut.Lås upp massor av föremål. Alla strider hjälper dig att låsa upp rang, band, medaljer och mer som gör dig starkare. Håll dig till helikoptern, bli en skicklig pilot och lås upp IR-bloss för att avvärja inkommande missiler, eller välja att öka din smygförmåga. Battlefield 3 Premium Edition innehåller:Spelet och alla 5 expansionspaket. Premium Edition innehåller 20 nya banor, 20 nya vapen, tio nya fordon och fyra nya spellägen. Multiplayer Head Start Kit. Lås direkt upp 15 avancerade vapen, plus utrustningsföremål, fordonsuppgraderingar och mer. Kraftfulla nya funktioner. Återställ din statistik och börja om på nytt, få prioritet i serverköer och få nya dekaler till plutonsemblem. Du kan även vara med i unika evenemang, som helger med dubbel XP, och delta i exklusiva tävlingar. Exklusiva föremål i spelet. Få unika föremål i spelet som inte är tillgängliga någon annanstans, inklusive nya kamouflage till soldater och vapen, kniven ACB-90 och en unik uppsättning ID-brickor."
6a159046-03d3-4dc7-b462-db55f5cce58e,"Battlefield 3™ Premium","ÄG MER MED BATTLEFIELD 3 PREMIUM Battlefield 3™ Premium innehåller expansionspaketen Back to Karkand, Close Quarters, Armored Kill, Aftermath och End Game. Om du köper Battlefield 3 Premium bör de här expansionspaketen vara tillgängliga via sidan Spelinformation för Battlefield 3 på Origin utan extra kostnad. Ta din Battlefield 3™-multiplayerupplevelse till nästa nivå med Battlefield 3™ Premium! Battlefield 3 Premium erbjuder enormt mycket innehåll och en unik chans att spela alla kommande expansionspaket innan de släpps, öka din soldats anpassningsalternativ och få exklusiva föremål i spelet mot en engångskostnad. Det här medlemskapet ger dig alla fem expansionspaket för Battlefield 3 samt två veckors tidig tillgång. Du kommer att erhålla unika föremål i spelet som inte är tillgängliga någon annanstans: ACB-90-kniven, en uppsättning dog tags och exklusiv kamouflering till din soldat och dina vapen. Battlefield 3 Premium-medlemmar kommer även att få tillgång till nya, kraftfulla funktioner så som möjligheten att återställa statistik, prioritet i serverköerna och nya dekaler till Platoon-emblemen. Vare sig du vill ha tidig tillgång till expansionspaketen, stå ut ur mängden med unika föremål i spelet eller använda de nya funktionerna så erbjuder Battlefield 3 Premium dig en multiplayerupplevelse utan motsvarighet. BATTLEFIELD 3 PREMIUM-NYCKELFUNKTIONER SPELA ALLA EXPANSIONSPAKET TIDIGT Få alla fem temabaserade expansionspaket till Battlefield 3 och spela dem två veckor innan de släpps.  STÅ UT UR MÄNGDEN MED EXKLUSIVA FÖREMÅL I SPELET Få erkännande och stå ut ur mängden med unika föremål i spelet innehållandes den unika ACB-90-kniven och en uppsättning dog tags för Battlefield 3 Premium. Anpassa din upplevelse ytterligare med exklusiv kamouflering för din soldat och dina vapen samt unika uppdrag. TILLGÅNG TILL KRAFTFULLA FUNKTIONER Med Battlefield 3 Premium får du den unika chansen att återställa din statistik för Score/Minute, Kills/Deaths och Wins/Losses om du vill få en nystart med din soldat i multiplayerläget. För att få din status erkänd har du prioritet till serverköarna, fler dekaler till dina Platoon-emblem och möjligheten att göra fem av dina stridsrapporter till favoriter så att de sparas för alltid. DELTA I UNIKA EVENT  Stig snabbare i rang med exklusiva event där du får dubbla erfarenhetspoäng och delta i unika tävlingar. FÅ STRATEGIGUIDER- OCH VIDEOKLIPP Kolla in videoklipp med speltips direkt från utvecklarna på DICE, få tillgång till ingående strategiguider och exklusiva förhandstittar på kommande expansionspaket. INNEHÅLL OCH FUNKTIONER • Alla Battlefield 3-expansionspaket med två veckors tidig tillgång:     o Battlefield 3: Back to Karkand     o Battlefield 3: Close Quarters     o Battlefield 3: Armored Kill     o Battlefield 3: Aftermath     o Battlefield 3: End Game Tillsammans innehåller de här fem expansionspaketen 20 kartor, 20 nya vapen, 10+ nya fordon, 4 nya spellägen, 30+ uppdrag och 20+ dog tags • Unik kniv • Unika dog tags • 10+ unika soldatkamoufleringar • Unika vapenkamoufleringar • Statistikåterställning • 10+ unika dekaler till Platoon-emblemen • Utökade lager för Platoon-emblemen • Prioritet i serverköerna • Spara upp till fem favoritstridsrapporter • 5+ unika uppdrag • Exklusiva tävlingar • Exklusiva event med dubbla erfarenhetspoäng • Exklusiva videoklipp • Strategiguider • Ytterligare bonusinnehåll Grundspelet Battlefield 3 ingår inte"
43cbe685-cbe3-4b6e-85d7-0f2dbdfabb39,"Battlefield 3™ Armored Kill","Gör dig redo för förödelse och höga hastigheter. Den här expansionen har nya körbara stridsvagnar, terrängfordon, mobilt artilleri och mer. Dessutom innehåller den enorma slagfält för stora fordonsstrider, inklusive den största banan någonsin i Battlefield. Armored Kill är ett av fem expansionspaket som ingår i Battlefield 3 Premium. Om du redan har Battlefield 3 Premium så får du automatiskt tillgång till det här innehållet.Huvudinnehåll:Delta i totalt krig med fordon. Kör, flyg och sprid förödelse på fyra nya banor, inklusive den största någonsin i Battlefield. Lås på målet och pressa ditt fordon till det yttersta. Kör fem nya fordon, inklusive pansarvärnskanonvagnar, mobilt artilleri och ett terrängfordon, eller spawna vid kanonplanet och bemanna kanonerna. Prova ett nytt utmanande spelläge. Det är dags att ta fram det tunga artilleriet i det nya läget Tank Superiority. Nå dina uppdragsmål i enorma stridsvagnar och pansarvärnskanonvagnar med stor eldkraft."
1bade534-d0ef-4810-ad1f-8ae352c5ce3f,"Battlefield 3™ Back to Karkand expansionspaket","Battlefield 3: Back to Karkand-expansionspaketEfter  köpet behöver du ladda ned den senaste Battlefield 3™-uppdateringen  från Origin och starta spelet för att ta del av Back to  Karkand-expansionspaketet.Det är dags för Back to  Karkand-expansionspaketet till DICE:s prisbelönta Battlefield 3. Med  kraften iFrostbite 2 omarbetar Back to Karkand-expansionspaketet de fyra  bästa Battlefield-kartorna och lägger tillutökad förstörelse: Strike at  Karkand, Wake Island, Gulf of Oman och Sharqi Peninsula.Utöver  detta så inkluderar Back to Karkand fem nya dog tags, fem nya  achievements/trophies till konsol, tre nya fordonfrån Battlefield 2  (sandloppan, STOVL-jaktflygplanet och ett pansarskyttefordon), tio  ikoniska Battlefield 2-vapen som duäven kan använda i grundspelet samt  nya uppdrag som spelare kan slutföra för att erhållabelöningar.KEY FEATURESBattlefield 3: Back to Karkand-expansionspaket• Spela på fyra legendariska Battlefield 2-kartor omarbetade med Frostbite 2-motorn• Ta kontroll över det nya pansarskyttefordonet, sandloppan och STOVL-jaktflygplanet• Utöka din arsenal med tio nya vapen som du kan även kan använda i grundspelet• Strid i klassiska Conquest Assault-läget känt från Battlefield 2• Klara av nya uppdrag för att låsa upp vapen och unika dog tagsOm du har köpt Battlefield 3 Limited Edition, så äger du redan Back to Karkand."
ae3416d7-d6a8-47bc-bb9d-aead4170275d,"Battlefield 3™: Close Quarters","ÄG MER MED BATTLEFIELD 3 PREMIUMBattlefield 3: Close Quarters är ett tema-expansionspaket som tar lagspelet i Battlefield 3 in i tighta inomhusmiljöer. De intensiva infanteristriderna förstärks av oöverträffad högupplöst förstörelse, nya sätt att spela, fler vapen och utökad hållbarhet. HD-förstörelsen i Close Quarters låter spelare förvandla hela lokaler till ruiner med sina vapen. Allt från möbler till murbruk kan skjutas i bitar och spelare ser resultatet av förstörelsen då grus och trasiga delar täcker golven framför dem. Den tighta nivådesignen och möjligheterna till vertikalt spelande innebär att spelarna måste göra sitt absolut bästa för att hålla sig vid liv i den här tävlingsinriktade krigsarenan. NYCKELFUNKTIONERBattlefield 3: Close Quarters:• Kastas in i galna och obarmhärtiga infanteristrider• Håll ögonen öppna då fienden lurar överallt• HD-förstörelsen låter dig förvandla hela lokaler till ruiner• Erhåll nya vapen och använd dem även i grundspelet• Slutför nya uppdrag och utrusta dig med unika dog tags• Spela Battlefield 3 på nya sätt som blandar lagspel och omedelbar action"
ccb8a290-8b61-42d4-ae65-0969d4214d34,"Battlefield 3™: End Game","Kör fram över fyra stora banor och undvik fiender på den nya snabba och smidiga terrängmotorcykeln. Slå tillbaka mot luftanfall med nya, lätta luftvärnsfordon. Välkommen tillbaka till två klassiska spellägen med blixtsnabba anfall och försvar. End Game är ett av fem expansionspaket som ingår i Battlefield 3 Premium. Om du redan har Battlefield 3 Premium så får du automatiskt tillgång till det här innehållet. Huvudinnehåll: Prova fyra nya banor och två klassiska spellägen. Åk fram genom skogar, öknar, och bergspass avsedda för action och strider i höga hastigheter. Och upplev spellägena Capture The Flag och Air Superiority igen. Bemästra tre nya fordon. Åk snabbt förbi fiendens linjer med snabba terrängmotorcyklar eller slå ut fiender med de nya lätta luftvärnsfordonen. Vänd striden med det nya landsättningsfordonet. Ge marktrupper stöd med nya möjligheter att sätta in fordon. Kalla in förstärkningar och mobilisera på ett ögonblick."
8cc3f405-8453-4031-be49-f826814faa0c,"Battlefield 4™","Omfatta oöverträffad förstörelse i Battlefield 4™. Njut av det frenetiska krigskaoset i öppet krig packat med givande, taktiska utmaningar i en interaktiv miljö. Ödelägg byggnaderna som skyddar din fiende och led detta anfall från baksidan av en kanonbåt. Battlefield ger dig friheten att göra mer och vara mer, så utnyttja dina styrkor och staka ut din egen väg mot segern! Det finns ingen motsvarighet. Låt dig uppslukas av ett förödande krigskaos. Nyckelfunktioner: Dynamiska stridsfält. Dessa interaktiva miljöer reagerar på dina handlingar i realtid, så fortsätt och orsaka ett skeppsbrott eller översvämma gatorna. Din motståndare ser det inte komma. Fler fordon, mer förstörelse, större frihet. Upplev en oöverträffad nivå av öppet krig med fler fordon och mer förstörelse än någonsin tidigare. Plus, de storslagna och enorma kartorna ger dig frihet att utnyttja dina styrkor och skapa din egen väg till seger. Starta ett amfibieanfall. Bemanna kanonerna och möt stormen för att slå ner dina motståndare. Dominera land, luften och havet med helt ny, intensiv vattenbaserad fordonsstrid. Intensiv enspelarkampanj. Battlefield 4™ har en intensiv, karaktärstyrd kampanj som börjar med evakueringen av amerikanska dignitärer från Shanghai och följer din trupps kamp för att återvända hem."
0e3171af-601f-4926-969d-dc6d2536a40e,"Battlefield 4™ Naval Strike","Fortsätt striden till havs i Naval Strike! Sydkinesiska havet erbjuder intensiva havsstrider på fyra nya kartor:•xa0Lost Islands:xa0Bland fiskebyarna på dessa tropiska öar utgör ett störtat passagerarplan ett viktigt strategiskt mål att erövra.•xa0Nansha Strike:xa0Detta är den största havskartan i Battlefields historia, och du och din grupp måste kämpa mot såväl fiender som stormiga hav.•xa0Wave Breaker:xa0Hamnen erbjuder inte mycket till skydd när du rusar mellan de klippiga öarna, men du kan lura in dina motståndare i den farofyllda flottbasen.•xa0Operation Mortar:xa0Storma en övergiven semesterort uppe på en klippa och visa hur skicklig du är på att upphäva en belägring. Njut sedan av utsikten från ditt nya högkvarter!Utöka din arsenal med fem nya vapen, samt det nya tregranatstillbehöret till Assault-klassen och antihelikopterminan till Engineer-klassen. Strid både på land och till havs med den nya amfibiesvävaren, och återupplev krigstriumferna från häromåret med Carrier Assault Mode – en nytolkning av det klassiska Titan Mode från Battlefield 2142."
c70d2be8-147f-4493-ab2c-6a5c29091eea,"Battlefield 4™ Premium Edition","Battlefield 4 Premium Edition ger dig nya banor, spellägen och mer i ett enkelt paket. Slutför utmanande uppdrag för att låsa upp nya vapen. Dominera taktiska utmaningar i en enorm interaktiv miljö – förstör byggnader som skyddar dina fiender, led ett anfall från aktern av en kanonbåt, eller använd lite sprängdeg med stor effekt. I enorma strider med 64 spelare får du använda alla dina resurser och styrkor för att kämpa dig fram till segern.xa0Huvudfunktioner:xa0Dynamiska slagfält.xa0Interaktiva miljöer som reagerar på dina handlingar i realtid så att du kan utlösa ett skeppsbrott eller översvämma gatorna för att få ett taktiskt övertag. Dina motståndare kommer inte att hinna märka vad som hände.Fler fordon, mer frihet.xa0Kontrollera slagfältet med dussintals fordon, från helikoptrar och smygjetplan till kanonbåtar och luftvärnsfordon som alla är till för att ge dig ett övertag på enorma, kaotiska banor.En intensiv enspelarkampanj.xa0Det internationella läget är mer spänt än någonsin, och du måste evakuera viktiga amerikaner från Shanghai och kämpa mot oddsen för att få hem din grupp.xa0Premium Edition innehåller:xa0Alla fem expansionspaket.xa0Du får 20 nya banor, 48 exklusiva uppdrag, nya spellägen och mer.Exklusiva personliga anpassningsmöjligheter.xa0Utrusta dig med de senaste kamouflagemönstren, emblemen och ID-brickorna. Alla fyra klasser har unik utrustning, så kombinationerna är oändliga.Prioriterad plats i serverköer.xa0Hoppa in i striden så snabbt som möjligt. Prioriterad plats innebär att du kan börja krossa fienden snabbare.12 extra Battlepacks.xa0Du får vapentillbehör, XP-bonusar och anpassningar som bara är tillgängliga för Premium-medlemmar."
d7b5c333-88f6-4a7d-8414-7294d67aa7b3,"Battlefield 4™ China Rising","Gör dig redo för en ny strid. Helt nya platser att strida på, vapen att avfyra, prylar att leka runt med och fordon att använda. Det första expansionspaketet till Battlefield 4 – China Rising – innehåller allt du behöver för att hålla dina färdigheter finslipade.
 
Dominera över motståndargrupperna på fyra helt nya multiplayerkartor på det kinesiska fastlandet. Ta dig fram över den kinesiska terrängen snabbare på en cross. Du kan även skicka ut nya obemannade luftfarkoster – en för Support-klassen och en för Recon.

Dessutom innehåller China Rising det nya spelläget Air Superiority och en ny Proxy Attack-förmåga i Commander Mode. Det finns något för alla typer av Battlefield-spelare!
 
Och viktigast av allt är att alla Battlefield Premium-medlemmar får tillgång till China Rising, och fyra framtida expansionspaket, två veckor innan alla andra. Det innebär två extra veckor att lära sig alla skrymslen och vrår på alla fyra kartor. Två veckor att lära sig de nya vapnen. Och två veckor att leka runt med de obemannade luftfarkosterna.
Om expansionen
 
• Multiplayerkartor: Krig för 64 spelare på olika platser runtom i Kina. Kriga vidare på helt nya kartor, bland annat Silk Road, Altai Range, Guilin Peaks och Dragon Pass.
 
• Nya vapen, fordon och prylar: Fem nya vapen innebär ännu mer förödelse i Battlefield 4. Använd det helt nya bombplanet och åk på två hjul genom Kina på crossen.  Både Support- och Recon-klassen får nya obemannade luftfarkoster.

• Tidig tillgång för Premium-medlemmar: Utöver alla fördelar som medlemskapet innebär – exklusiva XP-evenemang, unika anpassningsmöjligheter och prioriterad åtkomst – får alla medlemmar tillgång till fem expansionspaket två veckor innan alla andra."
