734692ed-e125-43b1-afb7-96626efe2108,"Need for Speed™ Most Wanted","Need for Speed Most Wanteds öppna värld ger dig friheten att köra hur du vill. Ta hopp och genvägar, byt bil, ligg lågt eller välj terräng som spelar på ditt fordons unika styrkor. Ta dig förbi poliser och rivaler med hjälp av skicklighet, senaste bilteknologin och en rejäl portion lustgas. Allt kretsar kring dig, dina vänner och massa häftiga bilar. Visa vad du kan. 
Utvalt innehåll
Upplev oavbruten action. Inga menyer, ingen lobby och inga begränsningar – bara hård konkurrens. Kör, kämpa, krascha och utforska en öppen värld full av saker att göra (och belöningar att samla) i din egen takt. 
Bevisa att du är bäst. Välj en bil och hoppa in i en spellista med onlinetävlingar utan slut. Påverka spellistan genom att rösta med din bil. Gör upp om startpositionerna. Passera mållinjen och gör en U-sväng för att slå ut de anstormande rivalerna. 
Slå dina vänner. Autolog sparar allt du gör och skickar dina viktigaste nya poäng, hastigheter och tider till dina vänner – och du får se deras. Vad du än gör finns det alltid någon att slå. 
Visa vad du går för i stadsmiljö. Need for Speed Most Wanted levererar en djup, fysisk upplevelse som visar upp olika licensierade bilars unika personligheter. Upplev hisnande hastigheter, spektakulära krascher, aggressiv körning och sliriga sladdar. "
7d26f1b3-93d1-40dc-9908-c3ce3ef676d1,"Need for Speed™ Payback","Need for Speed™, en av världens bäst säljande spelserier, är tillbaka med nya Need for Speed Payback.

Det utspelar sig i Fortune Valleys undre värld, och du och ditt gäng har delats av ett förräderi, och enats av strävan efter hämnd för att utplåna The House – en ondskefull kartell som kontrollerar stadens kasinon, brottslingar och poliser. I detta paradis för korrupta hasardspelare är insatserna höga, och kom ihåg: The House always win. 

Tillverka unika bilar med djupare prestanda och visuella anpassningar än någonsin tidigare. Pressa deras gränser när du nätt och jämnt kommer undan i storslagna strider mot poliser. Med vansinniga stölduppdrag, förödande bilstrider och enastående miljöer ger Need for Speed™ Payback en fantastisk upplevelse fylld av spänning och adrenalin.
Huvudinnehåll:
Skrot-, standard- och superbilar. Din bil står i centrum för allt du gör i Need for Speed Payback. Du kan göra mängder av finjusteringar av prestandan på alla de fem distinkta bilklasserna (Race, Drift, Off-Road, Drag och Runner) för att få ett övertag i alla tävlingar, uppdrag eller utmaningar.
Lev ut en actionfylld bilfantasi. Spela som tre olika karaktärer som enas av ett gemensamt mål: hämnd. Tyler, Mac och Jess samarbetar för att slå tillbaka mot alla odds och delta i den ultimata tävlingen för att besegra The House. Konfrontera poliser med allt större intensitet, tävla mot rivaler över hela staden och kör på och utanför vägar genom berg, dalar och öknar.
 Mycket står på spel. Vinn stort med helt ny spelmekanik med högre risker och belöningar. Intensiva biljakter med polisen innebär att det har aldrig stått mer på spel. Utmana dina vänner eller potentiella rivaler via Autolog-rekommendationer under evenemang eller möt dem i de klassiska spellägena online."
43cc48a4-6285-4286-bfe9-c46e447c31eb,"NFS Payback 2200 Speed Points","Speed Points är premiumvalutan som används i Need for Speed Payback. Du kan använda Speed Points för att köpa premium-leveranser i spelet med bankföremål, utsmyckningsföremål och bildelspolletter så att du kan ge din bil lite extra."
cc48fbce-baf6-4b80-a40c-ebeee7cfa8d3,"NFS Payback 4600 Speed Points","Speed Points är premiumvalutan som används i Need for Speed Payback. Du kan använda Speed Points för att köpa premium-leveranser i spelet med bankföremål, utsmyckningsföremål och bildelspolletter så att du kan ge din bil lite extra."
08949641-8220-4983-9ea8-6cc7c0fae495,"Need for Speed™ Rivals","Erase the line between single player and multiplayer in this street-racing rivalry between Cops and Racers. Seamlessly join a world where your friends are already racing and chasing. Forget isolated game modes. There are no lobbies; no waiting. You and your friends can all share the same race as paths cross and experiences merge.Key features:• All-drive:xa0Imagine your race and your friend’s pursuit colliding—creating a world where no two events feel the same. Don’t want to play with others? Then simply choose to make Redview County yours alone and dominate the advanced Racer and Cop AI.• High-stakes rivalry:xa0Racers are lone wolves out for glory; driving agile cars built for high-speed racing and epic chases. Cops work in teams to hunt down and bust racers using the full power of the police force. Switch roles whenever you like, and watch the stakes grow through a new scoring system that puts your speed points on the line.• Next-gen racing:xa0Experience speed that you can truly feel in the fastest racing game around, powered by the Frostbite 3 engine. Every detail of the game world is rendered in stunning, high-definition graphics. Race and chase in snow, hail, rain, dust storms and heavy fog.• Your car, your identity:xa0Personalize your cars with performance and style modifications. Power up your car with the latest upgrades in pursuit technology and personalize your bodywork with fresh paint jobs, liveries, custom license plates, rims and decals to show off your car to the world.• Pursuit and evasion tech:xa0Use the latest pursuit tech and modifications to change your pursuit or escape strategy on the fly. Racers evade Cops using turbo bursts, jammers and electromagnetic pulses. Cops will be armed for aggressive busts, deploying shockwaves, spikestrips and calling in police roadblocks or helicopter support."
5c84766c-f7c0-457b-89a2-210ee0eea762,"Need for Speed™ SHIFT","Tänk dig ett racingspel gjort av racingfantaster för racingfantaster så får du en bra bild av vad du kan vänta dig av Need for Speed SHIFT. Det kommer att ge spelarna en helt ny sorts realism aldrig tidigare sedd i ett Need for Speed-spel, med otroligt autentisk och engagerande körkänsla. Need for Speed SHIFT har designats för att ge känslan av att köra riktigt snabba bilar med bland annat en oerhört realistisk förstapersonsvy inifrån förarhytten och en helt ny krashmotor som bidrar till att ge känslan av hårresande racing i ruskigt höga farter.Spelet utvecklas enligt en modell där några av världens bästa racingspelsutvecklare samarbetar. Några av nyckelpersonerna bakom spelet är Michael Mann (executive producer vid Black Box), Patrick Soderlund (senior vp vid EA Games) och Slightly Mad Studios i London. SMS, eller som de hette tidigare, Blimey, borde vara välkända i racingspelskretsar med sina tidigare titlar GT Legends och GTR 2."
0e9d03a7-f404-41b0-81d9-8a548500574c,"Need for Speed™ The Run","Det är känt som The Run. 483 mil av oförlåtande asfalt från San Francisco till New York. Inga hastighetsbegränsningar. Inga regler. Inga allierade. Endast beväpnad med hans mod och instinkt tävlar Jack mot de allra mest ökända förarna som någonsin samlats. Täta stadsgator, istäckta bergspassager och smala raviner kräver det mesta av hans skicklighet. Jack kör för sitt liv, jagad av både polis och männen som vill se honom död.
NYCKELFUNKTIONER
Från Golden Gate till Empire State — Tävla i The Run, ett olagligt race som tar dig genom de mest ikoniska och förrädiska vägarna mellan San Francisco och New York. Det finns inga regler eller allierade i de städer, öknar, berg och raviner som står mellan dig och mållinjen.
Du är Jacks övertag — Jack kör för sitt liv och har något de andra i tävlingen inte har: dig. Håll Jack ett steg före farorna som lurar i hans mörka förflutna, både i och utanför bilen. Det är upp till dig att få Jack i ett stycke till New York före de övriga deltagarna.
Racing med Frostbite 2 — Den kraftfulla och nya Frostbite 2-motorn, utvecklad av den prisbelönta DICE-studion, vidareutvecklar de tekniska aspekterna för att leverera en spelupplevelse med enastående visuella detaljer, involverande miljöer och känslomässiga avtryck.
Delta i högoktanig racing för flera spelare — Den mest tillgängliga racingupplevelsen online någonsin. Med matchningsteknologi kan du gå med i race som redan pågår istället för att behöva vänta i lobbyn. Skapa ett party med vänner, välj en spellista med era favoritutmaningar och tävla om ära och berömmelse i alla delar av The Run. Genom att bemästra alla spellistor kan du öka i nivå och få tillgång till exklusiva fordon, uppgraderingar och egenskaper."
0d1f5b5e-9fe3-4d23-89da-3d0d347116de,"Plants vs. Zombies™ Garden Warfare","Vinnare av tio priser på E3, bland annat för bästa spel på E3 och bästa skjutarspel. Plants vs. Zombies Garden Warfare gräver skyttegravar med en explosiv actionupplevelse. Peppra zombier, plantor och unika spelkaraktärer i en sprängfylld värld där djupet i en traditionell onlineskjutare mixas med den uppfriskande humorn i Plants vs. Zombies.   Digital Deluxe Edition är det bästa sättet att hoppa in i all Garden Warfare-action. Du får 150xa0000 mynt att spendera på anpassning samt ett Origin-exklusivt Custom Accessories Pack. Multiplayer i fokus. Grannskapet invaderas av upp till 24 som sluter sig samman för att kontrollera över tio olika slagfält. Garden Warfare innehåller flera tävlings- och samarbetsinriktade spellägen, så välj sida och bemästra alla nyanser hos de olika spelbara karaktärerna. Anpassning deluxe. Varje poäng och varje seger ger dig mynt som du kan spendera på Sticker Packs som låser upp nya uppsättningar, spelbara karaktärer och mycket mer. Ju mer du spelar, desto mer låser du upp och desto mer kan du dominera i grannskapet. Kostnadsfria uppdateringar.  Garden Warfare fortsätter att få nytt, actionfyllt innehåll. Här är två grymma nytillskott sedan spelet släpptes:  • Suburbination. Krossa motståndet i spelläget Suburbination, där zombier och plantor kämpar om att erövra och kontrollera tre punkter. Plantorna vill åt dem för den bördiga jorden, medan zombierna är mer intresserade av de bördiga ... hjärnorna. Suburbination innehåller även den ökenstadsinspirerade kartan Crash Course, nya Garden Ops-bossar och en Plasma Pea Shooter-variant skapad av spelets community.  • Legends of the Lawn. Varför nöja sig med erövra en trist flagga när man kan erövra en läcker taco? I spelläget Taco Bandits är det precis det du får göra! Plantornas uppdrag är att försvara Crazy Daves oemotståndliga tacos när zombierna försöker stjäla dem. Du får även sju nya karaktärsvarianter (bland annat Golf Star, Centurion och Chomp Thing) och över 200 anpassningsföremål."
e632c3fa-9745-4753-9276-92715905ce71,"Plants vs Zombies™ Garden Warfare Digital Deluxe","Vinnare av tio priser på E3, bland annat för bästa spel på E3 och bästa skjutarspel.
Plants vs. Zombies Garden Warfare gräver skyttegravar med en explosiv actionupplevelse. Peppra zombier, plantor och unika spelkaraktärer i en sprängfylld värld där djupet i en traditionell onlineskjutare mixas med den uppfriskande humorn i Plants vs. Zombies. 

Digital Deluxe Edition är det bästa sättet att hoppa in i all Garden Warfare-action. Du får 150xa0000 mynt att spendera på anpassning samt ett Origin-exklusivt Custom Accessories Pack.
Multiplayer i fokus. Grannskapet invaderas av upp till 24 som sluter sig samman för att kontrollera över tio olika slagfält. Garden Warfare innehåller flera tävlings- och samarbetsinriktade spellägen, så välj sida och bemästra alla nyanser hos de olika spelbara karaktärerna.
Anpassning deluxe. Varje poäng och varje seger ger dig mynt som du kan spendera på Sticker Packs som låser upp nya uppsättningar, spelbara karaktärer och mycket mer. Ju mer du spelar, desto mer låser du upp och desto mer kan du dominera i grannskapet.
Kostnadsfria uppdateringar.  Garden Warfare fortsätter att få nytt, actionfyllt innehåll. Här är två grymma nytillskott sedan spelet släpptes: 
• Suburbination. Krossa motståndet i spelläget Suburbination, där zombier och plantor kämpar om att erövra och kontrollera tre punkter. Plantorna vill åt dem för den bördiga jorden, medan zombierna är mer intresserade av de bördiga ... hjärnorna. Suburbination innehåller även den ökenstadsinspirerade kartan Crash Course, nya Garden Ops-bossar och en Plasma Pea Shooter-variant skapad av spelets community. 
• Legends of the Lawn. Varför nöja sig med erövra en trist flagga när man kan erövra en läcker taco? I spelläget Taco Bandits är det precis det du får göra! Plantornas uppdrag är att försvara Crazy Daves oemotståndliga tacos när zombierna försöker stjäla dem. Du får även sju nya karaktärsvarianter (bland annat Golf Star, Centurion och Chomp Thing) och över 200 anpassningsföremål."
71472883-1b94-482d-8cb8-eabc6f40885d,"Plants vs. Zombies™ Garden Warfare 2: Standard Edition","Förbered ärtrören och gör dig klar för universums galnaste och roligaste skjutspel: Plants vs. Zombies Garden Warfare 2. 

Dr. Zomboss har tagit över förorten och förvandlat den till ett zombiefyllt paradis utan plantor. Nu är det plantornas tur att gå på offensiven i det nya 24-spelarläget Herbal Assault och återta sitt revir. Eller välj sida i solospel eller samarbete för 4 spelare. Plants vs. Zombies Garden Warfare 2 har nya lägen, klasser och mängder av humor, allt för att låta dig utkämpa krig mot allvar och vänner hur du vill. 

Plants vs. Zombies Garden Warfare 2 introducerar även Backyard Battleground, där du och upp till tre vänner kan utföra dagliga uppdrag, utmaningar och träffa andra PvZ-karaktärer.
Spelinnehåll:

Plantattack. Den här gången tar du striden till zombierna. Gå på offensiven som plantorna för att återta förorten, eller stoppa den botaniska invasionen och bevara zombielandet i helt nya spellägen.
Fler karaktärer, klasser och utseenden. 6 nya klasser tillkommer, för sammanlagt 14 spelbara karaktärsklasser. Välj mellan över 100 spelbara plantor och zombier från dåtiden, nutiden och framtiden och gör dig sedd under striden. 
Spela på ditt sätt. Plants vs. Zombies Garden Warfare 2 levererar massa trädgårdsinspirerade spellägen som du kan spela ensam eller med andra. Sällskapssjuk? Spela det nya läget Herbal Assault – häng med 24 spelare online och kämpa i hela förorten. Eller välj mellan plantornas och zombiernas sida och bilda lag i samarbetsläget för fyra personer. Om du vill kan du till och med spela solo!
En levande PvZ-värld. Slaget om förorten står i blom på 12 kartor fyllda av personlighet och humor. Kämpa dig fram genom Zombossifierade stadsbilder och fyllda luftrum, alla packade med dolda hemligheter att upptäcka."
d1275f51-2acb-413f-9bb6-ba2cca157504,"SHIFT 2 UNLEASHED™","De kritikerrosade SHIFT-spelen är tillbaka på banan med SHIFT 2 UNLEASHED™. Med en sann förarkänsla får du du den hittills mest engagerande racingupplevelsen med all intensitet och spänning som finns bakom ratten i en förarstrid. SHIFT 2 UNLEASHED med sin helt nya hjälmkamera, nattracing och skrämmande trovärdiga krascher levererar all våldsam spänning som en racingdag innebär i en banbrytande autentisk racingupplevelse.INNEHÅLL• Körkänsla på nästa nivå—Upplev instinktiv förstapersonsracing som aldrig förr. Den helt nya hjälmkameran återskapar realistiska huvudrörelser som ger en ojämförlig fartkänsla: luta och vrid dig in i kurvornas apex, känn varenda skrapning, gupp och krasch, upplev äkta i-cockpit-vibrationer och mer. • Äkta realistisk racing—SHIFT 2 UNLEASHED omdefinierar racingsimulatorgenren genom att återskapa atmosfären på en racingdag. SHIFT 2 UNLEASHED återskapar med sina autentiska bilkrascher och kraschfysik, skrämmande nattracing och stridshärjad känsla och utseende på både bil och bana den hittills mest autentiska racingspelupplevelsen. Innehåller FIA GT1 World Championship och GT3 European Championship plus riktiga förare, banor och bilar—det här är verkligen morgondagens simulering för dagens adrenalinfyllda racing. • Karriär med djup och variation—Förtjäna upplåsningar och delta i flera olika racinggrenar på din väg mot mästerskapet i FIA GT1. Med allt från uthållighetslopp till muskelbilar och retrobilar ger SHIFT 2 UNLEASHED dig möjligheten att välja den väg framåt som passar just din körstil. Slåss om positioner, dominera över motståndare och krossa bantiderna varje gång du kör—striden är inte över vid mållinjen, den följer med dig genom hela din karriär. • Ändra hela spelet med Autolog—Autolog är ett revolutionerande system som kopplar samman vänner och ändrar spelupplevelsen eftersom du kan dela med dig av nästan allt i din racingkarriär. Jämför spelarprofiler och karriärstatus, dela och kommentera bilder och video, skicka utmaningar och ta emot nyheter direkt från NFS.com och Speedhunters.com. Rekommendationer från Autolog höjer temperaturen på social tävlan genom att ge dig utmaningar baserade på vad dina vänner gör som skapar ett dynamiskt, tävlingsinriktat och roligt nytt sätt att spela, både online och offline. • Anpassa för uppvisning eller för att vinna!—Släpp lös kreativiteten och förvandla världens snabbaste bilar till eldsprutande vapen. Anpassa motorn, chassit, upphängningen och mycket, mycket annat och testa sedan din ultimata racingmaskin i valfritt spelläge. Vare sig du drömmer om att köra en 1000-hästars minibil eller en pimpad GTR så har du nästan oändliga möjligheter att härska på banan. Varje sekund räknas. "
8730968c-49d7-4135-af12-3219b5e172c3,SimCity™,"The defining city simulation is back! Create the city you desire and make the choices that shape your city and power the Sims within it. Every decision, big or small, has real consequences. Invest in heavy industry and your economy will soar—but at the expense of your Sims’ health as pollution spreads. Implement green technology and improve your Sims’ lives while risking higher taxes and unemployment. Team up with your friends to solve global challenges: launch a space shuttle, reduce carbon emissions, or build magnificent wonders. Compete on global and regional leader boards to be the richest, the dirtiest, the happiest or the best place to visit!  • Constructible Worlds  — Creative and customizable world that offers unique gameplay benefits, all with a fun tactile interface.  • Sims Matter — The Sims in your city speak to you directly and it’s up to you to respond to their needs. Will you listen and be the toast of the town? Or abuse your power for fame and fortune?  • Specialize in What You Love —Mold your city as a casino resort, manufacturing hub, educational enclave, and more, and then watch as a unique look and feel spread throughout your city.  • Multiplayer — Build a region with friends for the first time! Collaborate or compete in regional and global challenges and make decisions that impact the greater SimCity World.  • GlassBox Engine — SimCity introduces GlassBox, the revolutionary simulation technology that gives you the power to impact individual Sims lives, manage city level simulation, and balance multiple city simulations at once. "
f49733ba-390e-4375-81de-a828e2e4a1a8,"SimCity™: Complete Edition","Upplev den senaste versionen av SimCity - alla tiders bästa stadssimulator. Den här samlingen kommer med ett uppdaterat och utökat grundspel, expansionspaketet Simcity: Framtidens städer, nöjesparken, luftskepp och de franska, engelska och tyska stadsseten. Skapa den stad du vill ha och gör val som formar den och simmarna som bor i den.xa0Fokusera på industrin och ge ekonomin en skjuts, men tänk på att simmarnas hälsa påverkas av alla utsläpp. Satsar du på grön energi förbättras simmarnas livskvalitet, men du riskerar samtidigt högre skatt och arbetslöshet. Valet är ditt.

INNEHÅLL
Spela offline eller online: Valet är ditt. Spela när som helst och var som helst.
Simuleringsdjup: Upplev ett aldrig tidigare skådat djup i simuleringen där allt man kan se simuleras ända ner till de individuella simmarna.  
Specialisera dig på det du gillar mest: Gör din stad till en kasinometropol, ett produktionscentrum, ett konsumtionsdrivet megaföretag, ett grönt paradis eller något annat du gillar. Upplev hur din unika stil sprider sig i staden.
Bygg mot himlen: Bygg ännu tätare städer med monumentala megatorn som innehåller flera olika zoner där simmarna kan bo, arbeta och umgås utan att nånsin behöva nudda marken.
Riktig flerstadsskala:  Spela med endast en stad eller som mest 16 städer samtidigt och håll koll på invånarantal, välstånd, utbildning och lycka i hela regionen.
Den kompletta SimCity-samlingen: Inkluderar det utökade grundspelet, expansionen SimCity: Framtidens städer plus fem digitala innehållspaket."
ce0e8c3a-e6c7-456b-9740-49b6923bc3f6,"Engelskt stadsset","Gör snabbt om en del av din stad till nutida England! Ploppa ner sevärdheten Big Ben och se på när en raffinerad stil och känsla sprider sig i staden. England växer fram med unika engelska butiker och hus som dyker upp överallt runt Big Ben. Det engelska stadssetet kommer med exklusiva byggnader som det världsberömda Big Ben och dubbeldäckarbussar så att dina simmar kan åka med stil.EXKLUSIV SEVÄRDHET: BIG BEN Med Big Ben i staden vet du alltid när det är tedags. Big Ben är inte bara en av världens mest berömda sevärdheter, det är också en fullt fungerande klocka. Du kommer bli rackarns glad när du märker hur många turister som kommer för att höra Big Ben slå tolv slag.DUBBELDÄCKARBUSSARMed bussterminalen för dubbeldäckare får du ett av Londons mest välkända kännemärken. Vare sig den tar simmar till jobbet eller ut på en shoppingtur är dubbeldäckaren alltid en populär syn. Dubbeldäckare kan ta fler passagerare än vanliga bussar så de minskar trafikmängden ännu mer.FÖRVANDLA STADEN MED ENGELSKA ZONERÅterskapa en bit av London i din stad! Med Big Ben i staden förvandlas lyckliga bostadshus och framgångsrika företag till brittiska zoner. Det kommer kännas som att du är vid Themsen med Big Ben i staden, omgiven av brittiska zoner."
dc0dd905-4026-4a4f-8cef-b7eddbc6af72,"SimCity™ 4 Deluxe Edition","SimCity 4 Deluxe Edition inkluderar bästsäljarna SimCity 4 och det helt nya expansionspaketet SimCity 4 Rush Hour.Skapa den största stadsregionen någonsin, med en lantlig stad, medelklassförort, modernt företagscenter och en basindustri. Ta kontrollen över stadens transportsystem och lös U-Drive-It-uppdrag – från brottsbekämpning till att undvika katastrofer. Se hur befolkningen skjuter i höjden och skapa den ultimata, levande megastaden – den största SimCity-samlingen någonsin.


INNEHÅLL
SimCity 4


• Skapa en hel stadsregion – Bind ihop flera städer med ett fullt fungerande transportsystem och se hur de delar och slåss om resurser.



• Ha en guds krafter – Skulptera landskapet och skapa en egen fantasivärld. Framkalla sedan vulkaner, meteorer och blixtoväder.



• Var en god borgmästare – Bygg en världsstad med stadion, flygplatser, universitet och riktiga sevärdheter. Skicka ut utryckningsfordon och var med i kampen mot eldsvådor, folkmassor och annat.



• Få tips från dina simmar – Lär dig stadens puls, från resvägshelvete till skön söndagstrafik, efter jobbet-köer och nattlugn.


SimCity 4 Rush Hour


• U-Drive-It - Ta kontrollen över bilar, helikoptrar och ambulanser på stadsgatorna. Sätt på sirenerna och fånga biltjuvar eller kontrollera helikopterns strålkastare och jaga efter bankrånare. Ta kontrollen, lös uppdrag och få nya byggnader och fordon som belöning.



• Spännande nya transportmöjligheter - Rör om i gryten med San Franciscos enkelriktade gator, New Yorks breda avenyer, Tokyos snabbtåg och annat.



• Nya katastrofer - Testa dina nerver med en UFO-invasion, skapa olyckor på motorvägen eller tågurspårningar. Se hur kaoset sprider sig, eller ge dig in och bekämpa problemen.



• Nya byggnadsval - Skapa en modern europeisk stad eller använd originalseten från SimCity 4: 1890-talets Chicago, 1940-talets New York och 1990-talets Houston.



• Nya träningsavsnitt och nya svårighetsgrader - Det har aldrig förut var så roligt eller enkelt att komma igång, tack vare fyra nya träningsavsnitt. Dessutom kan du nya bestämma spelets svårighetsgrad."
