9329fbe9-d0c2-4fb7-a027-f12bfa73242b,"The Sims™ 3 Lyx & Design Prylpaket","Förvandla dina simmars hem till snygga, exklusiva loft med The Sims 3 Lyx & Design Prylpaket. Här finns en mängd nya föremål till de rum där simmarna tillbringar mest tid. Du hittar bland annat eleganta prylar till ditt högteknologiska hemmakontor, nästa generations spelkonsol till ett grymt spelrum, nutida möbler till ett supermodernt vardagsrum och mycket mer. Nu kan dina simmar ge sitt hem en ultramodern makeover! När du har moderniserat deras hem kan du rikta uppmärksamheten mot deras garderober och ge dem en översyn med hjälp av sofistikerat och vasst mode. Vare sig det är dina simmar själva eller deras hem som behöver en uppryckning så kommer The Sims 3 Lyx & Design Prylpaket att skjuta iväg dina simmar in i en modern, loftinspirerad livsstil!Funktioner:• Lägg till exklusiva möbler i dina simmars sovrum, underhållningsrum, kontor och uteplatser.• Förvandla dina simmars hem till vassa utrymmen med moderna soffor, eleganta soffbord och eklektisk konst.• Ge dina simmar eftertraktad elektronik som högteknologiska, ultraslimmade TV-apparater, TV-spelskonsoler, stereoapparater, med mera. • Uppgradera dina simmars garderob med moderiktiga kläder, skräddarsydda kostymer och sofistikerade ytterkläder. • Dessutom extra jubileumsföremål! Det speciella 10-årspaketet Funktioner:er även tre mycket omtyckta föremål från spelen The Sims och The Sims 2: den hjärtformade vibrerande sängen, elgitarren och akvariet."
453d0ab0-d597-42ba-809f-c82fe7022cc4,"The Sims™ 3 In i framtiden","Nu har dina simmar en helt ny lekplats. Hoppa in i tidsportalen, allihop, vi drar till framtiden!

Den här världen, hundratals år från nu, är ett gigantiskt rike med nya upplevelser att vara med om och het teknik att upptäcka. Vill du att dina simmar ska susa runt med svävarbrädor eller jetpacks ... eller åka genom stan i tubhissar och snygga enspårsbanor? Inga problem. Framtiden är nu. 

Men den här tidslinjen är inte fastställd. Du är fri att hoppa från framtid till nutid. Bevittna med egna ögon hur dina simmars handlingar nu kan påverka en värld flera sekel härifrån. En liten ändring kan räcka för att dina simmar ska kalla ner ett förödande meteorregn. Var är din utopi nu?

UTVALT INNEHÅLL  
- Det är framtiden: Alla bekvämligheter från en avlägsen framtid finns till hands för dina simmar. Svävarbrädor. Jetpacks. Flygande bilar. Nytt mode och nya bostäder. Förbättra dina simmars färdigheter med all möjlig framtidsteknik! 
- Lev i två tidsperioder: Dina simmar kan åka från nutiden till framtiden och tillbaka igen. Varje besök i nutiden kan ändra framtidens utveckling, så var så försiktig eller vårdslös du vill.  
- Bygg en Plumbot: Med Skapa en bot-programmet kan du nu befolka dina simmars värld med robotkompisar med olika utseenden och personligheter. Men förbered dig på konsekvenserna om du ställer in en av dem på ""ond""!"
8a97d87d-0bd9-468c-ad48-66aa47af9880,"The Sims™ 3 Semesterparadis","Ibland behöver dina simmar bara lite miljöombyte. En resa till havet kan vara den rätta medicinen! Åk omkring i ett antal anpassningsbara båtar, eller dyk rätt ner i det blå för ett uppfriskande dopp.

Om de vill stanna längre kan dina simmar anpassa ett eget hus nere på stranden. Rastlösa simmar kommer att uppskatta friheten med en kringfarande husbåt som ger dem möjlighet att utforska från hemmets sköna härd.

De besökande turisterna gör det här till en bra affärsmöjlighet för driftiga simmar. Det kan vara lukrativt att skapa ett perfekt semesterhotell, vare sig man riktar in sig på familjer eller singlar, så resan kan betala sig själv. Oavsett om de vill ha skoj i solen eller tänker på pengar så kan dina simmar välja hur de använder sitt semesterparadis.
Utvalt spelinnehåll:

• Exotiska arter: Staden Isla Paradiso är hemvist för det mytomspunna sjöfolket, hälften simmar och hälften fiskar. Med rätt diet kan din sim bli en av dem. Du kan till och med få besök av den skräckinjagande Kraken, de sju havens fasa!

• Hemliga öar: Trött på de tillgängliga öarna? Simmar som har tur och är envisa kan hitta kartbitar under vattnet som leder dem till nya landmassor att utforska.

• Livräddarkarriär: Om din sim lider av hjältekomplex kommer den nya livräddarkarriären att passa perfekt. Rädda drunknande simmar och sola dig i hjälteglansen!"
c5136649-c40a-4544-984b-ffe8ede69ff8,"The Sims™ 3 Kvällsnöjen Expansionspaket","Det är dags att skämma bort den festälskande rockstjärnan i din sim. I The Sims 3: Kvällsnöjen Expansionspaket till PC kan dina simmar utforska storstadens hektiska liv på ett helt nytt sätt: dra ner till den lokala syltan, gå ut och klubba, eller festa med blodsugande vampyrer. Vadå, de förtjänar också lite kul, men håll dem borta från dina simmars nackar. Den här expansionen innehåller även några nya karriäralternativ. Dina simmar kan servera drinkar som mixolog, shredda på gitarren i ett rockband eller bli en lokal kändis som kräver VIP-platser överallt.Funktioner:•xa0Häng på stans hetaste inneställen, från syltor till dansklubbar och chica barer, med egna dörrvakter.•xa0Vinn ära och berömmelse som medlem i ett musikband, mixolog, regissör eller lokal kändis.•xa0Ge dig in i en viss del av stan så kanske din sim upptäcker hemligheten med hur man blir en vampyr.• Få tillgång till exklusiva områden och njut av kändisfördelar som takvåningar, lyxiga spa-bad och bilar."
02f694e9-89c0-4936-9f6d-bf263ac113c6,"The Sims™ 3 Sovrum & Badrum Prylpaket","Hemmet är där hjärtat bor! Oavsett om dina simmar slappar i ett bubbelbad i sitt lyxiga badrum, njuter av lite fritid i sin exklusivt inredda sängkammare eller tar på sig nya underkläder för någon speciell, så ger The Sims™ 3 Sovrum & Badrum Prylpaket  deras hem lite extra krydda! Dina simmar kan slappa skönt och med stil i allt från stiliga sängkammare till spa-inspirerade badrum, iförda romantiska underkläder och frisyrer. Funktioner:• Skapa det ultimata sovrummet med en romantisk sänghimmel, 40-talsinspirerad fåtölj och mycket mer. • Ge dina simmars badrum en trevlig förändring med modern, spa-inspirerad inredning inklusive ett välbyggt badrumsskåp och ett elegant badkar. • Lägg till de sista detaljerna. Småsaker som blomvaser, levande ljus och rosenblad hjälper till att fixa rätt stämning. • Klä upp dig. Vare sig din sim söker ett romantiskt möte eller en avkopplande kväll, så kommer de nya klädmöjligheterna att göra ditt val möjligt. • Fullända utseendet med en vardaglig och även elegant frisyr som kompletterar din sims nya avslappnade stil. "
031e74d5-8946-4ce9-abef-c552e46e834f,"The Sims™ 3 Monte Vista","Upptäck ett landskap med massor av charm och pengar, där villor med vidsträckt utsikt ligger som ett pärlband på de mjuka sluttningarna. Utforska det levande samhället genom att besöka kända museer, ta en promenad på torget, eller lär dig kulinariska konster vid en äkta vedugn. I The Sims 3 Monte Vista får du inspiration från en kultur som har påverkat flera generationer. Finner dina simmar inspirationen som eldar på den kulinariska glöden?INNEHÅLL•* Helt nytt spelföremål* Vedeldad ugn – Utöka dina simmars kulinariska värld med nya recept! Gör en mängd olika bröd, calzone, lasagne och pizzor!xa0• En helt ny värld väntar – Träffa nya simmar, utforska nya platser och upplev den underbara utsikten i Monte Vista!• Nya exklusiva föremål – Anpassa ditt spel med dussintals helt nya, exklusiva föremål och kläder som bara finns i Monte Vista.• Sims 2-ättlingar – Möt familjen Monty från Veronavik! Innan deras fejd med familjen Capp började så tillbringade familjen Monty sina dagar i fridfull harmoni i Monte Vista."
d3204c8c-353e-4104-a536-d4c598326c50,"The Sims™ 3 Husdjur","Gör dina simmars hem ännu mer levande med ett nytt husdjur!Ibland är ett djur din bästa vän. Dina simmar kommer att älska sina nya djur och allt de kan göra. Att lära dem trick är bara början. De följer med dina simmar i deras dagliga sysslor och ger dem ändlös och oförutsägbar underhållning.Husdjuren kan anpassas, precis som dina simmar, med unika utseenden och egenskaper. De är smarta också: De kan lära sig en massa olika trick förutom det vanliga ""Apport!"" och kan till och med varna dina simmar när faror hotar.Husdjur har egna sociala liv med andra djur och det kanske slutar med några extra munnar att mätta! Man kan även tämja vilda djur som blir en del av flocken. Om dina simmar känner sig ensamma kan du väl ge dem ett husdjur!"
6428a109-f996-480d-b9d8-c829b286824d,"The Sims™ 3 Årstider","Låt dina simmar simma i havet en varm sommardag, fiska efter äpplen i en hink bland höstlöven, testa sina snowboardfärdigheter i en halfpipe, eller välkomna våren med ett färggrant paraply under en promenad i regnet. Varje ny årstid har helt nya aktiviteter, som fotboll, och stora årstidsfestivaler och festligheter. Dina simmar kan pluta med läpparna i pusståndet under vårfestivalen, eller se vilka spökeridagsöverraskningar som väntar i spökhuset. Klä dig efter vädret med årstidsriktigt mode som regnrockar, vinterkläder eller till och med paraplyer. Här finns en massa nya maträtter, inredning och vädereffekter så att dina simmar kan njuta av de olika årstidernas mångfald och skönhet, och leka med livet som aldrig förr. SPELINNEHÅLL:  • Kläder efter väder: Klä dina simmar i nya stilar för årstiden, bland annat vinterkläder, våtdräkter, regnrockar, paraplyer och nya Spökeridagsdräkter!  • Roa dina simmar med nya aktiviteter för varje årstid: Vare sig de bygger en mysig igloo, skär ut en läskig pumpalykta, hoppar från trampolinen eller skickar upp helt nya fyrverkerier, så har dina simmar nya saker att göra under hela året.  • Häng med på de roliga årstidsfestivalerna: Simmarna kan hamna i snöbollskrig på den årliga vinterfestivalen, få en ansiktsmålning under sommarfestivalen, rocka loss på vårbalen eller plocka äpplen ur hinken under höstfestivalen.  • Upplev det roliga och besvärliga med föränderligt väder: Nya vädereffekter och simreaktioner fångar naturens kraft och skönhet! Simmarna kan få en solbränna, bli träffade av blixten eller bli förkylda.  • Ta med dig naturen inomhus: Nu kan din sim lära sig receptet på pumpapaj eller inreda sitt hem med nya möbler och inredningsföremål. Det finns massor av nya föremål att välkomna varje årstid med. Skaffa ett solsprejsbås inför sommaren, eller skapa vinterlovsstämning med husbelysning och dekorationer.  • Välkomna mystiska besökare: Det är inte bara nya väderfenomen som dyker upp på himlen! Bli vän med utomjordiska besökare och använd deras UFO för att föra bort en granne, invadera en granntomt eller färdas ut bland stjärnorna. *Väderstenen dyker upp i alla världar, utom de från The Sims 3 Destination Världen."
9782f178-a047-4871-9642-940bda93319f,"The Sims™ 3 I Rampljuset","Upplev historien som för dina simmar från vardagsrummet till de stora arenorna medan du håller kontakten med dina vänner! Upplev resan in i rampljuset när din sim uppträder på scen vid flera olika platser. I The Sims 3 I Rampljuset introduceras för första gången sociala Funktioner:, bland annat SimPort, en helt ny funktion som låter dig skicka dina simmar till en kompis spel! Väl där så kan din sim uppträda på din kompis scen framför din kompis alla simmar! Du kan även chatta med dina vänner och skicka meddelanden samt skärmdumpar till deras loggar.
Funktioner:

• Dina simmar kan uppnå sina drömmar som sångare, akrobater, magiker och disk-jockeyer. Se dem ta klivet in i berömmelsens värld eller kraschlanda spektakulärt när de uppträder för andra simmar. 

• Helt nya sociala Funktioner:: chatta med vänner, skriv inlägg på deras loggar, ge statusuppdateringar, och skapa kompislistor.

• Skicka dina simmar till en kompis spel och låt din kompis simmar komma till ditt spel!

• Skapa en egen lokal! Bygg ett vräkigt konserthus, en massiv arena eller en indieklubb. Hur scenen är uppbyggd kommer att påverka din sims framträdande och karriärutveckling."
17b5bb5c-f59c-45c8-8d1b-fe1b488001d8,"The Sims™ 3 Övernaturligt Expansionspaket","Anamma det övernaturliga i en helt ny värld full av magi, mystik och rackartyg. Skapa häxor, vampyrer, älvor eller varulvar direkt från början. Varje övernaturlig sim har nya underliga egenskaper och förmågor som gör deras liv roligare och mer stimulerande för dem och omvärlden. Använd din trollstav för att kasta besvärjelser eller samla ingredienser och blanda dussintals elixir som förstärker spelupplevelsen. Du kan förvandla simmar till zombies eller ge din sim ett gyllene grepp. Dela med dig av dina trolldrycker till kompisar som har The Sims 3. Utforska den helt nya staden Moonlight Falls där dina simmars speciella krafter förstärks av måncykeln – och överraskningar lurar bakom varje hörn. Spelinnehåll: • Spela som övernaturliga simmar: Skapa häxor, häxmästare, varulvar, mer spännande vampyrer och älvor - var och en med egna magiska färdigheter, egenskaper och interaktioner. • Utforska staden Moonlight Falls: Avslöja de mysterier och krafter som dyker upp i fullmånens ljus. Blir din sim galen eller mer kraftfull? • Finslipa dina magiska konster och dela med dig av förtrollningen: Lär dig att kasta besvärjelser och hitta sällsynta ingredienser för att brygga elixir så att du kan förtrolla eller förhäxa dina simmars liv. Skicka dina magiska elixir i spelet till dina kompisar som också har The Sims 3. Dina simmar kan finslipa sina mentala krafter och göra karriär som siare. • Upptäck övernaturliga föremål: Susa runt i arenan på din kvast, besök zigenarvagnen eller kråma dig framför din magiska spegel. Du kan till och med väcka liv i den klassiska figuren Benhilda, det knasiga skeletthembiträdet. Med massor av nya förtrollande föremål vet man aldrig vad som händer härnäst? • Smycka ditt hem i äkta gothstil: Bygg en hemlig håla med en skjutdörr i form av en bokhylla och fyll ditt hem med nya läskiga möbler. • Zombiefiering: Blanda ett specialelixir för att skapa dina egna stapplande, hjärnsugna monster. Tugga på andra simmar för att sprida kärleken och skapa kaos. Var inte orolig, du kan alltid koka ihop ett annat elixir för att göra simmarna normala igen."
e9b7bf6b-8271-46fe-87c0-a1e164ec874e,"The Sims™ Stadsliv Prylpaket","Nytt spännande Funktioner: som aldrig tidigare skådats i ett prylpaket. The Sims™ 3 Stadsliv Prylpaket* presenterar helt nya lokaler som ger dina simmars stad en makeover – med föremål som passar lika bra i deras hem. Bygg ett elegant bibliotek, skapa ett exklusivt, toppmodernt gym, designa en rolig lekplats eller gör det enkelt att ta hand om hushållsgörat med en fräsch tvättstuga. The Sims 3 Stadsliv Prylpaket ger dig inte bara massor av nya inspirerande föremål att använda i hemmet, utan Funktioner:er även nya allmänna lokaler som dina simmar kan besöka, till exempel Caféet Smaskiga Småkakor!* Kräver The Sims 3 för att kunna spelasFunktioner:• Färdiga lokaler och tomter -Ge dina simmars stad en ny look med spektakulära färdiga lokaler och allmänna tomter—eller skapa egna häftiga miljöer.• Fräsch och i form - Träna med den senaste högteknologiska gymutrustningen och tvätta dina svettiga gymkläder med en toppmodern tvättmaskin och torktumlare.• Dags att varva ner - Barnen älskar Solstugans nya djungelgym, rutschkana och sandlåda, medan de vuxna spelar schack vid den nya fontänen.• Pluggdags eller sagodags - Uppdatera biblioteket med ett elegant utbud av accessoarer. Bygg ditt eget arbetsrum eller skapa bås med speciella sektionssäten.• Nya fritidskläder och frisyrer - Kläder att springa ärenden, bara hänga eller träna i—det finns massor av stilar för alla dina simmars modebehov."
237735a0-09b8-4827-bb27-443be319dce2,"The Sims™ 3 Universitetsliv","Universitetet är en plats för inlärning och experimenterande. Nu kan dina simmar skapa sina egna campusminnen och vara med om saker som formar deras öden! Valet av ett huvudämne är början på en utbildning som betalar sig efter universitetstiden, med bättre ingångsjobb och snabbare befordringar.  Men det handlar inte bara om att plugga ... dina simmar vill ha kul också! Fester i studentkorridoren och vid lägereldar är ett bra sätt att lätta på trycket, och det är ingen hejd på vad de kan hitta på. Ett medlemskap i en känd social grupp kan också öppna helt nya vägar till framgång.  Vare sig de skriver inlägg på sociala medier via en smartphone, leder en demonstration på campus eller forskar fram nya vetenskapliga upptäckter, så hittar ambitiösa simmar mycket att sysselsätta sig med i Universitetsliv! UTVALT INNEHÅLL:  • Huvudämnet på spiken: Varje huvudämne har speciella simfördelar. Lek med ett anatomiskt korrekt skelett när du läser forskning och medicin, eller sänd radioprogram när du väljer kommunikation som huvudämne.  • Bli den stora simmen på campus: Ett medlemskap i en framträdande social grupp – sportfånar, nördar eller rebeller – kan leda till unika specialjobb: idrottsagent, TV-spelsutvecklare och konstvärderare. Men din sim får jobba hårt för att nå toppen.  • Förhalningsmästaren: Den kringliggande staden har massor av underhållning och saker att utforska. Ta en fika på Mörkrostade Bönans kafé eller bråka om superkrafter på Stoffes Serier. Vad som helst bara du slipper plugga."
5c60cac9-fb35-45e8-a916-234d2b572e91,"The Sims™ 3 Destination Världen Expansionspaket","Ta med dina simmar på deras livs äventyr med The Sims™ 3 Destination Världen. Led dina simmar mot hyllade framgångar — eller potentiell undergång. Ta med dina simmar till exotiska resmål på jakt efter försvunna skatter. Upptäck nya färdigheter, upplev nya personlighetsdrag och spelarbelöningar, om dina simmar lyckas. Utforska forntida gravar i Egyptens pyramider, bemästra kampsport i Fjärran Östern och upptäck en rik kultur och berömda landmärken i Frankrike. Äventyren hägrar i fjärran — vad kommer dina simmar att upptäcka?Funktioner:• Anta utmaningar, hitta skatter, upptäck vad som lurar i gömda grottor och mycket mer.• Utforska berömda landmärken i Kina, Egypten och Frankrike.• Lär dig nya färdigheter som fotografering och få nya möjligheter. • Möt nya simmar från exotiska platser och ta del av deras kulturer. • Anpassa dina simmars hem med nya stilar & artefakter från deras äventyr. • Få 1000 SimPoints till The Sims 3 Store utan avgift och extra onlineFunktioner: som meddelas senare."
295f43ef-8cc5-423b-9ea8-20cef3855756,"The Sims™ 4","Enjoy the power to create and control people in a virtual world where there are no rules. Express your creativity as you customize your Sims’ distinct appearances and unique personalities. Choose their fashions, select their hairstyles, and give them life aspirations. Effortlessly build your Sims the perfect homes with the all-new room-based Build Mode, choosing your favorite designs and décor. Develop your Sims’ relationships, pursue new careers, and shape the rich and entertaining moments of their lives. Explore beautiful worlds with unique environments and travel to neighborhoods where you can visit venues and meet other interesting Sims. Be powerful and free, have fun, and play with life!

Create Unique Sims Create a variety of unique Sims with distinct appearances, big personalities, and all-new emotions. Sculpt your Sims’ body shape using the powerful new Create A Sim tool then choose their hairstyles, walk-styles, and fashions. Give their lives purpose by selecting their traits and aspirations that give you control over their mind, body, and heart.

Build the Perfect Home Effortlessly build and design homes for your Sims using the new room-based Build Mode. Construct the home of your dreams by designing its layout, choosing its furnishings, and altering the landscape. You can even add a pool or basement!

Explore Vibrant Worlds Travel between worlds, explore unique neighborhoods, and discover interesting venues. Your Sims can visit new communities to expand their social circle, hangout with friends in parks, or find and collect fun new objects. 

Play with Life Control the rich and entertaining moments of your Sims’ lives from their relationships to their careers. Your choices shape every aspect of their lives from birth, to being a toddler, and into adulthood. Develop your Sims’ skills and pursue new hobbies.

Add New Experiences The all-new Gallery gives you the power to discover amazing community content to add to your game, or share your own creations with the world. Download, like, and comment on your favorite Sims, complete homes, and fully designed rooms."
3f4949b9-f6e9-485c-b438-356ee82e310e,"The Sims™ 4 + Hundar & Katter Bundle","Du får The Sims 4, The Sims 4 Hundar & Katter och The Sims 4 Digital Deluxe-innehållet i en fantastisk samling! Du styr skapandet av unika simmar, bygger enkelt deras hus och utforskar livfulla världar. Lägg till hundar och katter i simmarnas hem, och förändra deras liv för alltid, eller ta hand om kvarterets husdjur som en veterinär.
UTVALT INNEHÅLL
The Sims 4.  Få kraften att skapa och styra folk i en virtuell värld där det är dina regler som gäller. Få utlopp för din kreativitet när du anpassar simmarnas utseenden och personligheter, och bygger perfekta hus åt dem. Utveckla simmarnas relationer, skaffa karriärer och utforska nya livliga världar.
The Sims 4 Hundar & Katter Expansion Pack.  Skapa en mängd olika hundar, katter, valpar och kattungar, genom att anpassa deras päls och ge dem egna personligheter. Upplev kamratskapet och glädjen som lurviga kompisar tillför dina simmars liv och bygg en veterinärklinik för att göra karriär som stadens mest lovande djurdoktor.
The Sims 4 Digital Deluxe-innehåll.  Uppgradera din upplevelse med innehåll som gör simmarna till festens höjdpunkt! Innehåller det digitala innehållet Festens höjdpunkt och Uppesittarkväll, samt det digitala ljudspåret till The Sims 4."
5a8c644d-2fc3-4ce8-aca4-7c8eea87cb28,"The Sims™ 4 Bundle - Dags att jobba, Vildmarken, Lyxigt & Festligt","Lägg till fler sätt att spela till ett bra pris med The Sims™ 4 Bundle som innehåller 1 Expansion Pack, 1 Game Pack och 1 Stuff Pack. Bestäm på jobbet med nya spännande karriärer, ta med dina simmar på camping i ett helt nytt resmål, och ordna en lyxig fest.
UTVALT INNEHÅLL
Lägg till fler sätt att spela. Innehåller The Sims™ 4 Dags att jobba Expansion Pack, The Sims™ 4 Vildmarken Game Pack och The Sims™ 4 Lyxigt & Festligt Stuff Pack.
The Sims™ 4 Dags att jobba. Du bestämmer på jobbet! Styr dina simmar aktivt medan de är på jobbet och bestäm om de ska tillbringa sina dagar med att rädda liv som en djärv doktor, lösa brott som en orädd kriminalare, bygga uppfinningar som en galen vetenskapsman eller starta en egen butik och försöka bli simdalerjonärer.
The Sims™ 4 Vildmarken. Ta med dina simmar på en campingtur och utforska det helt nya resmålet Granite Falls. Ge dig ut i den djupa skogen och upptäck nya överraskningar, som makalösa örter, nya fiskarter, krypande insekter och – björnar?
The Sims™ 4 Lyxigt & Festligt. Ordna en lyxig fest med en massa extravaganta dekorationer. Uppgradera dina simmars garderober med praktfulla klänningar och eleganta finkläder. Med det helt nya buffébordet kan du välja vilka läckra rätter du ska servera dina simmar och sätta ihop den perfekta bordsdekorationen för varje tillfälle."
5a3569e0-3229-4998-b091-bcccd85416bf,"The Sims™ 4 Coola köksprylar","Förvandla din sims kök och ge det en modern känsla med stilrena apparater i rosfritt stål plus nya möbler för gourmeter. Upptäck de delikata smakerna din sim skapar med glassmaskinen! Dessutom kommer dina simmar se riktigt aptitliga ut i sina nya frisyrer och kläder. 
UTVALT INNEHÅLL
Vispa ihop något skoj med den nya glassmaskinen. Alla älskar glass och den nya glassmaskinen klarar allt! Ta en våffla med några kulor, lite mjukglass eller en sorbet. Lägg sedan till bananskivor, vispgrädde, strössel och chokladsås – mums!
Ge köket en ny fräsch look. Skapa ett gourmetkök med rostfria vitvaror, skåp med frostat glas med mera. Köket är värdigt en mästerkock, även om dina simmar helst mikrar sina måltider.
Aptitretande stil. Dina simmar är redo att bli serverade lite mode! Uppdatera dina simmars utseenden med nya frisyrer och trendiga, vardagskläder."
